{
  "address": "0xCf7Ed3AccA5a467e9e704C703E8D87F634fB0Fc9",
  "abi": [
    {
      "inputs": [
        {
          "internalType": "address",
          "name": "_factory",
          "type": "address"
        },
        {
          "internalType": "address",
          "name": "_WETH",
          "type": "address"
        }
      ],
      "stateMutability": "nonpayable",
      "type": "constructor"
    },
    {
      "inputs": [],
      "name": "WETH",
      "outputs": [
        {
          "internalType": "address",
          "name": "",
          "type": "address"
        }
      ],
      "stateMutability": "view",
      "type": "function"
    },
    {
      "inputs": [
        {
          "internalType": "address",
          "name": "pair",
          "type": "address"
        },
        {
          "internalType": "address",
          "name": "tokenA",
          "type": "address"
        },
        {
          "internalType": "address",
          "name": "tokenB",
          "type": "address"
        },
        {
          "internalType": "uint256",
          "name": "amountADesired",
          "type": "uint256"
        },
        {
          "internalType": "uint256",
          "name": "amountBDesired",
          "type": "uint256"
        },
        {
          "internalType": "uint256",
          "name": "amountAMin",
          "type": "uint256"
        },
        {
          "internalType": "uint256",
          "name": "amountBMin",
          "type": "uint256"
        },
        {
          "internalType": "address",
          "name": "to",
          "type": "address"
        },
        {
          "internalType": "uint256",
          "name": "deadline",
          "type": "uint256"
        }
      ],
      "name": "addLiquidity",
      "outputs": [
        {
          "internalType": "uint256",
          "name": "amountA",
          "type": "uint256"
        },
        {
          "internalType": "uint256",
          "name": "amountB",
          "type": "uint256"
        },
        {
          "internalType": "uint256",
          "name": "liquidity",
          "type": "uint256"
        }
      ],
      "stateMutability": "nonpayable",
      "type": "function"
    },
    {
      "inputs": [
        {
          "internalType": "address",
          "name": "pair",
          "type": "address"
        },
        {
          "internalType": "address",
          "name": "token",
          "type": "address"
        },
        {
          "internalType": "uint256",
          "name": "amountTokenDesired",
          "type": "uint256"
        },
        {
          "internalType": "uint256",
          "name": "amountTokenMin",
          "type": "uint256"
        },
        {
          "internalType": "uint256",
          "name": "amountETHMin",
          "type": "uint256"
        },
        {
          "internalType": "address",
          "name": "to",
          "type": "address"
        },
        {
          "internalType": "uint256",
          "name": "deadline",
          "type": "uint256"
        }
      ],
      "name": "addLiquidityETH",
      "outputs": [
        {
          "internalType": "uint256",
          "name": "amountToken",
          "type": "uint256"
        },
        {
          "internalType": "uint256",
          "name": "amountETH",
          "type": "uint256"
        },
        {
          "internalType": "uint256",
          "name": "liquidity",
          "type": "uint256"
        }
      ],
      "stateMutability": "payable",
      "type": "function"
    },
    {
      "inputs": [
        {
          "internalType": "address",
          "name": "tokenA",
          "type": "address"
        },
        {
          "internalType": "address",
          "name": "tokenB",
          "type": "address"
        },
        {
          "internalType": "uint256",
          "name": "amountA",
          "type": "uint256"
        },
        {
          "internalType": "uint256",
          "name": "amountB",
          "type": "uint256"
        },
        {
          "internalType": "uint32",
          "name": "tokenWeightA",
          "type": "uint32"
        },
        {
          "internalType": "uint32",
          "name": "swapFee",
          "type": "uint32"
        },
        {
          "internalType": "address",
          "name": "to",
          "type": "address"
        }
      ],
      "name": "createPair",
      "outputs": [
        {
          "internalType": "uint256",
          "name": "liquidity",
          "type": "uint256"
        }
      ],
      "stateMutability": "nonpayable",
      "type": "function"
    },
    {
      "inputs": [
        {
          "internalType": "address",
          "name": "token",
          "type": "address"
        },
        {
          "internalType": "uint256",
          "name": "amountToken",
          "type": "uint256"
        },
        {
          "internalType": "uint32",
          "name": "tokenWeight",
          "type": "uint32"
        },
        {
          "internalType": "uint32",
          "name": "swapFee",
          "type": "uint32"
        },
        {
          "internalType": "address",
          "name": "to",
          "type": "address"
        }
      ],
      "name": "createPairETH",
      "outputs": [
        {
          "internalType": "uint256",
          "name": "liquidity",
          "type": "uint256"
        }
      ],
      "stateMutability": "payable",
      "type": "function"
    },
    {
      "inputs": [],
      "name": "factory",
      "outputs": [
        {
          "internalType": "address",
          "name": "",
          "type": "address"
        }
      ],
      "stateMutability": "view",
      "type": "function"
    },
    {
      "inputs": [],
      "name": "formula",
      "outputs": [
        {
          "internalType": "address",
          "name": "",
          "type": "address"
        }
      ],
      "stateMutability": "view",
      "type": "function"
    },
    {
      "inputs": [
        {
          "internalType": "address",
          "name": "pair",
          "type": "address"
        },
        {
          "internalType": "address",
          "name": "tokenA",
          "type": "address"
        },
        {
          "internalType": "address",
          "name": "tokenB",
          "type": "address"
        },
        {
          "internalType": "uint256",
          "name": "liquidity",
          "type": "uint256"
        },
        {
          "internalType": "uint256",
          "name": "amountAMin",
          "type": "uint256"
        },
        {
          "internalType": "uint256",
          "name": "amountBMin",
          "type": "uint256"
        },
        {
          "internalType": "address",
          "name": "to",
          "type": "address"
        },
        {
          "internalType": "uint256",
          "name": "deadline",
          "type": "uint256"
        }
      ],
      "name": "removeLiquidity",
      "outputs": [
        {
          "internalType": "uint256",
          "name": "amountA",
          "type": "uint256"
        },
        {
          "internalType": "uint256",
          "name": "amountB",
          "type": "uint256"
        }
      ],
      "stateMutability": "nonpayable",
      "type": "function"
    },
    {
      "inputs": [
        {
          "internalType": "address",
          "name": "pair",
          "type": "address"
        },
        {
          "internalType": "address",
          "name": "token",
          "type": "address"
        },
        {
          "internalType": "uint256",
          "name": "liquidity",
          "type": "uint256"
        },
        {
          "internalType": "uint256",
          "name": "amountTokenMin",
          "type": "uint256"
        },
        {
          "internalType": "uint256",
          "name": "amountETHMin",
          "type": "uint256"
        },
        {
          "internalType": "address",
          "name": "to",
          "type": "address"
        },
        {
          "internalType": "uint256",
          "name": "deadline",
          "type": "uint256"
        }
      ],
      "name": "removeLiquidityETH",
      "outputs": [
        {
          "internalType": "uint256",
          "name": "amountToken",
          "type": "uint256"
        },
        {
          "internalType": "uint256",
          "name": "amountETH",
          "type": "uint256"
        }
      ],
      "stateMutability": "nonpayable",
      "type": "function"
    },
    {
      "inputs": [
        {
          "internalType": "address",
          "name": "pair",
          "type": "address"
        },
        {
          "internalType": "address",
          "name": "token",
          "type": "address"
        },
        {
          "internalType": "uint256",
          "name": "liquidity",
          "type": "uint256"
        },
        {
          "internalType": "uint256",
          "name": "amountTokenMin",
          "type": "uint256"
        },
        {
          "internalType": "uint256",
          "name": "amountETHMin",
          "type": "uint256"
        },
        {
          "internalType": "address",
          "name": "to",
          "type": "address"
        },
        {
          "internalType": "uint256",
          "name": "deadline",
          "type": "uint256"
        }
      ],
      "name": "removeLiquidityETHSupportingFeeOnTransferTokens",
      "outputs": [
        {
          "internalType": "uint256",
          "name": "amountETH",
          "type": "uint256"
        }
      ],
      "stateMutability": "nonpayable",
      "type": "function"
    },
    {
      "inputs": [
        {
          "internalType": "address",
          "name": "pair",
          "type": "address"
        },
        {
          "internalType": "address",
          "name": "token",
          "type": "address"
        },
        {
          "internalType": "uint256",
          "name": "liquidity",
          "type": "uint256"
        },
        {
          "internalType": "uint256",
          "name": "amountTokenMin",
          "type": "uint256"
        },
        {
          "internalType": "uint256",
          "name": "amountETHMin",
          "type": "uint256"
        },
        {
          "internalType": "address",
          "name": "to",
          "type": "address"
        },
        {
          "internalType": "uint256",
          "name": "deadline",
          "type": "uint256"
        },
        {
          "internalType": "bool",
          "name": "approveMax",
          "type": "bool"
        },
        {
          "internalType": "uint8",
          "name": "v",
          "type": "uint8"
        },
        {
          "internalType": "bytes32",
          "name": "r",
          "type": "bytes32"
        },
        {
          "internalType": "bytes32",
          "name": "s",
          "type": "bytes32"
        }
      ],
      "name": "removeLiquidityETHWithPermit",
      "outputs": [
        {
          "internalType": "uint256",
          "name": "amountToken",
          "type": "uint256"
        },
        {
          "internalType": "uint256",
          "name": "amountETH",
          "type": "uint256"
        }
      ],
      "stateMutability": "nonpayable",
      "type": "function"
    },
    {
      "inputs": [
        {
          "internalType": "address",
          "name": "pair",
          "type": "address"
        },
        {
          "internalType": "address",
          "name": "token",
          "type": "address"
        },
        {
          "internalType": "uint256",
          "name": "liquidity",
          "type": "uint256"
        },
        {
          "internalType": "uint256",
          "name": "amountTokenMin",
          "type": "uint256"
        },
        {
          "internalType": "uint256",
          "name": "amountETHMin",
          "type": "uint256"
        },
        {
          "internalType": "address",
          "name": "to",
          "type": "address"
        },
        {
          "internalType": "uint256",
          "name": "deadline",
          "type": "uint256"
        },
        {
          "internalType": "bool",
          "name": "approveMax",
          "type": "bool"
        },
        {
          "internalType": "uint8",
          "name": "v",
          "type": "uint8"
        },
        {
          "internalType": "bytes32",
          "name": "r",
          "type": "bytes32"
        },
        {
          "internalType": "bytes32",
          "name": "s",
          "type": "bytes32"
        }
      ],
      "name": "removeLiquidityETHWithPermitSupportingFeeOnTransferTokens",
      "outputs": [
        {
          "internalType": "uint256",
          "name": "amountETH",
          "type": "uint256"
        }
      ],
      "stateMutability": "nonpayable",
      "type": "function"
    },
    {
      "inputs": [
        {
          "internalType": "address",
          "name": "pair",
          "type": "address"
        },
        {
          "internalType": "address",
          "name": "tokenA",
          "type": "address"
        },
        {
          "internalType": "address",
          "name": "tokenB",
          "type": "address"
        },
        {
          "internalType": "uint256",
          "name": "liquidity",
          "type": "uint256"
        },
        {
          "internalType": "uint256",
          "name": "amountAMin",
          "type": "uint256"
        },
        {
          "internalType": "uint256",
          "name": "amountBMin",
          "type": "uint256"
        },
        {
          "internalType": "address",
          "name": "to",
          "type": "address"
        },
        {
          "internalType": "uint256",
          "name": "deadline",
          "type": "uint256"
        },
        {
          "internalType": "bool",
          "name": "approveMax",
          "type": "bool"
        },
        {
          "internalType": "uint8",
          "name": "v",
          "type": "uint8"
        },
        {
          "internalType": "bytes32",
          "name": "r",
          "type": "bytes32"
        },
        {
          "internalType": "bytes32",
          "name": "s",
          "type": "bytes32"
        }
      ],
      "name": "removeLiquidityWithPermit",
      "outputs": [
        {
          "internalType": "uint256",
          "name": "amountA",
          "type": "uint256"
        },
        {
          "internalType": "uint256",
          "name": "amountB",
          "type": "uint256"
        }
      ],
      "stateMutability": "nonpayable",
      "type": "function"
    },
    {
      "stateMutability": "payable",
      "type": "receive"
    }
  ],
  "transactionHash": "0xeb8050477ca4353b34045a6db9fbb4f72194cf714d5293dc1847fff70c9f7709",
  "receipt": {
    "to": null,
    "from": "0xf39Fd6e51aad88F6F4ce6aB8827279cffFb92266",
    "contractAddress": "0xCf7Ed3AccA5a467e9e704C703E8D87F634fB0Fc9",
    "transactionIndex": 0,
    "gasUsed": "1716842",
    "logsBloom": "0x00000000000000000000000000000000000000000000000000000000000000000000000000000000000000000000000000000000000000000000000000000000000000000000000000000000000000000000000000000000000000000000000000000000000000000000000000000000000000000000000000000000000000000000000000000000000000000000000000000000000000000000000000000000000000000000000000000000000000000000000000000000000000000000000000000000000000000000000000000000000000000000000000000000000000000000000000000000000000000000000000000000000000000000000000000000",
    "blockHash": "0xfec638133e16c32172492ecd570c759899b35722a563a6bab8e964b50611f491",
    "transactionHash": "0xeb8050477ca4353b34045a6db9fbb4f72194cf714d5293dc1847fff70c9f7709",
    "logs": [],
    "blockNumber": 4,
    "cumulativeGasUsed": "1716842",
    "status": 1,
    "byzantium": true
  },
  "args": [
    "0x9fE46736679d2D9a65F0992F2272dE9f3c7fa6e0",
    "0x5FbDB2315678afecb367f032d93F642f64180aa3"
  ],
  "solcInputHash": "08bc38f2be58ca0a7ada3897e4e74e75",
  "metadata": "{\"compiler\":{\"version\":\"0.8.11+commit.d7f03943\"},\"language\":\"Solidity\",\"output\":{\"abi\":[{\"inputs\":[{\"internalType\":\"address\",\"name\":\"_factory\",\"type\":\"address\"},{\"internalType\":\"address\",\"name\":\"_WETH\",\"type\":\"address\"}],\"stateMutability\":\"nonpayable\",\"type\":\"constructor\"},{\"inputs\":[],\"name\":\"WETH\",\"outputs\":[{\"internalType\":\"address\",\"name\":\"\",\"type\":\"address\"}],\"stateMutability\":\"view\",\"type\":\"function\"},{\"inputs\":[{\"internalType\":\"address\",\"name\":\"pair\",\"type\":\"address\"},{\"internalType\":\"address\",\"name\":\"tokenA\",\"type\":\"address\"},{\"internalType\":\"address\",\"name\":\"tokenB\",\"type\":\"address\"},{\"internalType\":\"uint256\",\"name\":\"amountADesired\",\"type\":\"uint256\"},{\"internalType\":\"uint256\",\"name\":\"amountBDesired\",\"type\":\"uint256\"},{\"internalType\":\"uint256\",\"name\":\"amountAMin\",\"type\":\"uint256\"},{\"internalType\":\"uint256\",\"name\":\"amountBMin\",\"type\":\"uint256\"},{\"internalType\":\"address\",\"name\":\"to\",\"type\":\"address\"},{\"internalType\":\"uint256\",\"name\":\"deadline\",\"type\":\"uint256\"}],\"name\":\"addLiquidity\",\"outputs\":[{\"internalType\":\"uint256\",\"name\":\"amountA\",\"type\":\"uint256\"},{\"internalType\":\"uint256\",\"name\":\"amountB\",\"type\":\"uint256\"},{\"internalType\":\"uint256\",\"name\":\"liquidity\",\"type\":\"uint256\"}],\"stateMutability\":\"nonpayable\",\"type\":\"function\"},{\"inputs\":[{\"internalType\":\"address\",\"name\":\"pair\",\"type\":\"address\"},{\"internalType\":\"address\",\"name\":\"token\",\"type\":\"address\"},{\"internalType\":\"uint256\",\"name\":\"amountTokenDesired\",\"type\":\"uint256\"},{\"internalType\":\"uint256\",\"name\":\"amountTokenMin\",\"type\":\"uint256\"},{\"internalType\":\"uint256\",\"name\":\"amountETHMin\",\"type\":\"uint256\"},{\"internalType\":\"address\",\"name\":\"to\",\"type\":\"address\"},{\"internalType\":\"uint256\",\"name\":\"deadline\",\"type\":\"uint256\"}],\"name\":\"addLiquidityETH\",\"outputs\":[{\"internalType\":\"uint256\",\"name\":\"amountToken\",\"type\":\"uint256\"},{\"internalType\":\"uint256\",\"name\":\"amountETH\",\"type\":\"uint256\"},{\"internalType\":\"uint256\",\"name\":\"liquidity\",\"type\":\"uint256\"}],\"stateMutability\":\"payable\",\"type\":\"function\"},{\"inputs\":[{\"internalType\":\"address\",\"name\":\"tokenA\",\"type\":\"address\"},{\"internalType\":\"address\",\"name\":\"tokenB\",\"type\":\"address\"},{\"internalType\":\"uint256\",\"name\":\"amountA\",\"type\":\"uint256\"},{\"internalType\":\"uint256\",\"name\":\"amountB\",\"type\":\"uint256\"},{\"internalType\":\"uint32\",\"name\":\"tokenWeightA\",\"type\":\"uint32\"},{\"internalType\":\"uint32\",\"name\":\"swapFee\",\"type\":\"uint32\"},{\"internalType\":\"address\",\"name\":\"to\",\"type\":\"address\"}],\"name\":\"createPair\",\"outputs\":[{\"internalType\":\"uint256\",\"name\":\"liquidity\",\"type\":\"uint256\"}],\"stateMutability\":\"nonpayable\",\"type\":\"function\"},{\"inputs\":[{\"internalType\":\"address\",\"name\":\"token\",\"type\":\"address\"},{\"internalType\":\"uint256\",\"name\":\"amountToken\",\"type\":\"uint256\"},{\"internalType\":\"uint32\",\"name\":\"tokenWeight\",\"type\":\"uint32\"},{\"internalType\":\"uint32\",\"name\":\"swapFee\",\"type\":\"uint32\"},{\"internalType\":\"address\",\"name\":\"to\",\"type\":\"address\"}],\"name\":\"createPairETH\",\"outputs\":[{\"internalType\":\"uint256\",\"name\":\"liquidity\",\"type\":\"uint256\"}],\"stateMutability\":\"payable\",\"type\":\"function\"},{\"inputs\":[],\"name\":\"factory\",\"outputs\":[{\"internalType\":\"address\",\"name\":\"\",\"type\":\"address\"}],\"stateMutability\":\"view\",\"type\":\"function\"},{\"inputs\":[],\"name\":\"formula\",\"outputs\":[{\"internalType\":\"address\",\"name\":\"\",\"type\":\"address\"}],\"stateMutability\":\"view\",\"type\":\"function\"},{\"inputs\":[{\"internalType\":\"address\",\"name\":\"pair\",\"type\":\"address\"},{\"internalType\":\"address\",\"name\":\"tokenA\",\"type\":\"address\"},{\"internalType\":\"address\",\"name\":\"tokenB\",\"type\":\"address\"},{\"internalType\":\"uint256\",\"name\":\"liquidity\",\"type\":\"uint256\"},{\"internalType\":\"uint256\",\"name\":\"amountAMin\",\"type\":\"uint256\"},{\"internalType\":\"uint256\",\"name\":\"amountBMin\",\"type\":\"uint256\"},{\"internalType\":\"address\",\"name\":\"to\",\"type\":\"address\"},{\"internalType\":\"uint256\",\"name\":\"deadline\",\"type\":\"uint256\"}],\"name\":\"removeLiquidity\",\"outputs\":[{\"internalType\":\"uint256\",\"name\":\"amountA\",\"type\":\"uint256\"},{\"internalType\":\"uint256\",\"name\":\"amountB\",\"type\":\"uint256\"}],\"stateMutability\":\"nonpayable\",\"type\":\"function\"},{\"inputs\":[{\"internalType\":\"address\",\"name\":\"pair\",\"type\":\"address\"},{\"internalType\":\"address\",\"name\":\"token\",\"type\":\"address\"},{\"internalType\":\"uint256\",\"name\":\"liquidity\",\"type\":\"uint256\"},{\"internalType\":\"uint256\",\"name\":\"amountTokenMin\",\"type\":\"uint256\"},{\"internalType\":\"uint256\",\"name\":\"amountETHMin\",\"type\":\"uint256\"},{\"internalType\":\"address\",\"name\":\"to\",\"type\":\"address\"},{\"internalType\":\"uint256\",\"name\":\"deadline\",\"type\":\"uint256\"}],\"name\":\"removeLiquidityETH\",\"outputs\":[{\"internalType\":\"uint256\",\"name\":\"amountToken\",\"type\":\"uint256\"},{\"internalType\":\"uint256\",\"name\":\"amountETH\",\"type\":\"uint256\"}],\"stateMutability\":\"nonpayable\",\"type\":\"function\"},{\"inputs\":[{\"internalType\":\"address\",\"name\":\"pair\",\"type\":\"address\"},{\"internalType\":\"address\",\"name\":\"token\",\"type\":\"address\"},{\"internalType\":\"uint256\",\"name\":\"liquidity\",\"type\":\"uint256\"},{\"internalType\":\"uint256\",\"name\":\"amountTokenMin\",\"type\":\"uint256\"},{\"internalType\":\"uint256\",\"name\":\"amountETHMin\",\"type\":\"uint256\"},{\"internalType\":\"address\",\"name\":\"to\",\"type\":\"address\"},{\"internalType\":\"uint256\",\"name\":\"deadline\",\"type\":\"uint256\"}],\"name\":\"removeLiquidityETHSupportingFeeOnTransferTokens\",\"outputs\":[{\"internalType\":\"uint256\",\"name\":\"amountETH\",\"type\":\"uint256\"}],\"stateMutability\":\"nonpayable\",\"type\":\"function\"},{\"inputs\":[{\"internalType\":\"address\",\"name\":\"pair\",\"type\":\"address\"},{\"internalType\":\"address\",\"name\":\"token\",\"type\":\"address\"},{\"internalType\":\"uint256\",\"name\":\"liquidity\",\"type\":\"uint256\"},{\"internalType\":\"uint256\",\"name\":\"amountTokenMin\",\"type\":\"uint256\"},{\"internalType\":\"uint256\",\"name\":\"amountETHMin\",\"type\":\"uint256\"},{\"internalType\":\"address\",\"name\":\"to\",\"type\":\"address\"},{\"internalType\":\"uint256\",\"name\":\"deadline\",\"type\":\"uint256\"},{\"internalType\":\"bool\",\"name\":\"approveMax\",\"type\":\"bool\"},{\"internalType\":\"uint8\",\"name\":\"v\",\"type\":\"uint8\"},{\"internalType\":\"bytes32\",\"name\":\"r\",\"type\":\"bytes32\"},{\"internalType\":\"bytes32\",\"name\":\"s\",\"type\":\"bytes32\"}],\"name\":\"removeLiquidityETHWithPermit\",\"outputs\":[{\"internalType\":\"uint256\",\"name\":\"amountToken\",\"type\":\"uint256\"},{\"internalType\":\"uint256\",\"name\":\"amountETH\",\"type\":\"uint256\"}],\"stateMutability\":\"nonpayable\",\"type\":\"function\"},{\"inputs\":[{\"internalType\":\"address\",\"name\":\"pair\",\"type\":\"address\"},{\"internalType\":\"address\",\"name\":\"token\",\"type\":\"address\"},{\"internalType\":\"uint256\",\"name\":\"liquidity\",\"type\":\"uint256\"},{\"internalType\":\"uint256\",\"name\":\"amountTokenMin\",\"type\":\"uint256\"},{\"internalType\":\"uint256\",\"name\":\"amountETHMin\",\"type\":\"uint256\"},{\"internalType\":\"address\",\"name\":\"to\",\"type\":\"address\"},{\"internalType\":\"uint256\",\"name\":\"deadline\",\"type\":\"uint256\"},{\"internalType\":\"bool\",\"name\":\"approveMax\",\"type\":\"bool\"},{\"internalType\":\"uint8\",\"name\":\"v\",\"type\":\"uint8\"},{\"internalType\":\"bytes32\",\"name\":\"r\",\"type\":\"bytes32\"},{\"internalType\":\"bytes32\",\"name\":\"s\",\"type\":\"bytes32\"}],\"name\":\"removeLiquidityETHWithPermitSupportingFeeOnTransferTokens\",\"outputs\":[{\"internalType\":\"uint256\",\"name\":\"amountETH\",\"type\":\"uint256\"}],\"stateMutability\":\"nonpayable\",\"type\":\"function\"},{\"inputs\":[{\"internalType\":\"address\",\"name\":\"pair\",\"type\":\"address\"},{\"internalType\":\"address\",\"name\":\"tokenA\",\"type\":\"address\"},{\"internalType\":\"address\",\"name\":\"tokenB\",\"type\":\"address\"},{\"internalType\":\"uint256\",\"name\":\"liquidity\",\"type\":\"uint256\"},{\"internalType\":\"uint256\",\"name\":\"amountAMin\",\"type\":\"uint256\"},{\"internalType\":\"uint256\",\"name\":\"amountBMin\",\"type\":\"uint256\"},{\"internalType\":\"address\",\"name\":\"to\",\"type\":\"address\"},{\"internalType\":\"uint256\",\"name\":\"deadline\",\"type\":\"uint256\"},{\"internalType\":\"bool\",\"name\":\"approveMax\",\"type\":\"bool\"},{\"internalType\":\"uint8\",\"name\":\"v\",\"type\":\"uint8\"},{\"internalType\":\"bytes32\",\"name\":\"r\",\"type\":\"bytes32\"},{\"internalType\":\"bytes32\",\"name\":\"s\",\"type\":\"bytes32\"}],\"name\":\"removeLiquidityWithPermit\",\"outputs\":[{\"internalType\":\"uint256\",\"name\":\"amountA\",\"type\":\"uint256\"},{\"internalType\":\"uint256\",\"name\":\"amountB\",\"type\":\"uint256\"}],\"stateMutability\":\"nonpayable\",\"type\":\"function\"},{\"stateMutability\":\"payable\",\"type\":\"receive\"}],\"devdoc\":{\"kind\":\"dev\",\"methods\":{},\"version\":1},\"userdoc\":{\"kind\":\"user\",\"methods\":{},\"version\":1}},\"settings\":{\"compilationTarget\":{\"contracts/test/RequiemQPairManager_flat.sol\":\"RequiemQPairManager\"},\"evmVersion\":\"london\",\"libraries\":{},\"metadata\":{\"bytecodeHash\":\"ipfs\",\"useLiteralContent\":true},\"optimizer\":{\"enabled\":true,\"runs\":1000},\"remappings\":[]},\"sources\":{\"contracts/test/RequiemQPairManager_flat.sol\":{\"content\":\"// SPDX-License-Identifier: MIT\\n\\n// File: interfaces/IRequiemQPairManager.sol\\n\\npragma solidity ^0.8.11;\\n\\n// solhint-disable func-name-mixedcase\\n\\ninterface IRequiemQPairManager {\\n  function factory() external view returns (address);\\n\\n  function formula() external view returns (address);\\n\\n  function WETH() external view returns (address);\\n\\n  function createPair(\\n    address tokenA,\\n    address tokenB,\\n    uint256 amountA,\\n    uint256 amountB,\\n    uint32 tokenWeightA,\\n    uint32 swapFee,\\n    address to\\n  ) external returns (uint256 liquidity);\\n\\n  function createPairETH(\\n    address token,\\n    uint256 amountToken,\\n    uint32 tokenWeight,\\n    uint32 swapFee,\\n    address to\\n  ) external payable returns (uint256 liquidity);\\n\\n  function addLiquidity(\\n    address pair,\\n    address tokenA,\\n    address tokenB,\\n    uint256 amountADesired,\\n    uint256 amountBDesired,\\n    uint256 amountAMin,\\n    uint256 amountBMin,\\n    address to,\\n    uint256 deadline\\n  )\\n    external\\n    returns (\\n      uint256 amountA,\\n      uint256 amountB,\\n      uint256 liquidity\\n    );\\n\\n  function addLiquidityETH(\\n    address pair,\\n    address token,\\n    uint256 amountTokenDesired,\\n    uint256 amountTokenMin,\\n    uint256 amountETHMin,\\n    address to,\\n    uint256 deadline\\n  )\\n    external\\n    payable\\n    returns (\\n      uint256 amountToken,\\n      uint256 amountETH,\\n      uint256 liquidity\\n    );\\n\\n  function removeLiquidity(\\n    address pair,\\n    address tokenA,\\n    address tokenB,\\n    uint256 liquidity,\\n    uint256 amountAMin,\\n    uint256 amountBMin,\\n    address to,\\n    uint256 deadline\\n  ) external returns (uint256 amountA, uint256 amountB);\\n\\n  function removeLiquidityETH(\\n    address pair,\\n    address token,\\n    uint256 liquidity,\\n    uint256 amountTokenMin,\\n    uint256 amountETHMin,\\n    address to,\\n    uint256 deadline\\n  ) external returns (uint256 amountToken, uint256 amountETH);\\n\\n  function removeLiquidityWithPermit(\\n    address pair,\\n    address tokenA,\\n    address tokenB,\\n    uint256 liquidity,\\n    uint256 amountAMin,\\n    uint256 amountBMin,\\n    address to,\\n    uint256 deadline,\\n    bool approveMax,\\n    uint8 v,\\n    bytes32 r,\\n    bytes32 s\\n  ) external returns (uint256 amountA, uint256 amountB);\\n\\n  function removeLiquidityETHWithPermit(\\n    address pair,\\n    address token,\\n    uint256 liquidity,\\n    uint256 amountTokenMin,\\n    uint256 amountETHMin,\\n    address to,\\n    uint256 deadline,\\n    bool approveMax,\\n    uint8 v,\\n    bytes32 r,\\n    bytes32 s\\n  ) external returns (uint256 amountToken, uint256 amountETH);\\n\\n  function removeLiquidityETHSupportingFeeOnTransferTokens(\\n    address pair,\\n    address token,\\n    uint256 liquidity,\\n    uint256 amountTokenMin,\\n    uint256 amountETHMin,\\n    address to,\\n    uint256 deadline\\n  ) external returns (uint256 amountETH);\\n\\n  function removeLiquidityETHWithPermitSupportingFeeOnTransferTokens(\\n    address pair,\\n    address token,\\n    uint256 liquidity,\\n    uint256 amountTokenMin,\\n    uint256 amountETHMin,\\n    address to,\\n    uint256 deadline,\\n    bool approveMax,\\n    uint8 v,\\n    bytes32 r,\\n    bytes32 s\\n  ) external returns (uint256 amountETH);\\n}\\n\\n// File: interfaces/ERC20/IERC20.sol\\n\\npragma solidity ^0.8.11;\\n\\n/**\\n * @dev Interface of the ERC20 standard as defined in the EIP.\\n */\\ninterface IERC20 {\\n  /**\\n   * @dev Returns the amount of tokens in existence.\\n   */\\n  function totalSupply() external view returns (uint256);\\n\\n  /**\\n   * @dev Returns the amount of tokens owned by `account`.\\n   */\\n  function balanceOf(address account) external view returns (uint256);\\n\\n  /**\\n   * @dev Moves `amount` tokens from the caller's account to `recipient`.\\n   *\\n   * Returns a boolean value indicating whether the operation succeeded.\\n   *\\n   * Emits a {Transfer} event.\\n   */\\n  function transfer(address recipient, uint256 amount) external returns (bool);\\n\\n  /**\\n   * @dev Returns the remaining number of tokens that `spender` will be\\n   * allowed to spend on behalf of `owner` through {transferFrom}. This is\\n   * zero by default.\\n   *\\n   * This value changes when {approve} or {transferFrom} are called.\\n   */\\n  function allowance(address owner, address spender)\\n    external\\n    view\\n    returns (uint256);\\n\\n  /**\\n   * @dev Sets `amount` as the allowance of `spender` over the caller's tokens.\\n   *\\n   * Returns a boolean value indicating whether the operation succeeded.\\n   *\\n   * IMPORTANT: Beware that changing an allowance with this method brings the risk\\n   * that someone may use both the old and the new allowance by unfortunate\\n   * transaction ordering. One possible solution to mitigate this race\\n   * condition is to first reduce the spender's allowance to 0 and set the\\n   * desired value afterwards:\\n   * https://github.com/ethereum/EIPs/issues/20#issuecomment-263524729\\n   *\\n   * Emits an {Approval} event.\\n   */\\n  function approve(address spender, uint256 amount) external returns (bool);\\n\\n  /**\\n   * @dev Moves `amount` tokens from `sender` to `recipient` using the\\n   * allowance mechanism. `amount` is then deducted from the caller's\\n   * allowance.\\n   *\\n   * Returns a boolean value indicating whether the operation succeeded.\\n   *\\n   * Emits a {Transfer} event.\\n   */\\n  function transferFrom(\\n    address sender,\\n    address recipient,\\n    uint256 amount\\n  ) external returns (bool);\\n\\n  /**\\n   * @dev Emitted when `value` tokens are moved from one account (`from`) to\\n   * another (`to`).\\n   *\\n   * Note that `value` may be zero.\\n   */\\n  event Transfer(address indexed from, address indexed to, uint256 value);\\n\\n  /**\\n   * @dev Emitted when the allowance of a `spender` for an `owner` is set by\\n   * a call to {approve}. `value` is the new allowance.\\n   */\\n  event Approval(address indexed owner, address indexed spender, uint256 value);\\n}\\n// File: interfaces/IWETH.sol\\n\\n// This program is free software: you can redistribute it and/or modify\\n// it under the terms of the GNU General Public License as published by\\n// the Free Software Foundation, either version 3 of the License, or\\n// (at your option) any later version.\\n\\n// This program is distributed in the hope that it will be useful,\\n// but WITHOUT ANY WARRANTY; without even the implied warranty of\\n// MERCHANTABILITY or FITNESS FOR A PARTICULAR PURPOSE.  See the\\n// GNU General Public License for more details.\\n\\n// You should have received a copy of the GNU General Public License\\n// along with this program.  If not, see <http://www.gnu.org/licenses/>.\\n\\npragma solidity ^0.8.11;\\n\\n/**\\n * @dev Interface for WETH9.\\n * See https://github.com/gnosis/canonical-weth/blob/0dd1ea3e295eef916d0c6223ec63141137d22d67/contracts/WETH9.sol\\n */\\ninterface IWETH is IERC20 {\\n  function deposit() external payable;\\n\\n  function withdraw(uint256 amount) external;\\n}\\n\\n// File: libraries/TransferHelper.sol\\n\\npragma solidity >=0.8.11;\\n\\n// solhint-disable avoid-low-level-calls, reason-string\\n\\n// helper methods for interacting with ERC20 tokens and sending ETH that do not consistently return true/false\\nlibrary TransferHelper {\\n  function safeApprove(\\n    address token,\\n    address to,\\n    uint256 value\\n  ) internal {\\n    // bytes4(keccak256(bytes(\\\"approve(address,uint256)\\\")));\\n    (bool success, bytes memory data) = token.call(\\n      abi.encodeWithSelector(0x095ea7b3, to, value)\\n    );\\n    require(\\n      success && (data.length == 0 || abi.decode(data, (bool))),\\n      \\\"TransferHelper: APPROVE_FAILED\\\"\\n    );\\n  }\\n\\n  function safeTransfer(\\n    address token,\\n    address to,\\n    uint256 value\\n  ) internal {\\n    // bytes4(keccak256(bytes(\\\"transfer(address,uint256)\\\")));\\n    (bool success, bytes memory data) = token.call(\\n      abi.encodeWithSelector(0xa9059cbb, to, value)\\n    );\\n    require(\\n      success && (data.length == 0 || abi.decode(data, (bool))),\\n      \\\"TransferHelper: TRANSFER_FAILED\\\"\\n    );\\n  }\\n\\n  function safeTransferFrom(\\n    address token,\\n    address from,\\n    address to,\\n    uint256 value\\n  ) internal {\\n    // bytes4(keccak256(bytes(\\\"transferFrom(address,address,uint256)\\\")));\\n    (bool success, bytes memory data) = token.call(\\n      abi.encodeWithSelector(0x23b872dd, from, to, value)\\n    );\\n    require(\\n      success && (data.length == 0 || abi.decode(data, (bool))),\\n      \\\"TransferHelper: TRANSFER_FROM_FAILED\\\"\\n    );\\n  }\\n\\n  function safeTransferETH(address to, uint256 value) internal {\\n    (bool success, ) = to.call{value: value}(new bytes(0));\\n    require(success, \\\"TransferHelper: ETH_TRANSFER_FAILED\\\");\\n  }\\n}\\n\\n// File: interfaces/IRequiemSwap.sol\\n\\npragma solidity ^0.8.11;\\n\\ninterface IRequiemSwap {\\n  // this funtion requires the correctly calculated amounts as input\\n  // the others are supposed to implement that calculation\\n  // no return value required since the amounts are already known\\n  function onSwap(\\n    address tokenIn,\\n    address tokenOut,\\n    uint256 amountIn,\\n    uint256 amountOut,\\n    address to\\n  ) external;\\n\\n  //\\n  function onSwapGivenIn(\\n    address tokenIn,\\n    address tokenOut,\\n    uint256 amountIn,\\n    uint256 amountOutMin,\\n    address to\\n  ) external returns (uint256);\\n\\n  function onSwapGivenOut(\\n    address tokenIn,\\n    address tokenOut,\\n    uint256 amountOut,\\n    uint256 amountInMax,\\n    address to\\n  ) external returns (uint256);\\n\\n  function calculateSwapGivenIn(\\n    address tokenIn,\\n    address tokenOut,\\n    uint256 amountIn\\n  ) external view returns (uint256);\\n\\n  function calculateSwapGivenOut(\\n    address tokenIn,\\n    address tokenOut,\\n    uint256 amountOut\\n  ) external view returns (uint256);\\n}\\n\\n// File: interfaces/IRequiemERC20.sol\\n\\npragma solidity ^0.8.11;\\n\\n// solhint-disable func-name-mixedcase\\n\\ninterface IRequiemERC20 {\\n  event Approval(address indexed owner, address indexed spender, uint256 value);\\n  event Transfer(address indexed from, address indexed to, uint256 value);\\n\\n  function name() external view returns (string memory);\\n\\n  function symbol() external view returns (string memory);\\n\\n  function decimals() external pure returns (uint8);\\n\\n  function totalSupply() external view returns (uint256);\\n\\n  function balanceOf(address owner) external view returns (uint256);\\n\\n  function allowance(address owner, address spender)\\n    external\\n    view\\n    returns (uint256);\\n\\n  function approve(address spender, uint256 value) external returns (bool);\\n\\n  function transfer(address to, uint256 value) external returns (bool);\\n\\n  function transferFrom(\\n    address from,\\n    address to,\\n    uint256 value\\n  ) external returns (bool);\\n\\n  function DOMAIN_SEPARATOR() external view returns (bytes32);\\n\\n  function PERMIT_TYPEHASH() external pure returns (bytes32);\\n\\n  function nonces(address owner) external view returns (uint256);\\n\\n  function permit(\\n    address owner,\\n    address spender,\\n    uint256 value,\\n    uint256 deadline,\\n    uint8 v,\\n    bytes32 r,\\n    bytes32 s\\n  ) external;\\n}\\n\\n// File: interfaces/IRequiemPair.sol\\n\\npragma solidity ^0.8.11;\\n\\n// solhint-disable func-name-mixedcase\\n\\ninterface IRequiemPair is IRequiemERC20 {\\n  event PaidProtocolFee(uint112 collectedFee0, uint112 collectedFee1);\\n  event Mint(address indexed sender, uint256 amount0, uint256 amount1);\\n  event Burn(\\n    address indexed sender,\\n    uint256 amount0,\\n    uint256 amount1,\\n    address indexed to\\n  );\\n  event Swap(\\n    address indexed sender,\\n    uint256 amount0In,\\n    uint256 amount1In,\\n    uint256 amount0Out,\\n    uint256 amount1Out,\\n    address indexed to\\n  );\\n  event Sync(uint112 reserve0, uint112 reserve1);\\n\\n  function MINIMUM_LIQUIDITY() external pure returns (uint256);\\n\\n  function factory() external view returns (address);\\n\\n  function token0() external view returns (address);\\n\\n  function token1() external view returns (address);\\n\\n  function getReserves()\\n    external\\n    view\\n    returns (\\n      uint112 reserve0,\\n      uint112 reserve1,\\n      uint32 blockTimestampLast\\n    );\\n\\n  function getCollectedFees()\\n    external\\n    view\\n    returns (uint112 _collectedFee0, uint112 _collectedFee1);\\n\\n  function getTokenWeights()\\n    external\\n    view\\n    returns (uint32 tokenWeight0, uint32 tokenWeight1);\\n\\n  function getSwapFee() external view returns (uint32);\\n\\n  function price0CumulativeLast() external view returns (uint256);\\n\\n  function price1CumulativeLast() external view returns (uint256);\\n\\n  function mint(address to) external returns (uint256 liquidity);\\n\\n  function burn(address to) external returns (uint256 amount0, uint256 amount1);\\n\\n  function swap(\\n    uint256 amount0Out,\\n    uint256 amount1Out,\\n    address to,\\n    bytes calldata data\\n  ) external;\\n\\n  function skim(address to) external;\\n\\n  function sync() external;\\n\\n  function initialize(\\n    address,\\n    address,\\n    uint32,\\n    uint32\\n  ) external;\\n}\\n\\n// File: interfaces/IRequiemFormula.sol\\n\\npragma solidity >=0.8.11;\\n\\n/*\\n    Bancor Formula interface\\n*/\\ninterface IRequiemFormula {\\n  function getReserveAndWeights(address pair, address tokenA)\\n    external\\n    view\\n    returns (\\n      address tokenB,\\n      uint256 reserveA,\\n      uint256 reserveB,\\n      uint32 tokenWeightA,\\n      uint32 tokenWeightB,\\n      uint32 swapFee\\n    );\\n\\n  function getFactoryReserveAndWeights(\\n    address factory,\\n    address pair,\\n    address tokenA\\n  )\\n    external\\n    view\\n    returns (\\n      address tokenB,\\n      uint256 reserveA,\\n      uint256 reserveB,\\n      uint32 tokenWeightA,\\n      uint32 tokenWeightB,\\n      uint32 swapFee\\n    );\\n\\n  function getAmountIn(\\n    uint256 amountOut,\\n    uint256 reserveIn,\\n    uint256 reserveOut,\\n    uint32 tokenWeightIn,\\n    uint32 tokenWeightOut,\\n    uint32 swapFee\\n  ) external view returns (uint256 amountIn);\\n\\n  function getPairAmountIn(\\n    address pair,\\n    address tokenIn,\\n    uint256 amountOut\\n  ) external view returns (uint256 amountIn);\\n\\n  function getAmountOut(\\n    uint256 amountIn,\\n    uint256 reserveIn,\\n    uint256 reserveOut,\\n    uint32 tokenWeightIn,\\n    uint32 tokenWeightOut,\\n    uint32 swapFee\\n  ) external view returns (uint256 amountOut);\\n\\n  function getPairAmountOut(\\n    address pair,\\n    address tokenIn,\\n    uint256 amountIn\\n  ) external view returns (uint256 amountOut);\\n\\n  function getAmountsIn(\\n    address tokenIn,\\n    address tokenOut,\\n    uint256 amountOut,\\n    address[] calldata path\\n  ) external view returns (uint256[] memory amounts);\\n\\n  function getFactoryAmountsIn(\\n    address factory,\\n    address tokenIn,\\n    address tokenOut,\\n    uint256 amountOut,\\n    address[] calldata path\\n  ) external view returns (uint256[] memory amounts);\\n\\n  function getAmountsOut(\\n    address tokenIn,\\n    address tokenOut,\\n    uint256 amountIn,\\n    address[] calldata path\\n  ) external view returns (uint256[] memory amounts);\\n\\n  function getFactoryAmountsOut(\\n    address factory,\\n    address tokenIn,\\n    address tokenOut,\\n    uint256 amountIn,\\n    address[] calldata path\\n  ) external view returns (uint256[] memory amounts);\\n\\n  function ensureConstantValue(\\n    uint256 reserve0,\\n    uint256 reserve1,\\n    uint256 balance0Adjusted,\\n    uint256 balance1Adjusted,\\n    uint32 tokenWeight0\\n  ) external view returns (bool);\\n\\n  function getReserves(\\n    address pair,\\n    address tokenA,\\n    address tokenB\\n  ) external view returns (uint256 reserveA, uint256 reserveB);\\n\\n  function getOtherToken(address pair, address tokenA)\\n    external\\n    view\\n    returns (address tokenB);\\n\\n  function quote(\\n    uint256 amountA,\\n    uint256 reserveA,\\n    uint256 reserveB\\n  ) external pure returns (uint256 amountB);\\n\\n  function sortTokens(address tokenA, address tokenB)\\n    external\\n    pure\\n    returns (address token0, address token1);\\n\\n  function mintLiquidityFee(\\n    uint256 totalLiquidity,\\n    uint112 reserve0,\\n    uint112 reserve1,\\n    uint32 tokenWeight0,\\n    uint32 tokenWeight1,\\n    uint112 collectedFee0,\\n    uint112 collectedFee1\\n  ) external view returns (uint256 amount);\\n}\\n\\n// File: interfaces/IRequiemFactory.sol\\n\\npragma solidity >=0.5.16;\\n\\ninterface IRequiemFactory {\\n  event PairCreated(\\n    address indexed token0,\\n    address indexed token1,\\n    address pair,\\n    uint32 tokenWeight0,\\n    uint32 swapFee,\\n    uint256\\n  );\\n\\n  function feeTo() external view returns (address);\\n\\n  function formula() external view returns (address);\\n\\n  function protocolFee() external view returns (uint256);\\n\\n  function feeToSetter() external view returns (address);\\n\\n  function getPair(\\n    address tokenA,\\n    address tokenB,\\n    uint32 tokenWeightA,\\n    uint32 swapFee\\n  ) external view returns (address pair);\\n\\n  function allPairs(uint256) external view returns (address pair);\\n\\n  function isPair(address) external view returns (bool);\\n\\n  function allPairsLength() external view returns (uint256);\\n\\n  function createPair(\\n    address tokenA,\\n    address tokenB,\\n    uint32 tokenWeightA,\\n    uint32 swapFee\\n  ) external returns (address pair);\\n\\n  function getWeightsAndSwapFee(address pair)\\n    external\\n    view\\n    returns (\\n      uint32 tokenWeight0,\\n      uint32 tokenWeight1,\\n      uint32 swapFee\\n    );\\n\\n  function setFeeTo(address) external;\\n\\n  function setFeeToSetter(address) external;\\n\\n  function setProtocolFee(uint256) external;\\n}\\n\\n// File: RequiemQPairManager.sol\\n\\npragma solidity >=0.8.11;\\n\\n// solhint-disable not-rely-on-time, var-name-mixedcase, max-line-length, reason-string\\n\\ncontract RequiemQPairManager is IRequiemQPairManager {\\n  address public immutable override factory;\\n  address public immutable override formula;\\n  address public immutable override WETH;\\n  address private constant ETH_ADDRESS =\\n    address(0xEeeeeEeeeEeEeeEeEeEeeEEEeeeeEeeeeeeeEEeE);\\n\\n  modifier ensure(uint256 deadline) {\\n    require(deadline >= block.timestamp, \\\"Router: EXPIRED\\\");\\n    _;\\n  }\\n\\n  constructor(address _factory, address _WETH) {\\n    factory = _factory;\\n    formula = IRequiemFactory(_factory).formula();\\n    WETH = _WETH;\\n  }\\n\\n  receive() external payable {\\n    assert(msg.sender == WETH);\\n    // only accept ETH via fallback from the WETH contract\\n  }\\n\\n  // **** ADD LIQUIDITY ****\\n  function _addLiquidity(\\n    address pair,\\n    address tokenA,\\n    address tokenB,\\n    uint256 amountADesired,\\n    uint256 amountBDesired,\\n    uint256 amountAMin,\\n    uint256 amountBMin\\n  ) internal virtual returns (uint256 amountA, uint256 amountB) {\\n    (uint256 reserveA, uint256 reserveB) = IRequiemFormula(formula).getReserves(\\n      pair,\\n      tokenA,\\n      tokenB\\n    );\\n    if (reserveA == 0 && reserveB == 0) {\\n      (amountA, amountB) = (amountADesired, amountBDesired);\\n    } else {\\n      uint256 amountBOptimal = IRequiemFormula(formula).quote(\\n        amountADesired,\\n        reserveA,\\n        reserveB\\n      );\\n      if (amountBOptimal <= amountBDesired) {\\n        require(amountBOptimal >= amountBMin, \\\"Router: INSUFFICIENT_B_AMOUNT\\\");\\n        (amountA, amountB) = (amountADesired, amountBOptimal);\\n      } else {\\n        uint256 amountAOptimal = IRequiemFormula(formula).quote(\\n          amountBDesired,\\n          reserveB,\\n          reserveA\\n        );\\n        assert(amountAOptimal <= amountADesired);\\n        require(amountAOptimal >= amountAMin, \\\"Router: INSUFFICIENT_A_AMOUNT\\\");\\n        (amountA, amountB) = (amountAOptimal, amountBDesired);\\n      }\\n    }\\n  }\\n\\n  function _addLiquidityToken(\\n    address pair,\\n    address tokenA,\\n    address tokenB,\\n    uint256 amountADesired,\\n    uint256 amountBDesired,\\n    uint256 amountAMin,\\n    uint256 amountBMin\\n  ) internal returns (uint256 amountA, uint256 amountB) {\\n    (amountA, amountB) = _addLiquidity(\\n      pair,\\n      tokenA,\\n      tokenB,\\n      amountADesired,\\n      amountBDesired,\\n      amountAMin,\\n      amountBMin\\n    );\\n    TransferHelper.safeTransferFrom(tokenA, msg.sender, pair, amountA);\\n    TransferHelper.safeTransferFrom(tokenB, msg.sender, pair, amountB);\\n  }\\n\\n  function createPair(\\n    address tokenA,\\n    address tokenB,\\n    uint256 amountA,\\n    uint256 amountB,\\n    uint32 tokenWeightA,\\n    uint32 swapFee,\\n    address to\\n  ) public virtual override returns (uint256 liquidity) {\\n    address pair = IRequiemFactory(factory).createPair(\\n      tokenA,\\n      tokenB,\\n      tokenWeightA,\\n      swapFee\\n    );\\n    _addLiquidityToken(pair, tokenA, tokenB, amountA, amountB, 0, 0);\\n    liquidity = IRequiemPair(pair).mint(to);\\n  }\\n\\n  function addLiquidity(\\n    address pair,\\n    address tokenA,\\n    address tokenB,\\n    uint256 amountADesired,\\n    uint256 amountBDesired,\\n    uint256 amountAMin,\\n    uint256 amountBMin,\\n    address to,\\n    uint256 deadline\\n  )\\n    external\\n    virtual\\n    override\\n    ensure(deadline)\\n    returns (\\n      uint256 amountA,\\n      uint256 amountB,\\n      uint256 liquidity\\n    )\\n  {\\n    (amountA, amountB) = _addLiquidityToken(\\n      pair,\\n      tokenA,\\n      tokenB,\\n      amountADesired,\\n      amountBDesired,\\n      amountAMin,\\n      amountBMin\\n    );\\n    liquidity = IRequiemPair(pair).mint(to);\\n  }\\n\\n  function _addLiquidityETH(\\n    address pair,\\n    address token,\\n    uint256 amountTokenDesired,\\n    uint256 amountTokenMin,\\n    uint256 amountETHMin,\\n    address to\\n  )\\n    internal\\n    returns (\\n      uint256 amountToken,\\n      uint256 amountETH,\\n      uint256 liquidity\\n    )\\n  {\\n    (amountToken, amountETH) = _addLiquidity(\\n      pair,\\n      token,\\n      WETH,\\n      amountTokenDesired,\\n      msg.value,\\n      amountTokenMin,\\n      amountETHMin\\n    );\\n    TransferHelper.safeTransferFrom(token, msg.sender, pair, amountToken);\\n    transferETHTo(amountETH, pair);\\n    liquidity = IRequiemPair(pair).mint(to);\\n    // refund dust eth, if any\\n    if (msg.value > amountETH)\\n      TransferHelper.safeTransferETH(msg.sender, msg.value - amountETH);\\n  }\\n\\n  function createPairETH(\\n    address token,\\n    uint256 amountToken,\\n    uint32 tokenWeight,\\n    uint32 swapFee,\\n    address to\\n  ) public payable virtual override returns (uint256 liquidity) {\\n    address pair = IRequiemFactory(factory).createPair(\\n      token,\\n      WETH,\\n      tokenWeight,\\n      swapFee\\n    );\\n    (, , liquidity) = _addLiquidityETH(pair, token, amountToken, 0, 0, to);\\n  }\\n\\n  function addLiquidityETH(\\n    address pair,\\n    address token,\\n    uint256 amountTokenDesired,\\n    uint256 amountTokenMin,\\n    uint256 amountETHMin,\\n    address to,\\n    uint256 deadline\\n  )\\n    public\\n    payable\\n    virtual\\n    override\\n    ensure(deadline)\\n    returns (\\n      uint256 amountToken,\\n      uint256 amountETH,\\n      uint256 liquidity\\n    )\\n  {\\n    (amountToken, amountETH, liquidity) = _addLiquidityETH(\\n      pair,\\n      token,\\n      amountTokenDesired,\\n      amountTokenMin,\\n      amountETHMin,\\n      to\\n    );\\n  }\\n\\n  // **** REMOVE LIQUIDITY ****\\n  function _removeLiquidity(\\n    address pair,\\n    address tokenA,\\n    address tokenB,\\n    uint256 liquidity,\\n    uint256 amountAMin,\\n    uint256 amountBMin,\\n    address to\\n  ) internal returns (uint256 amountA, uint256 amountB) {\\n    require(IRequiemFactory(factory).isPair(pair), \\\"Router: Invalid pair\\\");\\n    IRequiemPair(pair).transferFrom(msg.sender, pair, liquidity);\\n    // send liquidity to pair\\n    (uint256 amount0, uint256 amount1) = IRequiemPair(pair).burn(to);\\n    (address token0, ) = IRequiemFormula(formula).sortTokens(tokenA, tokenB);\\n    (amountA, amountB) = tokenA == token0\\n      ? (amount0, amount1)\\n      : (amount1, amount0);\\n    require(amountA >= amountAMin, \\\"Router: INSUFFICIENT_A_AMOUNT\\\");\\n    require(amountB >= amountBMin, \\\"Router: INSUFFICIENT_B_AMOUNT\\\");\\n  }\\n\\n  function removeLiquidity(\\n    address pair,\\n    address tokenA,\\n    address tokenB,\\n    uint256 liquidity,\\n    uint256 amountAMin,\\n    uint256 amountBMin,\\n    address to,\\n    uint256 deadline\\n  )\\n    public\\n    virtual\\n    override\\n    ensure(deadline)\\n    returns (uint256 amountA, uint256 amountB)\\n  {\\n    (amountA, amountB) = _removeLiquidity(\\n      pair,\\n      tokenA,\\n      tokenB,\\n      liquidity,\\n      amountAMin,\\n      amountBMin,\\n      to\\n    );\\n  }\\n\\n  function removeLiquidityETH(\\n    address pair,\\n    address token,\\n    uint256 liquidity,\\n    uint256 amountTokenMin,\\n    uint256 amountETHMin,\\n    address to,\\n    uint256 deadline\\n  )\\n    public\\n    virtual\\n    override\\n    ensure(deadline)\\n    returns (uint256 amountToken, uint256 amountETH)\\n  {\\n    (amountToken, amountETH) = _removeLiquidity(\\n      pair,\\n      token,\\n      WETH,\\n      liquidity,\\n      amountTokenMin,\\n      amountETHMin,\\n      address(this)\\n    );\\n    TransferHelper.safeTransfer(token, to, amountToken);\\n    transferAll(ETH_ADDRESS, to, amountETH);\\n  }\\n\\n  function removeLiquidityWithPermit(\\n    address pair,\\n    address tokenA,\\n    address tokenB,\\n    uint256 liquidity,\\n    uint256 amountAMin,\\n    uint256 amountBMin,\\n    address to,\\n    uint256 deadline,\\n    bool approveMax,\\n    uint8 v,\\n    bytes32 r,\\n    bytes32 s\\n  )\\n    external\\n    virtual\\n    override\\n    ensure(deadline)\\n    returns (uint256 amountA, uint256 amountB)\\n  {\\n    {\\n      uint256 value = approveMax ? type(uint256).max : liquidity;\\n      IRequiemPair(pair).permit(\\n        msg.sender,\\n        address(this),\\n        value,\\n        deadline,\\n        v,\\n        r,\\n        s\\n      );\\n    }\\n    (amountA, amountB) = _removeLiquidity(\\n      pair,\\n      tokenA,\\n      tokenB,\\n      liquidity,\\n      amountAMin,\\n      amountBMin,\\n      to\\n    );\\n  }\\n\\n  function removeLiquidityETHWithPermit(\\n    address pair,\\n    address token,\\n    uint256 liquidity,\\n    uint256 amountTokenMin,\\n    uint256 amountETHMin,\\n    address to,\\n    uint256 deadline,\\n    bool approveMax,\\n    uint8 v,\\n    bytes32 r,\\n    bytes32 s\\n  ) external virtual override returns (uint256 amountToken, uint256 amountETH) {\\n    uint256 value = approveMax ? type(uint256).max : liquidity;\\n    IRequiemPair(pair).permit(\\n      msg.sender,\\n      address(this),\\n      value,\\n      deadline,\\n      v,\\n      r,\\n      s\\n    );\\n    (amountToken, amountETH) = removeLiquidityETH(\\n      pair,\\n      token,\\n      liquidity,\\n      amountTokenMin,\\n      amountETHMin,\\n      to,\\n      deadline\\n    );\\n  }\\n\\n  // **** REMOVE LIQUIDITY (supporting fee-on-transfer tokens) ****\\n  function removeLiquidityETHSupportingFeeOnTransferTokens(\\n    address pair,\\n    address token,\\n    uint256 liquidity,\\n    uint256 amountTokenMin,\\n    uint256 amountETHMin,\\n    address to,\\n    uint256 deadline\\n  ) public virtual override ensure(deadline) returns (uint256 amountETH) {\\n    (, amountETH) = removeLiquidity(\\n      pair,\\n      token,\\n      WETH,\\n      liquidity,\\n      amountTokenMin,\\n      amountETHMin,\\n      address(this),\\n      deadline\\n    );\\n    TransferHelper.safeTransfer(\\n      token,\\n      to,\\n      IERC20(token).balanceOf(address(this))\\n    );\\n    transferAll(ETH_ADDRESS, to, amountETH);\\n  }\\n\\n  function removeLiquidityETHWithPermitSupportingFeeOnTransferTokens(\\n    address pair,\\n    address token,\\n    uint256 liquidity,\\n    uint256 amountTokenMin,\\n    uint256 amountETHMin,\\n    address to,\\n    uint256 deadline,\\n    bool approveMax,\\n    uint8 v,\\n    bytes32 r,\\n    bytes32 s\\n  ) external virtual override returns (uint256 amountETH) {\\n    uint256 value = approveMax ? type(uint256).max : liquidity;\\n    IRequiemPair(pair).permit(\\n      msg.sender,\\n      address(this),\\n      value,\\n      deadline,\\n      v,\\n      r,\\n      s\\n    );\\n    amountETH = removeLiquidityETHSupportingFeeOnTransferTokens(\\n      pair,\\n      token,\\n      liquidity,\\n      amountTokenMin,\\n      amountETHMin,\\n      to,\\n      deadline\\n    );\\n  }\\n\\n  function transferETHTo(uint256 amount, address to) internal {\\n    IWETH(WETH).deposit{value: amount}();\\n    assert(IWETH(WETH).transfer(to, amount));\\n  }\\n\\n  function transferAll(\\n    address token,\\n    address to,\\n    uint256 amount\\n  ) internal returns (bool) {\\n    if (amount == 0) {\\n      return true;\\n    }\\n\\n    if (isETH(token)) {\\n      IWETH(WETH).withdraw(amount);\\n      TransferHelper.safeTransferETH(to, amount);\\n    } else {\\n      TransferHelper.safeTransfer(token, to, amount);\\n    }\\n    return true;\\n  }\\n\\n  function isETH(address token) internal pure returns (bool) {\\n    return (token == ETH_ADDRESS);\\n  }\\n}\\n\",\"keccak256\":\"0xd97fcecbbd5980fcf0716307846a3c20d80aca2721f67bae534d3bdd0e6db6c8\",\"license\":\"MIT\"}},\"version\":1}",
  "bytecode": "0x60e06040523480156200001157600080fd5b5060405162001fd938038062001fd98339810160408190526200003491620000db565b6001600160a01b038216608081905260408051634b75f54f60e01b81529051634b75f54f916004808201926020929091908290030181865afa1580156200007f573d6000803e3d6000fd5b505050506040513d601f19601f82011682018060405250810190620000a5919062000113565b6001600160a01b0390811660a0521660c0525062000138565b80516001600160a01b0381168114620000d657600080fd5b919050565b60008060408385031215620000ef57600080fd5b620000fa83620000be565b91506200010a60208401620000be565b90509250929050565b6000602082840312156200012657600080fd5b6200013182620000be565b9392505050565b60805160a05160c051611e09620001d06000396000818160e601528181610241015281816105a70152818161077f015281816109c401528181610b93015281816111810152818161168e015261172301526000818161018d01528181610eaa01528181611296015281816113490152611447015260008181610295015281816105e8015281816108240152610ca80152611e096000f3fe6080604052600436106100d65760003560e01c8063ad5c46481161007f578063d0f2c82a11610059578063d0f2c82a146102b7578063e1f4a784146102d7578063ebb5d2e9146102f7578063fbf451351461031757600080fd5b8063ad5c46481461022f578063b56b681d14610263578063c45a01551461028357600080fd5b80634c17fd7c116100b05780634c17fd7c146101c75780636cb49428146101fc578063a4aabb081461020f57600080fd5b80630e2f024c1461011a5780633990ba541461014d5780634b75f54f1461017b57600080fd5b3661011557336001600160a01b037f000000000000000000000000000000000000000000000000000000000000000016146101135761011361188c565b005b600080fd5b34801561012657600080fd5b5061013a6101353660046118de565b610337565b6040519081526020015b60405180910390f35b61016061015b366004611988565b6103f0565b60408051938452602084019290925290820152606001610144565b34801561018757600080fd5b506101af7f000000000000000000000000000000000000000000000000000000000000000081565b6040516001600160a01b039091168152602001610144565b3480156101d357600080fd5b506101e76101e23660046119fa565b61045f565b60408051928352602083019190915201610144565b61013a61020a366004611aca565b610588565b34801561021b57600080fd5b506101e761022a3660046118de565b610673565b34801561023b57600080fd5b506101af7f000000000000000000000000000000000000000000000000000000000000000081565b34801561026f57600080fd5b506101e761027e366004611988565b610732565b34801561028f57600080fd5b506101af7f000000000000000000000000000000000000000000000000000000000000000081565b3480156102c357600080fd5b5061013a6102d2366004611b2e565b6107e4565b3480156102e357600080fd5b506101e76102f2366004611bae565b610911565b34801561030357600080fd5b5061013a610312366004611988565b610978565b34801561032357600080fd5b50610160610332366004611c33565b610aab565b60008085610345578a610349565b6000195b60405163d505accf60e01b8152336004820152306024820152604481018290526064810189905260ff8716608482015260a4810186905260c481018590529091506001600160a01b038e169063d505accf9060e401600060405180830381600087803b1580156103b857600080fd5b505af11580156103cc573d6000803e3d6000fd5b505050506103df8d8d8d8d8d8d8d610978565b9d9c50505050505050505050505050565b6000806000834281101561043d5760405162461bcd60e51b815260206004820152600f60248201526e149bdd5d195c8e8811561412549151608a1b60448201526064015b60405180910390fd5b61044b8b8b8b8b8b8b610b87565b919d909c50909a5098505050505050505050565b60008086428110156104a55760405162461bcd60e51b815260206004820152600f60248201526e149bdd5d195c8e8811561412549151608a1b6044820152606401610434565b6000876104b2578c6104b6565b6000195b90508f6001600160a01b031663d505accf3330848d8c8c8c6040518863ffffffff1660e01b815260040161052c97969594939291906001600160a01b0397881681529590961660208601526040850193909352606084019190915260ff16608083015260a082015260c081019190915260e00190565b600060405180830381600087803b15801561054657600080fd5b505af115801561055a573d6000803e3d6000fd5b505050505061056e8f8f8f8f8f8f8f610c6b565b8093508194505050509c509c9a5050505050505050505050565b6040516314572adb60e01b81526001600160a01b0386811660048301527f00000000000000000000000000000000000000000000000000000000000000008116602483015263ffffffff80861660448401528416606483015260009182917f000000000000000000000000000000000000000000000000000000000000000016906314572adb906084016020604051808303816000875af1158015610631573d6000803e3d6000fd5b505050506040513d601f19601f820116820180604052508101906106559190611cc2565b905061066681888860008088610b87565b9998505050505050505050565b600080600086610683578b610687565b6000195b60405163d505accf60e01b815233600482015230602482015260448101829052606481018a905260ff8816608482015260a4810187905260c481018690529091506001600160a01b038f169063d505accf9060e401600060405180830381600087803b1580156106f657600080fd5b505af115801561070a573d6000803e3d6000fd5b5050505061071d8e8e8e8e8e8e8e610732565b909f909e509c50505050505050505050505050565b60008082428110156107785760405162461bcd60e51b815260206004820152600f60248201526e149bdd5d195c8e8811561412549151608a1b6044820152606401610434565b6107a78a8a7f00000000000000000000000000000000000000000000000000000000000000008b8b8b30610c6b565b90935091506107b7898685610fee565b6107d673eeeeeeeeeeeeeeeeeeeeeeeeeeeeeeeeeeeeeeee868461111e565b505097509795505050505050565b6040516314572adb60e01b81526001600160a01b038881166004830152878116602483015263ffffffff80861660448401528416606483015260009182917f000000000000000000000000000000000000000000000000000000000000000016906314572adb906084016020604051808303816000875af115801561086d573d6000803e3d6000fd5b505050506040513d601f19601f820116820180604052508101906108919190611cc2565b90506108a3818a8a8a8a60008061120a565b50506040516335313c2160e11b81526001600160a01b038481166004830152821690636a627842906024016020604051808303816000875af11580156108ed573d6000803e3d6000fd5b505050506040513d601f19601f820116820180604052508101906106669190611cdf565b60008082428110156109575760405162461bcd60e51b815260206004820152600f60248201526e149bdd5d195c8e8811561412549151608a1b6044820152606401610434565b6109668b8b8b8b8b8b8b610c6b565b909c909b509950505050505050505050565b600081428110156109bd5760405162461bcd60e51b815260206004820152600f60248201526e149bdd5d195c8e8811561412549151608a1b6044820152606401610434565b6109ed89897f00000000000000000000000000000000000000000000000000000000000000008a8a8a308a610911565b6040517f70a08231000000000000000000000000000000000000000000000000000000008152306004820152909350610a7f9150899086906001600160a01b038316906370a0823190602401602060405180830381865afa158015610a56573d6000803e3d6000fd5b505050506040513d601f19601f82011682018060405250810190610a7a9190611cdf565b610fee565b610a9e73eeeeeeeeeeeeeeeeeeeeeeeeeeeeeeeeeeeeeeee858461111e565b5050979650505050505050565b60008060008342811015610af35760405162461bcd60e51b815260206004820152600f60248201526e149bdd5d195c8e8811561412549151608a1b6044820152606401610434565b610b028d8d8d8d8d8d8d61120a565b6040516335313c2160e11b81526001600160a01b038981166004830152929650909450908e1690636a627842906024016020604051808303816000875af1158015610b51573d6000803e3d6000fd5b505050506040513d601f19601f82011682018060405250810190610b759190611cdf565b91505099509950999650505050505050565b6000806000610bbb89897f00000000000000000000000000000000000000000000000000000000000000008a348b8b611245565b9093509150610bcc88338b8661152e565b610bd6828a61168c565b6040516335313c2160e11b81526001600160a01b0385811660048301528a1690636a627842906024016020604051808303816000875af1158015610c1e573d6000803e3d6000fd5b505050506040513d601f19601f82011682018060405250810190610c429190611cdf565b905081341115610c5f57610c5f33610c5a8434611cf8565b6117a4565b96509650969350505050565b6040517fe5e31b130000000000000000000000000000000000000000000000000000000081526001600160a01b03888116600483015260009182917f0000000000000000000000000000000000000000000000000000000000000000169063e5e31b1390602401602060405180830381865afa158015610cef573d6000803e3d6000fd5b505050506040513d601f19601f82011682018060405250810190610d139190611d1d565b610d5f5760405162461bcd60e51b815260206004820152601460248201527f526f757465723a20496e76616c696420706169720000000000000000000000006044820152606401610434565b6040516323b872dd60e01b81523360048201526001600160a01b038a166024820181905260448201889052906323b872dd906064016020604051808303816000875af1158015610db3573d6000803e3d6000fd5b505050506040513d601f19601f82011682018060405250810190610dd79190611d1d565b506040517f89afcb440000000000000000000000000000000000000000000000000000000081526001600160a01b03848116600483015260009182918c16906389afcb449060240160408051808303816000875af1158015610e3d573d6000803e3d6000fd5b505050506040513d601f19601f82011682018060405250810190610e619190611d3a565b6040517f544caa560000000000000000000000000000000000000000000000000000000081526001600160a01b038d811660048301528c811660248301529294509092506000917f0000000000000000000000000000000000000000000000000000000000000000169063544caa56906044016040805180830381865afa158015610ef0573d6000803e3d6000fd5b505050506040513d601f19601f82011682018060405250810190610f149190611d5e565b509050806001600160a01b03168b6001600160a01b031614610f37578183610f3a565b82825b909550935087851015610f8f5760405162461bcd60e51b815260206004820152601d60248201527f526f757465723a20494e53554646494349454e545f415f414d4f554e540000006044820152606401610434565b86841015610fdf5760405162461bcd60e51b815260206004820152601d60248201527f526f757465723a20494e53554646494349454e545f425f414d4f554e540000006044820152606401610434565b50505097509795505050505050565b604080516001600160a01b038481166024830152604480830185905283518084039091018152606490920183526020820180517bffffffffffffffffffffffffffffffffffffffffffffffffffffffff1663a9059cbb60e01b179052915160009283929087169161105f9190611d98565b6000604051808303816000865af19150503d806000811461109c576040519150601f19603f3d011682016040523d82523d6000602084013e6110a1565b606091505b50915091508180156110cb5750805115806110cb5750808060200190518101906110cb9190611d1d565b6111175760405162461bcd60e51b815260206004820152601f60248201527f5472616e7366657248656c7065723a205452414e534645525f4641494c4544006044820152606401610434565b5050505050565b60008161112d57506001611203565b73eeeeeeeeeeeeeeeeeeeeeeeeeeeeeeeeeeeeeeee6001600160a01b03851614156111f4576040517f2e1a7d4d000000000000000000000000000000000000000000000000000000008152600481018390527f00000000000000000000000000000000000000000000000000000000000000006001600160a01b031690632e1a7d4d90602401600060405180830381600087803b1580156111cd57600080fd5b505af11580156111e1573d6000803e3d6000fd5b505050506111ef83836117a4565b6111ff565b6111ff848484610fee565b5060015b9392505050565b60008061121c89898989898989611245565b909250905061122d88338b8561152e565b61123987338b8461152e565b97509795505050505050565b6040517f327494610000000000000000000000000000000000000000000000000000000081526001600160a01b038881166004830152878116602483015286811660448301526000918291829182917f000000000000000000000000000000000000000000000000000000000000000016906332749461906064016040805180830381865afa1580156112dc573d6000803e3d6000fd5b505050506040513d601f19601f820116820180604052508101906113009190611d3a565b91509150816000148015611312575080155b15611322578793508692506107d6565b604051632b58577b60e21b81526004810189905260248101839052604481018290526000907f00000000000000000000000000000000000000000000000000000000000000006001600160a01b03169063ad615dec90606401602060405180830381865afa158015611398573d6000803e3d6000fd5b505050506040513d601f19601f820116820180604052508101906113bc9190611cdf565b905087811161142057858110156114155760405162461bcd60e51b815260206004820152601d60248201527f526f757465723a20494e53554646494349454e545f425f414d4f554e540000006044820152606401610434565b889450925082610fdf565b604051632b58577b60e21b81526004810189905260248101839052604481018490526000907f00000000000000000000000000000000000000000000000000000000000000006001600160a01b03169063ad615dec90606401602060405180830381865afa158015611496573d6000803e3d6000fd5b505050506040513d601f19601f820116820180604052508101906114ba9190611cdf565b9050898111156114cc576114cc61188c565b8781101561151c5760405162461bcd60e51b815260206004820152601d60248201527f526f757465723a20494e53554646494349454e545f415f414d4f554e540000006044820152606401610434565b9c979b50969950505050505050505050565b604080516001600160a01b0385811660248301528481166044830152606480830185905283518084039091018152608490920183526020820180517bffffffffffffffffffffffffffffffffffffffffffffffffffffffff166323b872dd60e01b17905291516000928392908816916115a79190611d98565b6000604051808303816000865af19150503d80600081146115e4576040519150601f19603f3d011682016040523d82523d6000602084013e6115e9565b606091505b50915091508180156116135750805115806116135750808060200190518101906116139190611d1d565b6116845760405162461bcd60e51b8152602060048201526024808201527f5472616e7366657248656c7065723a205452414e534645525f46524f4d5f464160448201527f494c4544000000000000000000000000000000000000000000000000000000006064820152608401610434565b505050505050565b7f00000000000000000000000000000000000000000000000000000000000000006001600160a01b031663d0e30db0836040518263ffffffff1660e01b81526004016000604051808303818588803b1580156116e757600080fd5b505af11580156116fb573d6000803e3d6000fd5b505060405163a9059cbb60e01b81526001600160a01b038581166004830152602482018790527f000000000000000000000000000000000000000000000000000000000000000016935063a9059cbb925060440190506020604051808303816000875af1158015611770573d6000803e3d6000fd5b505050506040513d601f19601f820116820180604052508101906117949190611d1d565b6117a0576117a061188c565b5050565b604080516000808252602082019092526001600160a01b0384169083906040516117ce9190611d98565b60006040518083038185875af1925050503d806000811461180b576040519150601f19603f3d011682016040523d82523d6000602084013e611810565b606091505b50509050806118875760405162461bcd60e51b815260206004820152602360248201527f5472616e7366657248656c7065723a204554485f5452414e534645525f46414960448201527f4c454400000000000000000000000000000000000000000000000000000000006064820152608401610434565b505050565b634e487b7160e01b600052600160045260246000fd5b6001600160a01b03811681146118b757600080fd5b50565b80151581146118b757600080fd5b803560ff811681146118d957600080fd5b919050565b60008060008060008060008060008060006101608c8e03121561190057600080fd5b8b3561190b816118a2565b9a5060208c013561191b816118a2565b995060408c0135985060608c0135975060808c0135965060a08c0135611940816118a2565b955060c08c0135945060e08c0135611957816118ba565b93506119666101008d016118c8565b92506101208c013591506101408c013590509295989b509295989b9093969950565b600080600080600080600060e0888a0312156119a357600080fd5b87356119ae816118a2565b965060208801356119be816118a2565b955060408801359450606088013593506080880135925060a08801356119e3816118a2565b8092505060c0880135905092959891949750929550565b6000806000806000806000806000806000806101808d8f031215611a1d57600080fd5b8c35611a28816118a2565b9b5060208d0135611a38816118a2565b9a5060408d0135611a48816118a2565b995060608d0135985060808d0135975060a08d0135965060c08d0135611a6d816118a2565b955060e08d013594506101008d0135611a85816118ba565b9350611a946101208e016118c8565b92506101408d013591506101608d013590509295989b509295989b509295989b565b803563ffffffff811681146118d957600080fd5b600080600080600060a08688031215611ae257600080fd5b8535611aed816118a2565b945060208601359350611b0260408701611ab6565b9250611b1060608701611ab6565b91506080860135611b20816118a2565b809150509295509295909350565b600080600080600080600060e0888a031215611b4957600080fd5b8735611b54816118a2565b96506020880135611b64816118a2565b95506040880135945060608801359350611b8060808901611ab6565b9250611b8e60a08901611ab6565b915060c0880135611b9e816118a2565b8091505092959891949750929550565b600080600080600080600080610100898b031215611bcb57600080fd5b8835611bd6816118a2565b97506020890135611be6816118a2565b96506040890135611bf6816118a2565b9550606089013594506080890135935060a0890135925060c0890135611c1b816118a2565b8092505060e089013590509295985092959890939650565b60008060008060008060008060006101208a8c031215611c5257600080fd5b8935611c5d816118a2565b985060208a0135611c6d816118a2565b975060408a0135611c7d816118a2565b965060608a0135955060808a0135945060a08a0135935060c08a0135925060e08a0135611ca9816118a2565b809250506101008a013590509295985092959850929598565b600060208284031215611cd457600080fd5b8151611203816118a2565b600060208284031215611cf157600080fd5b5051919050565b600082821015611d1857634e487b7160e01b600052601160045260246000fd5b500390565b600060208284031215611d2f57600080fd5b8151611203816118ba565b60008060408385031215611d4d57600080fd5b505080516020909101519092909150565b60008060408385031215611d7157600080fd5b8251611d7c816118a2565b6020840151909250611d8d816118a2565b809150509250929050565b6000825160005b81811015611db95760208186018101518583015201611d9f565b81811115611dc8576000828501525b50919091019291505056fea2646970667358221220f95a2a37413fc625202336533e0faf53eb841f42a3d4fbf136ed389a3a01876f64736f6c634300080b0033",
  "deployedBytecode": "0x6080604052600436106100d65760003560e01c8063ad5c46481161007f578063d0f2c82a11610059578063d0f2c82a146102b7578063e1f4a784146102d7578063ebb5d2e9146102f7578063fbf451351461031757600080fd5b8063ad5c46481461022f578063b56b681d14610263578063c45a01551461028357600080fd5b80634c17fd7c116100b05780634c17fd7c146101c75780636cb49428146101fc578063a4aabb081461020f57600080fd5b80630e2f024c1461011a5780633990ba541461014d5780634b75f54f1461017b57600080fd5b3661011557336001600160a01b037f000000000000000000000000000000000000000000000000000000000000000016146101135761011361188c565b005b600080fd5b34801561012657600080fd5b5061013a6101353660046118de565b610337565b6040519081526020015b60405180910390f35b61016061015b366004611988565b6103f0565b60408051938452602084019290925290820152606001610144565b34801561018757600080fd5b506101af7f000000000000000000000000000000000000000000000000000000000000000081565b6040516001600160a01b039091168152602001610144565b3480156101d357600080fd5b506101e76101e23660046119fa565b61045f565b60408051928352602083019190915201610144565b61013a61020a366004611aca565b610588565b34801561021b57600080fd5b506101e761022a3660046118de565b610673565b34801561023b57600080fd5b506101af7f000000000000000000000000000000000000000000000000000000000000000081565b34801561026f57600080fd5b506101e761027e366004611988565b610732565b34801561028f57600080fd5b506101af7f000000000000000000000000000000000000000000000000000000000000000081565b3480156102c357600080fd5b5061013a6102d2366004611b2e565b6107e4565b3480156102e357600080fd5b506101e76102f2366004611bae565b610911565b34801561030357600080fd5b5061013a610312366004611988565b610978565b34801561032357600080fd5b50610160610332366004611c33565b610aab565b60008085610345578a610349565b6000195b60405163d505accf60e01b8152336004820152306024820152604481018290526064810189905260ff8716608482015260a4810186905260c481018590529091506001600160a01b038e169063d505accf9060e401600060405180830381600087803b1580156103b857600080fd5b505af11580156103cc573d6000803e3d6000fd5b505050506103df8d8d8d8d8d8d8d610978565b9d9c50505050505050505050505050565b6000806000834281101561043d5760405162461bcd60e51b815260206004820152600f60248201526e149bdd5d195c8e8811561412549151608a1b60448201526064015b60405180910390fd5b61044b8b8b8b8b8b8b610b87565b919d909c50909a5098505050505050505050565b60008086428110156104a55760405162461bcd60e51b815260206004820152600f60248201526e149bdd5d195c8e8811561412549151608a1b6044820152606401610434565b6000876104b2578c6104b6565b6000195b90508f6001600160a01b031663d505accf3330848d8c8c8c6040518863ffffffff1660e01b815260040161052c97969594939291906001600160a01b0397881681529590961660208601526040850193909352606084019190915260ff16608083015260a082015260c081019190915260e00190565b600060405180830381600087803b15801561054657600080fd5b505af115801561055a573d6000803e3d6000fd5b505050505061056e8f8f8f8f8f8f8f610c6b565b8093508194505050509c509c9a5050505050505050505050565b6040516314572adb60e01b81526001600160a01b0386811660048301527f00000000000000000000000000000000000000000000000000000000000000008116602483015263ffffffff80861660448401528416606483015260009182917f000000000000000000000000000000000000000000000000000000000000000016906314572adb906084016020604051808303816000875af1158015610631573d6000803e3d6000fd5b505050506040513d601f19601f820116820180604052508101906106559190611cc2565b905061066681888860008088610b87565b9998505050505050505050565b600080600086610683578b610687565b6000195b60405163d505accf60e01b815233600482015230602482015260448101829052606481018a905260ff8816608482015260a4810187905260c481018690529091506001600160a01b038f169063d505accf9060e401600060405180830381600087803b1580156106f657600080fd5b505af115801561070a573d6000803e3d6000fd5b5050505061071d8e8e8e8e8e8e8e610732565b909f909e509c50505050505050505050505050565b60008082428110156107785760405162461bcd60e51b815260206004820152600f60248201526e149bdd5d195c8e8811561412549151608a1b6044820152606401610434565b6107a78a8a7f00000000000000000000000000000000000000000000000000000000000000008b8b8b30610c6b565b90935091506107b7898685610fee565b6107d673eeeeeeeeeeeeeeeeeeeeeeeeeeeeeeeeeeeeeeee868461111e565b505097509795505050505050565b6040516314572adb60e01b81526001600160a01b038881166004830152878116602483015263ffffffff80861660448401528416606483015260009182917f000000000000000000000000000000000000000000000000000000000000000016906314572adb906084016020604051808303816000875af115801561086d573d6000803e3d6000fd5b505050506040513d601f19601f820116820180604052508101906108919190611cc2565b90506108a3818a8a8a8a60008061120a565b50506040516335313c2160e11b81526001600160a01b038481166004830152821690636a627842906024016020604051808303816000875af11580156108ed573d6000803e3d6000fd5b505050506040513d601f19601f820116820180604052508101906106669190611cdf565b60008082428110156109575760405162461bcd60e51b815260206004820152600f60248201526e149bdd5d195c8e8811561412549151608a1b6044820152606401610434565b6109668b8b8b8b8b8b8b610c6b565b909c909b509950505050505050505050565b600081428110156109bd5760405162461bcd60e51b815260206004820152600f60248201526e149bdd5d195c8e8811561412549151608a1b6044820152606401610434565b6109ed89897f00000000000000000000000000000000000000000000000000000000000000008a8a8a308a610911565b6040517f70a08231000000000000000000000000000000000000000000000000000000008152306004820152909350610a7f9150899086906001600160a01b038316906370a0823190602401602060405180830381865afa158015610a56573d6000803e3d6000fd5b505050506040513d601f19601f82011682018060405250810190610a7a9190611cdf565b610fee565b610a9e73eeeeeeeeeeeeeeeeeeeeeeeeeeeeeeeeeeeeeeee858461111e565b5050979650505050505050565b60008060008342811015610af35760405162461bcd60e51b815260206004820152600f60248201526e149bdd5d195c8e8811561412549151608a1b6044820152606401610434565b610b028d8d8d8d8d8d8d61120a565b6040516335313c2160e11b81526001600160a01b038981166004830152929650909450908e1690636a627842906024016020604051808303816000875af1158015610b51573d6000803e3d6000fd5b505050506040513d601f19601f82011682018060405250810190610b759190611cdf565b91505099509950999650505050505050565b6000806000610bbb89897f00000000000000000000000000000000000000000000000000000000000000008a348b8b611245565b9093509150610bcc88338b8661152e565b610bd6828a61168c565b6040516335313c2160e11b81526001600160a01b0385811660048301528a1690636a627842906024016020604051808303816000875af1158015610c1e573d6000803e3d6000fd5b505050506040513d601f19601f82011682018060405250810190610c429190611cdf565b905081341115610c5f57610c5f33610c5a8434611cf8565b6117a4565b96509650969350505050565b6040517fe5e31b130000000000000000000000000000000000000000000000000000000081526001600160a01b03888116600483015260009182917f0000000000000000000000000000000000000000000000000000000000000000169063e5e31b1390602401602060405180830381865afa158015610cef573d6000803e3d6000fd5b505050506040513d601f19601f82011682018060405250810190610d139190611d1d565b610d5f5760405162461bcd60e51b815260206004820152601460248201527f526f757465723a20496e76616c696420706169720000000000000000000000006044820152606401610434565b6040516323b872dd60e01b81523360048201526001600160a01b038a166024820181905260448201889052906323b872dd906064016020604051808303816000875af1158015610db3573d6000803e3d6000fd5b505050506040513d601f19601f82011682018060405250810190610dd79190611d1d565b506040517f89afcb440000000000000000000000000000000000000000000000000000000081526001600160a01b03848116600483015260009182918c16906389afcb449060240160408051808303816000875af1158015610e3d573d6000803e3d6000fd5b505050506040513d601f19601f82011682018060405250810190610e619190611d3a565b6040517f544caa560000000000000000000000000000000000000000000000000000000081526001600160a01b038d811660048301528c811660248301529294509092506000917f0000000000000000000000000000000000000000000000000000000000000000169063544caa56906044016040805180830381865afa158015610ef0573d6000803e3d6000fd5b505050506040513d601f19601f82011682018060405250810190610f149190611d5e565b509050806001600160a01b03168b6001600160a01b031614610f37578183610f3a565b82825b909550935087851015610f8f5760405162461bcd60e51b815260206004820152601d60248201527f526f757465723a20494e53554646494349454e545f415f414d4f554e540000006044820152606401610434565b86841015610fdf5760405162461bcd60e51b815260206004820152601d60248201527f526f757465723a20494e53554646494349454e545f425f414d4f554e540000006044820152606401610434565b50505097509795505050505050565b604080516001600160a01b038481166024830152604480830185905283518084039091018152606490920183526020820180517bffffffffffffffffffffffffffffffffffffffffffffffffffffffff1663a9059cbb60e01b179052915160009283929087169161105f9190611d98565b6000604051808303816000865af19150503d806000811461109c576040519150601f19603f3d011682016040523d82523d6000602084013e6110a1565b606091505b50915091508180156110cb5750805115806110cb5750808060200190518101906110cb9190611d1d565b6111175760405162461bcd60e51b815260206004820152601f60248201527f5472616e7366657248656c7065723a205452414e534645525f4641494c4544006044820152606401610434565b5050505050565b60008161112d57506001611203565b73eeeeeeeeeeeeeeeeeeeeeeeeeeeeeeeeeeeeeeee6001600160a01b03851614156111f4576040517f2e1a7d4d000000000000000000000000000000000000000000000000000000008152600481018390527f00000000000000000000000000000000000000000000000000000000000000006001600160a01b031690632e1a7d4d90602401600060405180830381600087803b1580156111cd57600080fd5b505af11580156111e1573d6000803e3d6000fd5b505050506111ef83836117a4565b6111ff565b6111ff848484610fee565b5060015b9392505050565b60008061121c89898989898989611245565b909250905061122d88338b8561152e565b61123987338b8461152e565b97509795505050505050565b6040517f327494610000000000000000000000000000000000000000000000000000000081526001600160a01b038881166004830152878116602483015286811660448301526000918291829182917f000000000000000000000000000000000000000000000000000000000000000016906332749461906064016040805180830381865afa1580156112dc573d6000803e3d6000fd5b505050506040513d601f19601f820116820180604052508101906113009190611d3a565b91509150816000148015611312575080155b15611322578793508692506107d6565b604051632b58577b60e21b81526004810189905260248101839052604481018290526000907f00000000000000000000000000000000000000000000000000000000000000006001600160a01b03169063ad615dec90606401602060405180830381865afa158015611398573d6000803e3d6000fd5b505050506040513d601f19601f820116820180604052508101906113bc9190611cdf565b905087811161142057858110156114155760405162461bcd60e51b815260206004820152601d60248201527f526f757465723a20494e53554646494349454e545f425f414d4f554e540000006044820152606401610434565b889450925082610fdf565b604051632b58577b60e21b81526004810189905260248101839052604481018490526000907f00000000000000000000000000000000000000000000000000000000000000006001600160a01b03169063ad615dec90606401602060405180830381865afa158015611496573d6000803e3d6000fd5b505050506040513d601f19601f820116820180604052508101906114ba9190611cdf565b9050898111156114cc576114cc61188c565b8781101561151c5760405162461bcd60e51b815260206004820152601d60248201527f526f757465723a20494e53554646494349454e545f415f414d4f554e540000006044820152606401610434565b9c979b50969950505050505050505050565b604080516001600160a01b0385811660248301528481166044830152606480830185905283518084039091018152608490920183526020820180517bffffffffffffffffffffffffffffffffffffffffffffffffffffffff166323b872dd60e01b17905291516000928392908816916115a79190611d98565b6000604051808303816000865af19150503d80600081146115e4576040519150601f19603f3d011682016040523d82523d6000602084013e6115e9565b606091505b50915091508180156116135750805115806116135750808060200190518101906116139190611d1d565b6116845760405162461bcd60e51b8152602060048201526024808201527f5472616e7366657248656c7065723a205452414e534645525f46524f4d5f464160448201527f494c4544000000000000000000000000000000000000000000000000000000006064820152608401610434565b505050505050565b7f00000000000000000000000000000000000000000000000000000000000000006001600160a01b031663d0e30db0836040518263ffffffff1660e01b81526004016000604051808303818588803b1580156116e757600080fd5b505af11580156116fb573d6000803e3d6000fd5b505060405163a9059cbb60e01b81526001600160a01b038581166004830152602482018790527f000000000000000000000000000000000000000000000000000000000000000016935063a9059cbb925060440190506020604051808303816000875af1158015611770573d6000803e3d6000fd5b505050506040513d601f19601f820116820180604052508101906117949190611d1d565b6117a0576117a061188c565b5050565b604080516000808252602082019092526001600160a01b0384169083906040516117ce9190611d98565b60006040518083038185875af1925050503d806000811461180b576040519150601f19603f3d011682016040523d82523d6000602084013e611810565b606091505b50509050806118875760405162461bcd60e51b815260206004820152602360248201527f5472616e7366657248656c7065723a204554485f5452414e534645525f46414960448201527f4c454400000000000000000000000000000000000000000000000000000000006064820152608401610434565b505050565b634e487b7160e01b600052600160045260246000fd5b6001600160a01b03811681146118b757600080fd5b50565b80151581146118b757600080fd5b803560ff811681146118d957600080fd5b919050565b60008060008060008060008060008060006101608c8e03121561190057600080fd5b8b3561190b816118a2565b9a5060208c013561191b816118a2565b995060408c0135985060608c0135975060808c0135965060a08c0135611940816118a2565b955060c08c0135945060e08c0135611957816118ba565b93506119666101008d016118c8565b92506101208c013591506101408c013590509295989b509295989b9093969950565b600080600080600080600060e0888a0312156119a357600080fd5b87356119ae816118a2565b965060208801356119be816118a2565b955060408801359450606088013593506080880135925060a08801356119e3816118a2565b8092505060c0880135905092959891949750929550565b6000806000806000806000806000806000806101808d8f031215611a1d57600080fd5b8c35611a28816118a2565b9b5060208d0135611a38816118a2565b9a5060408d0135611a48816118a2565b995060608d0135985060808d0135975060a08d0135965060c08d0135611a6d816118a2565b955060e08d013594506101008d0135611a85816118ba565b9350611a946101208e016118c8565b92506101408d013591506101608d013590509295989b509295989b509295989b565b803563ffffffff811681146118d957600080fd5b600080600080600060a08688031215611ae257600080fd5b8535611aed816118a2565b945060208601359350611b0260408701611ab6565b9250611b1060608701611ab6565b91506080860135611b20816118a2565b809150509295509295909350565b600080600080600080600060e0888a031215611b4957600080fd5b8735611b54816118a2565b96506020880135611b64816118a2565b95506040880135945060608801359350611b8060808901611ab6565b9250611b8e60a08901611ab6565b915060c0880135611b9e816118a2565b8091505092959891949750929550565b600080600080600080600080610100898b031215611bcb57600080fd5b8835611bd6816118a2565b97506020890135611be6816118a2565b96506040890135611bf6816118a2565b9550606089013594506080890135935060a0890135925060c0890135611c1b816118a2565b8092505060e089013590509295985092959890939650565b60008060008060008060008060006101208a8c031215611c5257600080fd5b8935611c5d816118a2565b985060208a0135611c6d816118a2565b975060408a0135611c7d816118a2565b965060608a0135955060808a0135945060a08a0135935060c08a0135925060e08a0135611ca9816118a2565b809250506101008a013590509295985092959850929598565b600060208284031215611cd457600080fd5b8151611203816118a2565b600060208284031215611cf157600080fd5b5051919050565b600082821015611d1857634e487b7160e01b600052601160045260246000fd5b500390565b600060208284031215611d2f57600080fd5b8151611203816118ba565b60008060408385031215611d4d57600080fd5b505080516020909101519092909150565b60008060408385031215611d7157600080fd5b8251611d7c816118a2565b6020840151909250611d8d816118a2565b809150509250929050565b6000825160005b81811015611db95760208186018101518583015201611d9f565b81811115611dc8576000828501525b50919091019291505056fea2646970667358221220f95a2a37413fc625202336533e0faf53eb841f42a3d4fbf136ed389a3a01876f64736f6c634300080b0033",
  "devdoc": {
    "kind": "dev",
    "methods": {},
    "version": 1
  },
  "userdoc": {
    "kind": "user",
    "methods": {},
    "version": 1
  },
  "storageLayout": {
    "storage": [],
    "types": null
  }
}