{
  "address": "0xA51c1fc2f0D1a1b8494Ed1FE312d7C3a78Ed91C0",
  "abi": [
    {
      "inputs": [
        {
          "internalType": "address",
          "name": "_factory",
          "type": "address"
        },
        {
          "internalType": "address",
          "name": "_WETH",
          "type": "address"
        }
      ],
      "stateMutability": "nonpayable",
      "type": "constructor"
    },
    {
      "anonymous": false,
      "inputs": [
        {
          "indexed": false,
          "internalType": "address",
          "name": "pair",
          "type": "address"
        },
        {
          "indexed": false,
          "internalType": "uint256",
          "name": "amountOut",
          "type": "uint256"
        },
        {
          "indexed": false,
          "internalType": "address",
          "name": "output",
          "type": "address"
        }
      ],
      "name": "Exchange",
      "type": "event"
    },
    {
      "inputs": [],
      "name": "WETH",
      "outputs": [
        {
          "internalType": "address",
          "name": "",
          "type": "address"
        }
      ],
      "stateMutability": "view",
      "type": "function"
    },
    {
      "inputs": [],
      "name": "factory",
      "outputs": [
        {
          "internalType": "address",
          "name": "",
          "type": "address"
        }
      ],
      "stateMutability": "view",
      "type": "function"
    },
    {
      "inputs": [],
      "name": "formula",
      "outputs": [
        {
          "internalType": "address",
          "name": "",
          "type": "address"
        }
      ],
      "stateMutability": "view",
      "type": "function"
    },
    {
      "inputs": [
        {
          "components": [
            {
              "internalType": "address",
              "name": "pool",
              "type": "address"
            },
            {
              "internalType": "address",
              "name": "tokenIn",
              "type": "address"
            },
            {
              "internalType": "address",
              "name": "tokenOut",
              "type": "address"
            },
            {
              "internalType": "uint256",
              "name": "swapAmount",
              "type": "uint256"
            },
            {
              "internalType": "uint256",
              "name": "limitReturnAmount",
              "type": "uint256"
            },
            {
              "internalType": "uint256",
              "name": "maxPrice",
              "type": "uint256"
            }
          ],
          "internalType": "struct IRequiemQRouter.Swap[][]",
          "name": "swapSequences",
          "type": "tuple[][]"
        },
        {
          "internalType": "address",
          "name": "tokenIn",
          "type": "address"
        },
        {
          "internalType": "address",
          "name": "tokenOut",
          "type": "address"
        },
        {
          "internalType": "uint256",
          "name": "totalAmountIn",
          "type": "uint256"
        },
        {
          "internalType": "uint256",
          "name": "minTotalAmountOut",
          "type": "uint256"
        },
        {
          "internalType": "uint256",
          "name": "deadline",
          "type": "uint256"
        }
      ],
      "name": "multihopBatchSwapExactIn",
      "outputs": [
        {
          "internalType": "uint256",
          "name": "totalAmountOut",
          "type": "uint256"
        }
      ],
      "stateMutability": "payable",
      "type": "function"
    },
    {
      "inputs": [
        {
          "components": [
            {
              "internalType": "address",
              "name": "pool",
              "type": "address"
            },
            {
              "internalType": "address",
              "name": "tokenIn",
              "type": "address"
            },
            {
              "internalType": "address",
              "name": "tokenOut",
              "type": "address"
            },
            {
              "internalType": "uint256",
              "name": "swapAmount",
              "type": "uint256"
            },
            {
              "internalType": "uint256",
              "name": "limitReturnAmount",
              "type": "uint256"
            },
            {
              "internalType": "uint256",
              "name": "maxPrice",
              "type": "uint256"
            }
          ],
          "internalType": "struct IRequiemQRouter.Swap[][]",
          "name": "swapSequences",
          "type": "tuple[][]"
        },
        {
          "internalType": "address",
          "name": "tokenIn",
          "type": "address"
        },
        {
          "internalType": "address",
          "name": "tokenOut",
          "type": "address"
        },
        {
          "internalType": "uint256",
          "name": "maxTotalAmountIn",
          "type": "uint256"
        },
        {
          "internalType": "uint256",
          "name": "deadline",
          "type": "uint256"
        }
      ],
      "name": "multihopBatchSwapExactOut",
      "outputs": [
        {
          "internalType": "uint256",
          "name": "totalAmountIn",
          "type": "uint256"
        }
      ],
      "stateMutability": "payable",
      "type": "function"
    },
    {
      "inputs": [
        {
          "internalType": "address[]",
          "name": "pools",
          "type": "address[]"
        },
        {
          "internalType": "address[]",
          "name": "tokens",
          "type": "address[]"
        },
        {
          "internalType": "uint256",
          "name": "amountOut",
          "type": "uint256"
        },
        {
          "internalType": "address",
          "name": "to",
          "type": "address"
        },
        {
          "internalType": "uint256",
          "name": "deadline",
          "type": "uint256"
        }
      ],
      "name": "onSwapETHForExactTokens",
      "outputs": [
        {
          "internalType": "uint256[]",
          "name": "amounts",
          "type": "uint256[]"
        }
      ],
      "stateMutability": "payable",
      "type": "function"
    },
    {
      "inputs": [
        {
          "internalType": "address[]",
          "name": "pools",
          "type": "address[]"
        },
        {
          "internalType": "address[]",
          "name": "tokens",
          "type": "address[]"
        },
        {
          "internalType": "uint256",
          "name": "amountOutMin",
          "type": "uint256"
        },
        {
          "internalType": "address",
          "name": "to",
          "type": "address"
        },
        {
          "internalType": "uint256",
          "name": "deadline",
          "type": "uint256"
        }
      ],
      "name": "onSwapExactETHForTokens",
      "outputs": [
        {
          "internalType": "uint256",
          "name": "amountLast",
          "type": "uint256"
        }
      ],
      "stateMutability": "payable",
      "type": "function"
    },
    {
      "inputs": [
        {
          "internalType": "address[]",
          "name": "pools",
          "type": "address[]"
        },
        {
          "internalType": "address[]",
          "name": "tokens",
          "type": "address[]"
        },
        {
          "internalType": "uint256",
          "name": "amountIn",
          "type": "uint256"
        },
        {
          "internalType": "uint256",
          "name": "amountOutMin",
          "type": "uint256"
        },
        {
          "internalType": "address",
          "name": "to",
          "type": "address"
        },
        {
          "internalType": "uint256",
          "name": "deadline",
          "type": "uint256"
        }
      ],
      "name": "onSwapExactTokensForETH",
      "outputs": [
        {
          "internalType": "uint256",
          "name": "amountLast",
          "type": "uint256"
        }
      ],
      "stateMutability": "nonpayable",
      "type": "function"
    },
    {
      "inputs": [
        {
          "internalType": "address[]",
          "name": "pools",
          "type": "address[]"
        },
        {
          "internalType": "address[]",
          "name": "tokens",
          "type": "address[]"
        },
        {
          "internalType": "uint256",
          "name": "amountIn",
          "type": "uint256"
        },
        {
          "internalType": "uint256",
          "name": "amountOutMin",
          "type": "uint256"
        },
        {
          "internalType": "address",
          "name": "to",
          "type": "address"
        },
        {
          "internalType": "uint256",
          "name": "deadline",
          "type": "uint256"
        }
      ],
      "name": "onSwapExactTokensForTokens",
      "outputs": [
        {
          "internalType": "uint256",
          "name": "amountLast",
          "type": "uint256"
        }
      ],
      "stateMutability": "nonpayable",
      "type": "function"
    },
    {
      "inputs": [
        {
          "internalType": "address[]",
          "name": "pools",
          "type": "address[]"
        },
        {
          "internalType": "address[]",
          "name": "tokens",
          "type": "address[]"
        },
        {
          "internalType": "uint256",
          "name": "amountOut",
          "type": "uint256"
        },
        {
          "internalType": "uint256",
          "name": "amountInMax",
          "type": "uint256"
        },
        {
          "internalType": "address",
          "name": "to",
          "type": "address"
        },
        {
          "internalType": "uint256",
          "name": "deadline",
          "type": "uint256"
        }
      ],
      "name": "onSwapTokensForExactETH",
      "outputs": [
        {
          "internalType": "uint256[]",
          "name": "amounts",
          "type": "uint256[]"
        }
      ],
      "stateMutability": "nonpayable",
      "type": "function"
    },
    {
      "inputs": [
        {
          "internalType": "address[]",
          "name": "pools",
          "type": "address[]"
        },
        {
          "internalType": "address[]",
          "name": "tokens",
          "type": "address[]"
        },
        {
          "internalType": "uint256",
          "name": "amountOut",
          "type": "uint256"
        },
        {
          "internalType": "uint256",
          "name": "amountInMax",
          "type": "uint256"
        },
        {
          "internalType": "address",
          "name": "to",
          "type": "address"
        },
        {
          "internalType": "uint256",
          "name": "deadline",
          "type": "uint256"
        }
      ],
      "name": "onSwapTokensForExactTokens",
      "outputs": [
        {
          "internalType": "uint256[]",
          "name": "amounts",
          "type": "uint256[]"
        }
      ],
      "stateMutability": "nonpayable",
      "type": "function"
    },
    {
      "inputs": [
        {
          "internalType": "address",
          "name": "tokenOut",
          "type": "address"
        },
        {
          "internalType": "uint256",
          "name": "amountOut",
          "type": "uint256"
        },
        {
          "internalType": "address[]",
          "name": "path",
          "type": "address[]"
        },
        {
          "internalType": "address",
          "name": "to",
          "type": "address"
        },
        {
          "internalType": "uint256",
          "name": "deadline",
          "type": "uint256"
        }
      ],
      "name": "swapETHForExactTokens",
      "outputs": [
        {
          "internalType": "uint256[]",
          "name": "amounts",
          "type": "uint256[]"
        }
      ],
      "stateMutability": "payable",
      "type": "function"
    },
    {
      "inputs": [
        {
          "internalType": "address",
          "name": "tokenOut",
          "type": "address"
        },
        {
          "internalType": "uint256",
          "name": "amountOutMin",
          "type": "uint256"
        },
        {
          "internalType": "address[]",
          "name": "path",
          "type": "address[]"
        },
        {
          "internalType": "address",
          "name": "to",
          "type": "address"
        },
        {
          "internalType": "uint256",
          "name": "deadline",
          "type": "uint256"
        }
      ],
      "name": "swapExactETHForTokens",
      "outputs": [
        {
          "internalType": "uint256[]",
          "name": "amounts",
          "type": "uint256[]"
        }
      ],
      "stateMutability": "payable",
      "type": "function"
    },
    {
      "inputs": [
        {
          "internalType": "address",
          "name": "tokenOut",
          "type": "address"
        },
        {
          "internalType": "uint256",
          "name": "amountOutMin",
          "type": "uint256"
        },
        {
          "internalType": "address[]",
          "name": "path",
          "type": "address[]"
        },
        {
          "internalType": "address",
          "name": "to",
          "type": "address"
        },
        {
          "internalType": "uint256",
          "name": "deadline",
          "type": "uint256"
        }
      ],
      "name": "swapExactETHForTokensSupportingFeeOnTransferTokens",
      "outputs": [],
      "stateMutability": "payable",
      "type": "function"
    },
    {
      "inputs": [
        {
          "internalType": "address",
          "name": "tokenIn",
          "type": "address"
        },
        {
          "internalType": "uint256",
          "name": "amountIn",
          "type": "uint256"
        },
        {
          "internalType": "uint256",
          "name": "amountOutMin",
          "type": "uint256"
        },
        {
          "internalType": "address[]",
          "name": "path",
          "type": "address[]"
        },
        {
          "internalType": "address",
          "name": "to",
          "type": "address"
        },
        {
          "internalType": "uint256",
          "name": "deadline",
          "type": "uint256"
        }
      ],
      "name": "swapExactTokensForETH",
      "outputs": [
        {
          "internalType": "uint256[]",
          "name": "amounts",
          "type": "uint256[]"
        }
      ],
      "stateMutability": "nonpayable",
      "type": "function"
    },
    {
      "inputs": [
        {
          "internalType": "address",
          "name": "tokenIn",
          "type": "address"
        },
        {
          "internalType": "uint256",
          "name": "amountIn",
          "type": "uint256"
        },
        {
          "internalType": "uint256",
          "name": "amountOutMin",
          "type": "uint256"
        },
        {
          "internalType": "address[]",
          "name": "path",
          "type": "address[]"
        },
        {
          "internalType": "address",
          "name": "to",
          "type": "address"
        },
        {
          "internalType": "uint256",
          "name": "deadline",
          "type": "uint256"
        }
      ],
      "name": "swapExactTokensForETHSupportingFeeOnTransferTokens",
      "outputs": [],
      "stateMutability": "nonpayable",
      "type": "function"
    },
    {
      "inputs": [
        {
          "internalType": "address",
          "name": "tokenIn",
          "type": "address"
        },
        {
          "internalType": "address",
          "name": "tokenOut",
          "type": "address"
        },
        {
          "internalType": "uint256",
          "name": "amountIn",
          "type": "uint256"
        },
        {
          "internalType": "uint256",
          "name": "amountOutMin",
          "type": "uint256"
        },
        {
          "internalType": "address[]",
          "name": "path",
          "type": "address[]"
        },
        {
          "internalType": "address",
          "name": "to",
          "type": "address"
        },
        {
          "internalType": "uint256",
          "name": "deadline",
          "type": "uint256"
        }
      ],
      "name": "swapExactTokensForTokens",
      "outputs": [
        {
          "internalType": "uint256[]",
          "name": "amounts",
          "type": "uint256[]"
        }
      ],
      "stateMutability": "nonpayable",
      "type": "function"
    },
    {
      "inputs": [
        {
          "internalType": "address",
          "name": "tokenIn",
          "type": "address"
        },
        {
          "internalType": "address",
          "name": "tokenOut",
          "type": "address"
        },
        {
          "internalType": "uint256",
          "name": "amountIn",
          "type": "uint256"
        },
        {
          "internalType": "uint256",
          "name": "amountOutMin",
          "type": "uint256"
        },
        {
          "internalType": "address[]",
          "name": "path",
          "type": "address[]"
        },
        {
          "internalType": "address",
          "name": "to",
          "type": "address"
        },
        {
          "internalType": "uint256",
          "name": "deadline",
          "type": "uint256"
        }
      ],
      "name": "swapExactTokensForTokensSupportingFeeOnTransferTokens",
      "outputs": [],
      "stateMutability": "nonpayable",
      "type": "function"
    },
    {
      "inputs": [
        {
          "internalType": "address",
          "name": "tokenIn",
          "type": "address"
        },
        {
          "internalType": "uint256",
          "name": "amountOut",
          "type": "uint256"
        },
        {
          "internalType": "uint256",
          "name": "amountInMax",
          "type": "uint256"
        },
        {
          "internalType": "address[]",
          "name": "path",
          "type": "address[]"
        },
        {
          "internalType": "address",
          "name": "to",
          "type": "address"
        },
        {
          "internalType": "uint256",
          "name": "deadline",
          "type": "uint256"
        }
      ],
      "name": "swapTokensForExactETH",
      "outputs": [
        {
          "internalType": "uint256[]",
          "name": "amounts",
          "type": "uint256[]"
        }
      ],
      "stateMutability": "nonpayable",
      "type": "function"
    },
    {
      "inputs": [
        {
          "internalType": "address",
          "name": "tokenIn",
          "type": "address"
        },
        {
          "internalType": "address",
          "name": "tokenOut",
          "type": "address"
        },
        {
          "internalType": "uint256",
          "name": "amountOut",
          "type": "uint256"
        },
        {
          "internalType": "uint256",
          "name": "amountInMax",
          "type": "uint256"
        },
        {
          "internalType": "address[]",
          "name": "path",
          "type": "address[]"
        },
        {
          "internalType": "address",
          "name": "to",
          "type": "address"
        },
        {
          "internalType": "uint256",
          "name": "deadline",
          "type": "uint256"
        }
      ],
      "name": "swapTokensForExactTokens",
      "outputs": [
        {
          "internalType": "uint256[]",
          "name": "amounts",
          "type": "uint256[]"
        }
      ],
      "stateMutability": "nonpayable",
      "type": "function"
    },
    {
      "stateMutability": "payable",
      "type": "receive"
    }
  ],
  "transactionHash": "0xc89e65181e1459280eb19c18034ed92b1c534f9bc66e7d9b4d3c0b573bbe44eb",
  "receipt": {
    "to": null,
    "from": "0xf39Fd6e51aad88F6F4ce6aB8827279cffFb92266",
    "contractAddress": "0xA51c1fc2f0D1a1b8494Ed1FE312d7C3a78Ed91C0",
    "transactionIndex": 0,
    "gasUsed": "3964061",
    "logsBloom": "0x00000000000000000000000000000000000000000000000000000000000000000000000000000000000000000000000000000000000000000000000000000000000000000000000000000000000000000000000000000000000000000000000000000000000000000000000000000000000000000000000000000000000000000000000000000000000000000000000000000000000000000000000000000000000000000000000000000000000000000000000000000000000000000000000000000000000000000000000000000000000000000000000000000000000000000000000000000000000000000000000000000000000000000000000000000000",
    "blockHash": "0x8bbebbefff0978c73b21e16c86e40a6511d39c7a7fa7bd5de6a5c230fec49166",
    "transactionHash": "0xc89e65181e1459280eb19c18034ed92b1c534f9bc66e7d9b4d3c0b573bbe44eb",
    "logs": [],
    "blockNumber": 13,
    "cumulativeGasUsed": "3964061",
    "status": 1,
    "byzantium": true
  },
  "args": [
    "0x610178dA211FEF7D417bC0e6FeD39F05609AD788",
    "0xDc64a140Aa3E981100a9becA4E685f962f0cF6C9"
  ],
  "solcInputHash": "64139b767f29485ef56e10b31548e9dd",
  "metadata": "{\"compiler\":{\"version\":\"0.8.10+commit.fc410830\"},\"language\":\"Solidity\",\"output\":{\"abi\":[{\"inputs\":[{\"internalType\":\"address\",\"name\":\"_factory\",\"type\":\"address\"},{\"internalType\":\"address\",\"name\":\"_WETH\",\"type\":\"address\"}],\"stateMutability\":\"nonpayable\",\"type\":\"constructor\"},{\"anonymous\":false,\"inputs\":[{\"indexed\":false,\"internalType\":\"address\",\"name\":\"pair\",\"type\":\"address\"},{\"indexed\":false,\"internalType\":\"uint256\",\"name\":\"amountOut\",\"type\":\"uint256\"},{\"indexed\":false,\"internalType\":\"address\",\"name\":\"output\",\"type\":\"address\"}],\"name\":\"Exchange\",\"type\":\"event\"},{\"inputs\":[],\"name\":\"WETH\",\"outputs\":[{\"internalType\":\"address\",\"name\":\"\",\"type\":\"address\"}],\"stateMutability\":\"view\",\"type\":\"function\"},{\"inputs\":[],\"name\":\"factory\",\"outputs\":[{\"internalType\":\"address\",\"name\":\"\",\"type\":\"address\"}],\"stateMutability\":\"view\",\"type\":\"function\"},{\"inputs\":[],\"name\":\"formula\",\"outputs\":[{\"internalType\":\"address\",\"name\":\"\",\"type\":\"address\"}],\"stateMutability\":\"view\",\"type\":\"function\"},{\"inputs\":[{\"components\":[{\"internalType\":\"address\",\"name\":\"pool\",\"type\":\"address\"},{\"internalType\":\"address\",\"name\":\"tokenIn\",\"type\":\"address\"},{\"internalType\":\"address\",\"name\":\"tokenOut\",\"type\":\"address\"},{\"internalType\":\"uint256\",\"name\":\"swapAmount\",\"type\":\"uint256\"},{\"internalType\":\"uint256\",\"name\":\"limitReturnAmount\",\"type\":\"uint256\"},{\"internalType\":\"uint256\",\"name\":\"maxPrice\",\"type\":\"uint256\"}],\"internalType\":\"struct IRequiemQRouter.Swap[][]\",\"name\":\"swapSequences\",\"type\":\"tuple[][]\"},{\"internalType\":\"address\",\"name\":\"tokenIn\",\"type\":\"address\"},{\"internalType\":\"address\",\"name\":\"tokenOut\",\"type\":\"address\"},{\"internalType\":\"uint256\",\"name\":\"totalAmountIn\",\"type\":\"uint256\"},{\"internalType\":\"uint256\",\"name\":\"minTotalAmountOut\",\"type\":\"uint256\"},{\"internalType\":\"uint256\",\"name\":\"deadline\",\"type\":\"uint256\"}],\"name\":\"multihopBatchSwapExactIn\",\"outputs\":[{\"internalType\":\"uint256\",\"name\":\"totalAmountOut\",\"type\":\"uint256\"}],\"stateMutability\":\"payable\",\"type\":\"function\"},{\"inputs\":[{\"components\":[{\"internalType\":\"address\",\"name\":\"pool\",\"type\":\"address\"},{\"internalType\":\"address\",\"name\":\"tokenIn\",\"type\":\"address\"},{\"internalType\":\"address\",\"name\":\"tokenOut\",\"type\":\"address\"},{\"internalType\":\"uint256\",\"name\":\"swapAmount\",\"type\":\"uint256\"},{\"internalType\":\"uint256\",\"name\":\"limitReturnAmount\",\"type\":\"uint256\"},{\"internalType\":\"uint256\",\"name\":\"maxPrice\",\"type\":\"uint256\"}],\"internalType\":\"struct IRequiemQRouter.Swap[][]\",\"name\":\"swapSequences\",\"type\":\"tuple[][]\"},{\"internalType\":\"address\",\"name\":\"tokenIn\",\"type\":\"address\"},{\"internalType\":\"address\",\"name\":\"tokenOut\",\"type\":\"address\"},{\"internalType\":\"uint256\",\"name\":\"maxTotalAmountIn\",\"type\":\"uint256\"},{\"internalType\":\"uint256\",\"name\":\"deadline\",\"type\":\"uint256\"}],\"name\":\"multihopBatchSwapExactOut\",\"outputs\":[{\"internalType\":\"uint256\",\"name\":\"totalAmountIn\",\"type\":\"uint256\"}],\"stateMutability\":\"payable\",\"type\":\"function\"},{\"inputs\":[{\"internalType\":\"address[]\",\"name\":\"pools\",\"type\":\"address[]\"},{\"internalType\":\"address[]\",\"name\":\"tokens\",\"type\":\"address[]\"},{\"internalType\":\"uint256\",\"name\":\"amountOut\",\"type\":\"uint256\"},{\"internalType\":\"address\",\"name\":\"to\",\"type\":\"address\"},{\"internalType\":\"uint256\",\"name\":\"deadline\",\"type\":\"uint256\"}],\"name\":\"onSwapETHForExactTokens\",\"outputs\":[{\"internalType\":\"uint256[]\",\"name\":\"amounts\",\"type\":\"uint256[]\"}],\"stateMutability\":\"payable\",\"type\":\"function\"},{\"inputs\":[{\"internalType\":\"address[]\",\"name\":\"pools\",\"type\":\"address[]\"},{\"internalType\":\"address[]\",\"name\":\"tokens\",\"type\":\"address[]\"},{\"internalType\":\"uint256\",\"name\":\"amountOutMin\",\"type\":\"uint256\"},{\"internalType\":\"address\",\"name\":\"to\",\"type\":\"address\"},{\"internalType\":\"uint256\",\"name\":\"deadline\",\"type\":\"uint256\"}],\"name\":\"onSwapExactETHForTokens\",\"outputs\":[{\"internalType\":\"uint256\",\"name\":\"amountLast\",\"type\":\"uint256\"}],\"stateMutability\":\"payable\",\"type\":\"function\"},{\"inputs\":[{\"internalType\":\"address[]\",\"name\":\"pools\",\"type\":\"address[]\"},{\"internalType\":\"address[]\",\"name\":\"tokens\",\"type\":\"address[]\"},{\"internalType\":\"uint256\",\"name\":\"amountIn\",\"type\":\"uint256\"},{\"internalType\":\"uint256\",\"name\":\"amountOutMin\",\"type\":\"uint256\"},{\"internalType\":\"address\",\"name\":\"to\",\"type\":\"address\"},{\"internalType\":\"uint256\",\"name\":\"deadline\",\"type\":\"uint256\"}],\"name\":\"onSwapExactTokensForETH\",\"outputs\":[{\"internalType\":\"uint256\",\"name\":\"amountLast\",\"type\":\"uint256\"}],\"stateMutability\":\"nonpayable\",\"type\":\"function\"},{\"inputs\":[{\"internalType\":\"address[]\",\"name\":\"pools\",\"type\":\"address[]\"},{\"internalType\":\"address[]\",\"name\":\"tokens\",\"type\":\"address[]\"},{\"internalType\":\"uint256\",\"name\":\"amountIn\",\"type\":\"uint256\"},{\"internalType\":\"uint256\",\"name\":\"amountOutMin\",\"type\":\"uint256\"},{\"internalType\":\"address\",\"name\":\"to\",\"type\":\"address\"},{\"internalType\":\"uint256\",\"name\":\"deadline\",\"type\":\"uint256\"}],\"name\":\"onSwapExactTokensForTokens\",\"outputs\":[{\"internalType\":\"uint256\",\"name\":\"amountLast\",\"type\":\"uint256\"}],\"stateMutability\":\"nonpayable\",\"type\":\"function\"},{\"inputs\":[{\"internalType\":\"address[]\",\"name\":\"pools\",\"type\":\"address[]\"},{\"internalType\":\"address[]\",\"name\":\"tokens\",\"type\":\"address[]\"},{\"internalType\":\"uint256\",\"name\":\"amountOut\",\"type\":\"uint256\"},{\"internalType\":\"uint256\",\"name\":\"amountInMax\",\"type\":\"uint256\"},{\"internalType\":\"address\",\"name\":\"to\",\"type\":\"address\"},{\"internalType\":\"uint256\",\"name\":\"deadline\",\"type\":\"uint256\"}],\"name\":\"onSwapTokensForExactETH\",\"outputs\":[{\"internalType\":\"uint256[]\",\"name\":\"amounts\",\"type\":\"uint256[]\"}],\"stateMutability\":\"nonpayable\",\"type\":\"function\"},{\"inputs\":[{\"internalType\":\"address[]\",\"name\":\"pools\",\"type\":\"address[]\"},{\"internalType\":\"address[]\",\"name\":\"tokens\",\"type\":\"address[]\"},{\"internalType\":\"uint256\",\"name\":\"amountOut\",\"type\":\"uint256\"},{\"internalType\":\"uint256\",\"name\":\"amountInMax\",\"type\":\"uint256\"},{\"internalType\":\"address\",\"name\":\"to\",\"type\":\"address\"},{\"internalType\":\"uint256\",\"name\":\"deadline\",\"type\":\"uint256\"}],\"name\":\"onSwapTokensForExactTokens\",\"outputs\":[{\"internalType\":\"uint256[]\",\"name\":\"amounts\",\"type\":\"uint256[]\"}],\"stateMutability\":\"nonpayable\",\"type\":\"function\"},{\"inputs\":[{\"internalType\":\"address\",\"name\":\"tokenOut\",\"type\":\"address\"},{\"internalType\":\"uint256\",\"name\":\"amountOut\",\"type\":\"uint256\"},{\"internalType\":\"address[]\",\"name\":\"path\",\"type\":\"address[]\"},{\"internalType\":\"address\",\"name\":\"to\",\"type\":\"address\"},{\"internalType\":\"uint256\",\"name\":\"deadline\",\"type\":\"uint256\"}],\"name\":\"swapETHForExactTokens\",\"outputs\":[{\"internalType\":\"uint256[]\",\"name\":\"amounts\",\"type\":\"uint256[]\"}],\"stateMutability\":\"payable\",\"type\":\"function\"},{\"inputs\":[{\"internalType\":\"address\",\"name\":\"tokenOut\",\"type\":\"address\"},{\"internalType\":\"uint256\",\"name\":\"amountOutMin\",\"type\":\"uint256\"},{\"internalType\":\"address[]\",\"name\":\"path\",\"type\":\"address[]\"},{\"internalType\":\"address\",\"name\":\"to\",\"type\":\"address\"},{\"internalType\":\"uint256\",\"name\":\"deadline\",\"type\":\"uint256\"}],\"name\":\"swapExactETHForTokens\",\"outputs\":[{\"internalType\":\"uint256[]\",\"name\":\"amounts\",\"type\":\"uint256[]\"}],\"stateMutability\":\"payable\",\"type\":\"function\"},{\"inputs\":[{\"internalType\":\"address\",\"name\":\"tokenOut\",\"type\":\"address\"},{\"internalType\":\"uint256\",\"name\":\"amountOutMin\",\"type\":\"uint256\"},{\"internalType\":\"address[]\",\"name\":\"path\",\"type\":\"address[]\"},{\"internalType\":\"address\",\"name\":\"to\",\"type\":\"address\"},{\"internalType\":\"uint256\",\"name\":\"deadline\",\"type\":\"uint256\"}],\"name\":\"swapExactETHForTokensSupportingFeeOnTransferTokens\",\"outputs\":[],\"stateMutability\":\"payable\",\"type\":\"function\"},{\"inputs\":[{\"internalType\":\"address\",\"name\":\"tokenIn\",\"type\":\"address\"},{\"internalType\":\"uint256\",\"name\":\"amountIn\",\"type\":\"uint256\"},{\"internalType\":\"uint256\",\"name\":\"amountOutMin\",\"type\":\"uint256\"},{\"internalType\":\"address[]\",\"name\":\"path\",\"type\":\"address[]\"},{\"internalType\":\"address\",\"name\":\"to\",\"type\":\"address\"},{\"internalType\":\"uint256\",\"name\":\"deadline\",\"type\":\"uint256\"}],\"name\":\"swapExactTokensForETH\",\"outputs\":[{\"internalType\":\"uint256[]\",\"name\":\"amounts\",\"type\":\"uint256[]\"}],\"stateMutability\":\"nonpayable\",\"type\":\"function\"},{\"inputs\":[{\"internalType\":\"address\",\"name\":\"tokenIn\",\"type\":\"address\"},{\"internalType\":\"uint256\",\"name\":\"amountIn\",\"type\":\"uint256\"},{\"internalType\":\"uint256\",\"name\":\"amountOutMin\",\"type\":\"uint256\"},{\"internalType\":\"address[]\",\"name\":\"path\",\"type\":\"address[]\"},{\"internalType\":\"address\",\"name\":\"to\",\"type\":\"address\"},{\"internalType\":\"uint256\",\"name\":\"deadline\",\"type\":\"uint256\"}],\"name\":\"swapExactTokensForETHSupportingFeeOnTransferTokens\",\"outputs\":[],\"stateMutability\":\"nonpayable\",\"type\":\"function\"},{\"inputs\":[{\"internalType\":\"address\",\"name\":\"tokenIn\",\"type\":\"address\"},{\"internalType\":\"address\",\"name\":\"tokenOut\",\"type\":\"address\"},{\"internalType\":\"uint256\",\"name\":\"amountIn\",\"type\":\"uint256\"},{\"internalType\":\"uint256\",\"name\":\"amountOutMin\",\"type\":\"uint256\"},{\"internalType\":\"address[]\",\"name\":\"path\",\"type\":\"address[]\"},{\"internalType\":\"address\",\"name\":\"to\",\"type\":\"address\"},{\"internalType\":\"uint256\",\"name\":\"deadline\",\"type\":\"uint256\"}],\"name\":\"swapExactTokensForTokens\",\"outputs\":[{\"internalType\":\"uint256[]\",\"name\":\"amounts\",\"type\":\"uint256[]\"}],\"stateMutability\":\"nonpayable\",\"type\":\"function\"},{\"inputs\":[{\"internalType\":\"address\",\"name\":\"tokenIn\",\"type\":\"address\"},{\"internalType\":\"address\",\"name\":\"tokenOut\",\"type\":\"address\"},{\"internalType\":\"uint256\",\"name\":\"amountIn\",\"type\":\"uint256\"},{\"internalType\":\"uint256\",\"name\":\"amountOutMin\",\"type\":\"uint256\"},{\"internalType\":\"address[]\",\"name\":\"path\",\"type\":\"address[]\"},{\"internalType\":\"address\",\"name\":\"to\",\"type\":\"address\"},{\"internalType\":\"uint256\",\"name\":\"deadline\",\"type\":\"uint256\"}],\"name\":\"swapExactTokensForTokensSupportingFeeOnTransferTokens\",\"outputs\":[],\"stateMutability\":\"nonpayable\",\"type\":\"function\"},{\"inputs\":[{\"internalType\":\"address\",\"name\":\"tokenIn\",\"type\":\"address\"},{\"internalType\":\"uint256\",\"name\":\"amountOut\",\"type\":\"uint256\"},{\"internalType\":\"uint256\",\"name\":\"amountInMax\",\"type\":\"uint256\"},{\"internalType\":\"address[]\",\"name\":\"path\",\"type\":\"address[]\"},{\"internalType\":\"address\",\"name\":\"to\",\"type\":\"address\"},{\"internalType\":\"uint256\",\"name\":\"deadline\",\"type\":\"uint256\"}],\"name\":\"swapTokensForExactETH\",\"outputs\":[{\"internalType\":\"uint256[]\",\"name\":\"amounts\",\"type\":\"uint256[]\"}],\"stateMutability\":\"nonpayable\",\"type\":\"function\"},{\"inputs\":[{\"internalType\":\"address\",\"name\":\"tokenIn\",\"type\":\"address\"},{\"internalType\":\"address\",\"name\":\"tokenOut\",\"type\":\"address\"},{\"internalType\":\"uint256\",\"name\":\"amountOut\",\"type\":\"uint256\"},{\"internalType\":\"uint256\",\"name\":\"amountInMax\",\"type\":\"uint256\"},{\"internalType\":\"address[]\",\"name\":\"path\",\"type\":\"address[]\"},{\"internalType\":\"address\",\"name\":\"to\",\"type\":\"address\"},{\"internalType\":\"uint256\",\"name\":\"deadline\",\"type\":\"uint256\"}],\"name\":\"swapTokensForExactTokens\",\"outputs\":[{\"internalType\":\"uint256[]\",\"name\":\"amounts\",\"type\":\"uint256[]\"}],\"stateMutability\":\"nonpayable\",\"type\":\"function\"},{\"stateMutability\":\"payable\",\"type\":\"receive\"}],\"devdoc\":{\"kind\":\"dev\",\"methods\":{},\"version\":1},\"userdoc\":{\"kind\":\"user\",\"methods\":{},\"version\":1}},\"settings\":{\"compilationTarget\":{\"contracts/test/RequiemQRouter_flat.sol\":\"RequiemQRouter\"},\"evmVersion\":\"london\",\"libraries\":{},\"metadata\":{\"bytecodeHash\":\"ipfs\",\"useLiteralContent\":true},\"optimizer\":{\"enabled\":true,\"runs\":200},\"remappings\":[]},\"sources\":{\"contracts/test/RequiemQRouter_flat.sol\":{\"content\":\"// SPDX-License-Identifier: MIT\\n\\n// File: interfaces/IRequiemQRouter.sol\\n\\npragma solidity ^0.8.10;\\n\\ninterface IRequiemQRouter {\\n  event Exchange(address pair, uint256 amountOut, address output);\\n  struct Swap {\\n    address pool;\\n    address tokenIn;\\n    address tokenOut;\\n    uint256 swapAmount; // tokenInAmount / tokenOutAmount\\n    uint256 limitReturnAmount; // minAmountOut / maxAmountIn\\n    uint256 maxPrice;\\n  }\\n\\n  function factory() external view returns (address);\\n\\n  function formula() external view returns (address);\\n\\n  function WETH() external view returns (address);\\n\\n  function swapExactTokensForTokens(\\n    address tokenIn,\\n    address tokenOut,\\n    uint256 amountIn,\\n    uint256 amountOutMin,\\n    address[] calldata path,\\n    address to,\\n    uint256 deadline\\n  ) external returns (uint256[] memory amounts);\\n\\n  function swapTokensForExactTokens(\\n    address tokenIn,\\n    address tokenOut,\\n    uint256 amountOut,\\n    uint256 amountInMax,\\n    address[] calldata path,\\n    address to,\\n    uint256 deadline\\n  ) external returns (uint256[] memory amounts);\\n\\n  function swapExactETHForTokens(\\n    address tokenOut,\\n    uint256 amountOutMin,\\n    address[] calldata path,\\n    address to,\\n    uint256 deadline\\n  ) external payable returns (uint256[] memory amounts);\\n\\n  function swapTokensForExactETH(\\n    address tokenIn,\\n    uint256 amountOut,\\n    uint256 amountInMax,\\n    address[] calldata path,\\n    address to,\\n    uint256 deadline\\n  ) external returns (uint256[] memory amounts);\\n\\n  function swapExactTokensForETH(\\n    address tokenIn,\\n    uint256 amountIn,\\n    uint256 amountOutMin,\\n    address[] calldata path,\\n    address to,\\n    uint256 deadline\\n  ) external returns (uint256[] memory amounts);\\n\\n  function swapETHForExactTokens(\\n    address tokenOut,\\n    uint256 amountOut,\\n    address[] calldata path,\\n    address to,\\n    uint256 deadline\\n  ) external payable returns (uint256[] memory amounts);\\n\\n  function swapExactTokensForTokensSupportingFeeOnTransferTokens(\\n    address tokenIn,\\n    address tokenOut,\\n    uint256 amountIn,\\n    uint256 amountOutMin,\\n    address[] calldata path,\\n    address to,\\n    uint256 deadline\\n  ) external;\\n\\n  function swapExactETHForTokensSupportingFeeOnTransferTokens(\\n    address tokenOut,\\n    uint256 amountOutMin,\\n    address[] calldata path,\\n    address to,\\n    uint256 deadline\\n  ) external payable;\\n\\n  function swapExactTokensForETHSupportingFeeOnTransferTokens(\\n    address tokenIn,\\n    uint256 amountIn,\\n    uint256 amountOutMin,\\n    address[] calldata path,\\n    address to,\\n    uint256 deadline\\n  ) external;\\n\\n  function multihopBatchSwapExactIn(\\n    Swap[][] memory swapSequences,\\n    address tokenIn,\\n    address tokenOut,\\n    uint256 totalAmountIn,\\n    uint256 minTotalAmountOut,\\n    uint256 deadline\\n  ) external payable returns (uint256 totalAmountOut);\\n\\n  function multihopBatchSwapExactOut(\\n    Swap[][] memory swapSequences,\\n    address tokenIn,\\n    address tokenOut,\\n    uint256 maxTotalAmountIn,\\n    uint256 deadline\\n  ) external payable returns (uint256 totalAmountIn);\\n}\\n\\n// File: interfaces/ERC20/IERC20.sol\\n\\npragma solidity ^0.8.10;\\n\\n/**\\n * @dev Interface of the ERC20 standard as defined in the EIP.\\n */\\ninterface IERC20 {\\n  /**\\n   * @dev Returns the amount of tokens in existence.\\n   */\\n  function totalSupply() external view returns (uint256);\\n\\n  /**\\n   * @dev Returns the amount of tokens owned by `account`.\\n   */\\n  function balanceOf(address account) external view returns (uint256);\\n\\n  /**\\n   * @dev Moves `amount` tokens from the caller's account to `recipient`.\\n   *\\n   * Returns a boolean value indicating whether the operation succeeded.\\n   *\\n   * Emits a {Transfer} event.\\n   */\\n  function transfer(address recipient, uint256 amount) external returns (bool);\\n\\n  /**\\n   * @dev Returns the remaining number of tokens that `spender` will be\\n   * allowed to spend on behalf of `owner` through {transferFrom}. This is\\n   * zero by default.\\n   *\\n   * This value changes when {approve} or {transferFrom} are called.\\n   */\\n  function allowance(address owner, address spender)\\n    external\\n    view\\n    returns (uint256);\\n\\n  /**\\n   * @dev Sets `amount` as the allowance of `spender` over the caller's tokens.\\n   *\\n   * Returns a boolean value indicating whether the operation succeeded.\\n   *\\n   * IMPORTANT: Beware that changing an allowance with this method brings the risk\\n   * that someone may use both the old and the new allowance by unfortunate\\n   * transaction ordering. One possible solution to mitigate this race\\n   * condition is to first reduce the spender's allowance to 0 and set the\\n   * desired value afterwards:\\n   * https://github.com/ethereum/EIPs/issues/20#issuecomment-263524729\\n   *\\n   * Emits an {Approval} event.\\n   */\\n  function approve(address spender, uint256 amount) external returns (bool);\\n\\n  /**\\n   * @dev Moves `amount` tokens from `sender` to `recipient` using the\\n   * allowance mechanism. `amount` is then deducted from the caller's\\n   * allowance.\\n   *\\n   * Returns a boolean value indicating whether the operation succeeded.\\n   *\\n   * Emits a {Transfer} event.\\n   */\\n  function transferFrom(\\n    address sender,\\n    address recipient,\\n    uint256 amount\\n  ) external returns (bool);\\n\\n  /**\\n   * @dev Emitted when `value` tokens are moved from one account (`from`) to\\n   * another (`to`).\\n   *\\n   * Note that `value` may be zero.\\n   */\\n  event Transfer(address indexed from, address indexed to, uint256 value);\\n\\n  /**\\n   * @dev Emitted when the allowance of a `spender` for an `owner` is set by\\n   * a call to {approve}. `value` is the new allowance.\\n   */\\n  event Approval(address indexed owner, address indexed spender, uint256 value);\\n}\\n// File: interfaces/IWETH.sol\\n\\n// This program is free software: you can redistribute it and/or modify\\n// it under the terms of the GNU General Public License as published by\\n// the Free Software Foundation, either version 3 of the License, or\\n// (at your option) any later version.\\n\\n// This program is distributed in the hope that it will be useful,\\n// but WITHOUT ANY WARRANTY; without even the implied warranty of\\n// MERCHANTABILITY or FITNESS FOR A PARTICULAR PURPOSE.  See the\\n// GNU General Public License for more details.\\n\\n// You should have received a copy of the GNU General Public License\\n// along with this program.  If not, see <http://www.gnu.org/licenses/>.\\n\\npragma solidity ^0.8.10;\\n\\n/**\\n * @dev Interface for WETH9.\\n * See https://github.com/gnosis/canonical-weth/blob/0dd1ea3e295eef916d0c6223ec63141137d22d67/contracts/WETH9.sol\\n */\\ninterface IWETH is IERC20 {\\n  function deposit() external payable;\\n\\n  function withdraw(uint256 amount) external;\\n}\\n\\n// File: libraries/TransferHelper.sol\\n\\npragma solidity >=0.8.10;\\n\\n// solhint-disable avoid-low-level-calls, reason-string\\n\\n// helper methods for interacting with ERC20 tokens and sending ETH that do not consistently return true/false\\nlibrary TransferHelper {\\n  function safeApprove(\\n    address token,\\n    address to,\\n    uint256 value\\n  ) internal {\\n    // bytes4(keccak256(bytes(\\\"approve(address,uint256)\\\")));\\n    (bool success, bytes memory data) = token.call(\\n      abi.encodeWithSelector(0x095ea7b3, to, value)\\n    );\\n    require(\\n      success && (data.length == 0 || abi.decode(data, (bool))),\\n      \\\"TransferHelper: APPROVE_FAILED\\\"\\n    );\\n  }\\n\\n  function safeTransfer(\\n    address token,\\n    address to,\\n    uint256 value\\n  ) internal {\\n    // bytes4(keccak256(bytes(\\\"transfer(address,uint256)\\\")));\\n    (bool success, bytes memory data) = token.call(\\n      abi.encodeWithSelector(0xa9059cbb, to, value)\\n    );\\n    require(\\n      success && (data.length == 0 || abi.decode(data, (bool))),\\n      \\\"TransferHelper: TRANSFER_FAILED\\\"\\n    );\\n  }\\n\\n  function safeTransferFrom(\\n    address token,\\n    address from,\\n    address to,\\n    uint256 value\\n  ) internal {\\n    // bytes4(keccak256(bytes(\\\"transferFrom(address,address,uint256)\\\")));\\n    (bool success, bytes memory data) = token.call(\\n      abi.encodeWithSelector(0x23b872dd, from, to, value)\\n    );\\n    require(\\n      success && (data.length == 0 || abi.decode(data, (bool))),\\n      \\\"TransferHelper: TRANSFER_FROM_FAILED\\\"\\n    );\\n  }\\n\\n  function safeTransferETH(address to, uint256 value) internal {\\n    (bool success, ) = to.call{value: value}(new bytes(0));\\n    require(success, \\\"TransferHelper: ETH_TRANSFER_FAILED\\\");\\n  }\\n}\\n\\n// File: interfaces/IRequiemSwap.sol\\n\\npragma solidity ^0.8.10;\\n\\ninterface IRequiemSwap {\\n  // this funtion requires the correctly calculated amounts as input\\n  // the others are supposed to implement that calculation\\n  // no return value required since the amounts are already known\\n  function onSwap(\\n    address tokenIn,\\n    address tokenOut,\\n    uint256 amountIn,\\n    uint256 amountOut,\\n    address to\\n  ) external;\\n\\n  //\\n  function onSwapGivenIn(\\n    address tokenIn,\\n    address tokenOut,\\n    uint256 amountIn,\\n    uint256 amountOutMin,\\n    address to\\n  ) external returns (uint256);\\n\\n  function onSwapGivenOut(\\n    address tokenIn,\\n    address tokenOut,\\n    uint256 amountOut,\\n    uint256 amountInMax,\\n    address to\\n  ) external returns (uint256);\\n\\n  function calculateSwapGivenIn(\\n    address tokenIn,\\n    address tokenOut,\\n    uint256 amountIn\\n  ) external view returns (uint256);\\n\\n  function calculateSwapGivenOut(\\n    address tokenIn,\\n    address tokenOut,\\n    uint256 amountOut\\n  ) external view returns (uint256);\\n}\\n\\n// File: interfaces/IRequiemERC20.sol\\n\\npragma solidity ^0.8.10;\\n\\n// solhint-disable func-name-mixedcase\\n\\ninterface IRequiemERC20 {\\n  event Approval(address indexed owner, address indexed spender, uint256 value);\\n  event Transfer(address indexed from, address indexed to, uint256 value);\\n\\n  function name() external view returns (string memory);\\n\\n  function symbol() external view returns (string memory);\\n\\n  function decimals() external pure returns (uint8);\\n\\n  function totalSupply() external view returns (uint256);\\n\\n  function balanceOf(address owner) external view returns (uint256);\\n\\n  function allowance(address owner, address spender)\\n    external\\n    view\\n    returns (uint256);\\n\\n  function approve(address spender, uint256 value) external returns (bool);\\n\\n  function transfer(address to, uint256 value) external returns (bool);\\n\\n  function transferFrom(\\n    address from,\\n    address to,\\n    uint256 value\\n  ) external returns (bool);\\n\\n  function DOMAIN_SEPARATOR() external view returns (bytes32);\\n\\n  function PERMIT_TYPEHASH() external pure returns (bytes32);\\n\\n  function nonces(address owner) external view returns (uint256);\\n\\n  function permit(\\n    address owner,\\n    address spender,\\n    uint256 value,\\n    uint256 deadline,\\n    uint8 v,\\n    bytes32 r,\\n    bytes32 s\\n  ) external;\\n}\\n\\n// File: interfaces/IRequiemPair.sol\\n\\npragma solidity ^0.8.10;\\n\\n// solhint-disable func-name-mixedcase\\n\\ninterface IRequiemPair is IRequiemERC20 {\\n  event PaidProtocolFee(uint112 collectedFee0, uint112 collectedFee1);\\n  event Mint(address indexed sender, uint256 amount0, uint256 amount1);\\n  event Burn(\\n    address indexed sender,\\n    uint256 amount0,\\n    uint256 amount1,\\n    address indexed to\\n  );\\n  event Swap(\\n    address indexed sender,\\n    uint256 amount0In,\\n    uint256 amount1In,\\n    uint256 amount0Out,\\n    uint256 amount1Out,\\n    address indexed to\\n  );\\n  event Sync(uint112 reserve0, uint112 reserve1);\\n\\n  function MINIMUM_LIQUIDITY() external pure returns (uint256);\\n\\n  function factory() external view returns (address);\\n\\n  function token0() external view returns (address);\\n\\n  function token1() external view returns (address);\\n\\n  function getReserves()\\n    external\\n    view\\n    returns (\\n      uint112 reserve0,\\n      uint112 reserve1,\\n      uint32 blockTimestampLast\\n    );\\n\\n  function getCollectedFees()\\n    external\\n    view\\n    returns (uint112 _collectedFee0, uint112 _collectedFee1);\\n\\n  function getTokenWeights()\\n    external\\n    view\\n    returns (uint32 tokenWeight0, uint32 tokenWeight1);\\n\\n  function getSwapFee() external view returns (uint32);\\n\\n  function price0CumulativeLast() external view returns (uint256);\\n\\n  function price1CumulativeLast() external view returns (uint256);\\n\\n  function mint(address to) external returns (uint256 liquidity);\\n\\n  function burn(address to) external returns (uint256 amount0, uint256 amount1);\\n\\n  function swap(\\n    uint256 amount0Out,\\n    uint256 amount1Out,\\n    address to,\\n    bytes calldata data\\n  ) external;\\n\\n  function skim(address to) external;\\n\\n  function sync() external;\\n\\n  function initialize(\\n    address,\\n    address,\\n    uint32,\\n    uint32\\n  ) external;\\n}\\n\\n// File: interfaces/IRequiemFormula.sol\\n\\npragma solidity >=0.8.10;\\n\\n/*\\n    Bancor Formula interface\\n*/\\ninterface IRequiemFormula {\\n  function getReserveAndWeights(address pair, address tokenA)\\n    external\\n    view\\n    returns (\\n      address tokenB,\\n      uint256 reserveA,\\n      uint256 reserveB,\\n      uint32 tokenWeightA,\\n      uint32 tokenWeightB,\\n      uint32 swapFee\\n    );\\n\\n  function getFactoryReserveAndWeights(\\n    address factory,\\n    address pair,\\n    address tokenA\\n  )\\n    external\\n    view\\n    returns (\\n      address tokenB,\\n      uint256 reserveA,\\n      uint256 reserveB,\\n      uint32 tokenWeightA,\\n      uint32 tokenWeightB,\\n      uint32 swapFee\\n    );\\n\\n  function getAmountIn(\\n    uint256 amountOut,\\n    uint256 reserveIn,\\n    uint256 reserveOut,\\n    uint32 tokenWeightIn,\\n    uint32 tokenWeightOut,\\n    uint32 swapFee\\n  ) external view returns (uint256 amountIn);\\n\\n  function getPairAmountIn(\\n    address pair,\\n    address tokenIn,\\n    uint256 amountOut\\n  ) external view returns (uint256 amountIn);\\n\\n  function getAmountOut(\\n    uint256 amountIn,\\n    uint256 reserveIn,\\n    uint256 reserveOut,\\n    uint32 tokenWeightIn,\\n    uint32 tokenWeightOut,\\n    uint32 swapFee\\n  ) external view returns (uint256 amountOut);\\n\\n  function getPairAmountOut(\\n    address pair,\\n    address tokenIn,\\n    uint256 amountIn\\n  ) external view returns (uint256 amountOut);\\n\\n  function getAmountsIn(\\n    address tokenIn,\\n    address tokenOut,\\n    uint256 amountOut,\\n    address[] calldata path\\n  ) external view returns (uint256[] memory amounts);\\n\\n  function getFactoryAmountsIn(\\n    address factory,\\n    address tokenIn,\\n    address tokenOut,\\n    uint256 amountOut,\\n    address[] calldata path\\n  ) external view returns (uint256[] memory amounts);\\n\\n  function getAmountsOut(\\n    address tokenIn,\\n    address tokenOut,\\n    uint256 amountIn,\\n    address[] calldata path\\n  ) external view returns (uint256[] memory amounts);\\n\\n  function getFactoryAmountsOut(\\n    address factory,\\n    address tokenIn,\\n    address tokenOut,\\n    uint256 amountIn,\\n    address[] calldata path\\n  ) external view returns (uint256[] memory amounts);\\n\\n  function ensureConstantValue(\\n    uint256 reserve0,\\n    uint256 reserve1,\\n    uint256 balance0Adjusted,\\n    uint256 balance1Adjusted,\\n    uint32 tokenWeight0\\n  ) external view returns (bool);\\n\\n  function getReserves(\\n    address pair,\\n    address tokenA,\\n    address tokenB\\n  ) external view returns (uint256 reserveA, uint256 reserveB);\\n\\n  function getOtherToken(address pair, address tokenA)\\n    external\\n    view\\n    returns (address tokenB);\\n\\n  function quote(\\n    uint256 amountA,\\n    uint256 reserveA,\\n    uint256 reserveB\\n  ) external pure returns (uint256 amountB);\\n\\n  function sortTokens(address tokenA, address tokenB)\\n    external\\n    pure\\n    returns (address token0, address token1);\\n\\n  function mintLiquidityFee(\\n    uint256 totalLiquidity,\\n    uint112 reserve0,\\n    uint112 reserve1,\\n    uint32 tokenWeight0,\\n    uint32 tokenWeight1,\\n    uint112 collectedFee0,\\n    uint112 collectedFee1\\n  ) external view returns (uint256 amount);\\n}\\n\\n// File: interfaces/IRequiemFactory.sol\\n\\npragma solidity >=0.5.16;\\n\\ninterface IRequiemFactory {\\n  event PairCreated(\\n    address indexed token0,\\n    address indexed token1,\\n    address pair,\\n    uint32 tokenWeight0,\\n    uint32 swapFee,\\n    uint256\\n  );\\n\\n  function feeTo() external view returns (address);\\n\\n  function formula() external view returns (address);\\n\\n  function protocolFee() external view returns (uint256);\\n\\n  function feeToSetter() external view returns (address);\\n\\n  function getPair(\\n    address tokenA,\\n    address tokenB,\\n    uint32 tokenWeightA,\\n    uint32 swapFee\\n  ) external view returns (address pair);\\n\\n  function allPairs(uint256) external view returns (address pair);\\n\\n  function isPair(address) external view returns (bool);\\n\\n  function allPairsLength() external view returns (uint256);\\n\\n  function createPair(\\n    address tokenA,\\n    address tokenB,\\n    uint32 tokenWeightA,\\n    uint32 swapFee\\n  ) external returns (address pair);\\n\\n  function getWeightsAndSwapFee(address pair)\\n    external\\n    view\\n    returns (\\n      uint32 tokenWeight0,\\n      uint32 tokenWeight1,\\n      uint32 swapFee\\n    );\\n\\n  function setFeeTo(address) external;\\n\\n  function setFeeToSetter(address) external;\\n\\n  function setProtocolFee(uint256) external;\\n}\\n\\n// File: RequiemQRouter.sol\\n\\npragma solidity >=0.8.10;\\n\\n// solhint-disable not-rely-on-time, var-name-mixedcase, max-line-length, reason-string\\n\\ncontract RequiemQRouter is IRequiemQRouter {\\n  address public immutable override factory;\\n  address public immutable override formula;\\n  address public immutable override WETH;\\n  address private constant ETH_ADDRESS =\\n    address(0xEeeeeEeeeEeEeeEeEeEeeEEEeeeeEeeeeeeeEEeE);\\n\\n  modifier ensure(uint256 deadline) {\\n    require(deadline >= block.timestamp, \\\"Router: EXPIRED\\\");\\n    _;\\n  }\\n\\n  constructor(address _factory, address _WETH) {\\n    factory = _factory;\\n    formula = IRequiemFactory(_factory).formula();\\n    WETH = _WETH;\\n  }\\n\\n  receive() external payable {\\n    assert(msg.sender == WETH);\\n    // only accept ETH via fallback from the WETH contract\\n  }\\n\\n  // **** SWAP ****\\n  // requires the initial amount to have already been sent to the first pair\\n  function _swap(\\n    address tokenIn,\\n    uint256[] memory amounts,\\n    address[] memory path,\\n    address _to\\n  ) internal virtual {\\n    address input = tokenIn;\\n    for (uint256 i = 0; i < path.length; i++) {\\n      IRequiemPair pairV2 = IRequiemPair(path[i]);\\n      address token0 = pairV2.token0();\\n      uint256 amountOut = amounts[i + 1];\\n      (uint256 amount0Out, uint256 amount1Out, address output) = input == token0\\n        ? (uint256(0), amountOut, pairV2.token1())\\n        : (amountOut, uint256(0), token0);\\n      address to = i < path.length - 1 ? path[i + 1] : _to;\\n      pairV2.swap(amount0Out, amount1Out, to, new bytes(0));\\n      emit Exchange(address(pairV2), amountOut, output);\\n      input = output;\\n    }\\n  }\\n\\n  function swapExactTokensForTokens(\\n    address tokenIn,\\n    address tokenOut,\\n    uint256 amountIn,\\n    uint256 amountOutMin,\\n    address[] memory path,\\n    address to,\\n    uint256 deadline\\n  )\\n    public\\n    virtual\\n    override\\n    ensure(deadline)\\n    returns (uint256[] memory amounts)\\n  {\\n    amounts = _validateAmountOut(\\n      tokenIn,\\n      tokenOut,\\n      amountIn,\\n      amountOutMin,\\n      path\\n    );\\n    TransferHelper.safeTransferFrom(tokenIn, msg.sender, path[0], amounts[0]);\\n    _swap(tokenIn, amounts, path, to);\\n  }\\n\\n  // the onSwap functions are designed to include the stable swap\\n  // it currenty only allows exactIn structures\\n  function onSwapExactTokensForTokens(\\n    address[] memory pools,\\n    address[] memory tokens,\\n    uint256 amountIn,\\n    uint256 amountOutMin,\\n    address to,\\n    uint256 deadline\\n  ) public virtual ensure(deadline) returns (uint256 amountLast) {\\n    amountLast = amountIn;\\n    TransferHelper.safeTransferFrom(tokens[0], msg.sender, pools[0], amountIn);\\n    for (uint256 i = 0; i < pools.length; i++) {\\n      address _to = i == pools.length - 1 ? to : pools[i + 1];\\n      amountLast = IRequiemSwap(pools[i]).onSwapGivenIn(\\n        tokens[i],\\n        tokens[i + 1],\\n        amountLast,\\n        0,\\n        _to\\n      );\\n    }\\n    require(amountOutMin <= amountLast, \\\"INSUFFICIENT_OUTPUT\\\");\\n  }\\n\\n  function onSwapExactETHForTokens(\\n    address[] memory pools,\\n    address[] memory tokens,\\n    uint256 amountOutMin,\\n    address to,\\n    uint256 deadline\\n  ) external payable virtual ensure(deadline) returns (uint256 amountLast) {\\n    amountLast = msg.value;\\n    transferETHTo(msg.value, pools[0]);\\n    for (uint256 i = 0; i < pools.length; i++) {\\n      address _to = i == pools.length - 1 ? to : pools[i + 1];\\n      amountLast = IRequiemSwap(pools[i]).onSwapGivenIn(\\n        tokens[i],\\n        tokens[i + 1],\\n        amountLast,\\n        0,\\n        _to\\n      );\\n    }\\n    require(amountOutMin <= amountLast, \\\"INSUFFICIENT_OUTPUT\\\");\\n  }\\n\\n  function onSwapExactTokensForETH(\\n    address[] memory pools,\\n    address[] memory tokens,\\n    uint256 amountIn,\\n    uint256 amountOutMin,\\n    address to,\\n    uint256 deadline\\n  ) external virtual ensure(deadline) returns (uint256 amountLast) {\\n    amountLast = amountIn;\\n    TransferHelper.safeTransferFrom(tokens[0], msg.sender, pools[0], amountIn);\\n    for (uint256 i = 0; i < pools.length; i++) {\\n      address _to = i == pools.length - 1 ? address(this) : pools[i + 1];\\n      amountLast = IRequiemSwap(pools[i]).onSwapGivenIn(\\n        tokens[i],\\n        tokens[i + 1],\\n        amountLast,\\n        0,\\n        _to\\n      );\\n    }\\n    require(amountOutMin <= amountLast, \\\"INSUFFICIENT_OUTPUT\\\");\\n    transferAll(ETH_ADDRESS, to, amountLast);\\n  }\\n\\n  // direct swap function for given exact output\\n  function onSwapTokensForExactTokens(\\n    address[] memory pools,\\n    address[] memory tokens,\\n    uint256 amountOut,\\n    uint256 amountInMax,\\n    address to,\\n    uint256 deadline\\n  ) external virtual ensure(deadline) returns (uint256[] memory amounts) {\\n    // set amount array\\n    amounts = new uint256[](tokens.length);\\n    amounts[pools.length] = amountOut;\\n\\n    // calculate all amounts to be sent and recieved\\n    for (uint256 i = amounts.length - 1; i > 0; i--) {\\n      amounts[i - 1] = IRequiemSwap(pools[i - 1]).calculateSwapGivenOut(\\n        tokens[i - 1],\\n        tokens[i],\\n        amounts[i]\\n      );\\n    }\\n\\n    // check input condition\\n    require(amounts[0] <= amountInMax, \\\"EXCESSIVE_INPUT\\\");\\n\\n    // tranfer amounts\\n    TransferHelper.safeTransferFrom(\\n      tokens[0],\\n      msg.sender,\\n      pools[0],\\n      amounts[0]\\n    );\\n\\n    // use general swap functions that do not execute the full calculation to save gas\\n    for (uint256 i = 0; i < pools.length; i++) {\\n      address _to = i == pools.length - 1 ? to : pools[i + 1];\\n      IRequiemSwap(pools[i]).onSwap(\\n        tokens[i],\\n        tokens[i + 1],\\n        amounts[i],\\n        amounts[i + 1],\\n        _to\\n      );\\n    }\\n  }\\n\\n  function onSwapETHForExactTokens(\\n    address[] memory pools,\\n    address[] memory tokens,\\n    uint256 amountOut,\\n    address to,\\n    uint256 deadline\\n  )\\n    external\\n    payable\\n    virtual\\n    ensure(deadline)\\n    returns (uint256[] memory amounts)\\n  {\\n    amounts = new uint256[](tokens.length);\\n    amounts[pools.length] = amountOut;\\n    for (uint256 i = amounts.length - 1; i > 0; i--) {\\n      amounts[i - 1] = IRequiemSwap(pools[i - 1]).calculateSwapGivenOut(\\n        tokens[i - 1],\\n        tokens[i],\\n        amounts[i]\\n      );\\n    }\\n\\n    require(amounts[0] <= msg.value, \\\"EXCESSIVE_INPUT\\\");\\n\\n    transferETHTo(amounts[0], pools[0]);\\n    for (uint256 i = 0; i < pools.length; i++) {\\n      address _to = i == pools.length - 1 ? to : pools[i + 1];\\n      IRequiemSwap(pools[i]).onSwap(\\n        tokens[i],\\n        tokens[i + 1],\\n        amounts[i],\\n        amounts[i + 1],\\n        _to\\n      );\\n    }\\n    // refund dust eth, if any\\n    if (msg.value > amounts[0])\\n      TransferHelper.safeTransferETH(msg.sender, msg.value - amounts[0]);\\n  }\\n\\n  function onSwapTokensForExactETH(\\n    address[] memory pools,\\n    address[] memory tokens,\\n    uint256 amountOut,\\n    uint256 amountInMax,\\n    address to,\\n    uint256 deadline\\n  ) external virtual ensure(deadline) returns (uint256[] memory amounts) {\\n    amounts = new uint256[](tokens.length);\\n    amounts[pools.length] = amountOut;\\n    for (uint256 i = amounts.length - 1; i > 0; i--) {\\n      amounts[i - 1] = IRequiemSwap(pools[i - 1]).calculateSwapGivenOut(\\n        tokens[i - 1],\\n        tokens[i],\\n        amounts[i]\\n      );\\n    }\\n\\n    require(amounts[0] <= amountInMax, \\\"EXCESSIVE_INPUT\\\");\\n    TransferHelper.safeTransferFrom(\\n      tokens[0],\\n      msg.sender,\\n      pools[0],\\n      amounts[0]\\n    );\\n    for (uint256 i = 0; i < pools.length; i++) {\\n      address _to = i == pools.length - 1 ? address(this) : pools[i + 1];\\n      IRequiemSwap(pools[i]).onSwap(\\n        tokens[i],\\n        tokens[i + 1],\\n        amounts[i],\\n        amounts[i + 1],\\n        _to\\n      );\\n    }\\n\\n    transferAll(ETH_ADDRESS, to, amountOut);\\n  }\\n\\n  function swapTokensForExactTokens(\\n    address tokenIn,\\n    address tokenOut,\\n    uint256 amountOut,\\n    uint256 amountInMax,\\n    address[] calldata path,\\n    address to,\\n    uint256 deadline\\n  )\\n    external\\n    virtual\\n    override\\n    ensure(deadline)\\n    returns (uint256[] memory amounts)\\n  {\\n    amounts = _validateAmountIn(\\n      tokenIn,\\n      tokenOut,\\n      amountOut,\\n      amountInMax,\\n      path\\n    );\\n\\n    TransferHelper.safeTransferFrom(tokenIn, msg.sender, path[0], amounts[0]);\\n    _swap(tokenIn, amounts, path, to);\\n  }\\n\\n  function swapExactETHForTokens(\\n    address tokenOut,\\n    uint256 amountOutMin,\\n    address[] calldata path,\\n    address to,\\n    uint256 deadline\\n  )\\n    external\\n    payable\\n    virtual\\n    override\\n    ensure(deadline)\\n    returns (uint256[] memory amounts)\\n  {\\n    amounts = _validateAmountOut(WETH, tokenOut, msg.value, amountOutMin, path);\\n\\n    transferETHTo(amounts[0], path[0]);\\n    _swap(WETH, amounts, path, to);\\n  }\\n\\n  function swapTokensForExactETH(\\n    address tokenIn,\\n    uint256 amountOut,\\n    uint256 amountInMax,\\n    address[] calldata path,\\n    address to,\\n    uint256 deadline\\n  )\\n    external\\n    virtual\\n    override\\n    ensure(deadline)\\n    returns (uint256[] memory amounts)\\n  {\\n    amounts = _validateAmountIn(tokenIn, WETH, amountOut, amountInMax, path);\\n\\n    TransferHelper.safeTransferFrom(tokenIn, msg.sender, path[0], amounts[0]);\\n    _swap(tokenIn, amounts, path, address(this));\\n    transferAll(ETH_ADDRESS, to, amounts[amounts.length - 1]);\\n  }\\n\\n  function swapExactTokensForETH(\\n    address tokenIn,\\n    uint256 amountIn,\\n    uint256 amountOutMin,\\n    address[] calldata path,\\n    address to,\\n    uint256 deadline\\n  )\\n    external\\n    virtual\\n    override\\n    ensure(deadline)\\n    returns (uint256[] memory amounts)\\n  {\\n    amounts = _validateAmountOut(tokenIn, WETH, amountIn, amountOutMin, path);\\n\\n    TransferHelper.safeTransferFrom(tokenIn, msg.sender, path[0], amounts[0]);\\n    _swap(tokenIn, amounts, path, address(this));\\n    transferAll(ETH_ADDRESS, to, amounts[amounts.length - 1]);\\n  }\\n\\n  function swapETHForExactTokens(\\n    address tokenOut,\\n    uint256 amountOut,\\n    address[] calldata path,\\n    address to,\\n    uint256 deadline\\n  )\\n    external\\n    payable\\n    virtual\\n    override\\n    ensure(deadline)\\n    returns (uint256[] memory amounts)\\n  {\\n    amounts = _validateAmountIn(WETH, tokenOut, amountOut, msg.value, path);\\n\\n    transferETHTo(amounts[0], path[0]);\\n    _swap(WETH, amounts, path, to);\\n    // refund dust eth, if any\\n    if (msg.value > amounts[0])\\n      TransferHelper.safeTransferETH(msg.sender, msg.value - amounts[0]);\\n  }\\n\\n  // **** SWAP (supporting fee-on-transfer tokens) ****\\n  // requires the initial amount to have already been sent to the first pair\\n  function _swapSupportingFeeOnTransferTokens(\\n    address tokenIn,\\n    address[] memory path,\\n    address _to\\n  ) internal virtual {\\n    address input = tokenIn;\\n    for (uint256 i; i < path.length; i++) {\\n      IRequiemPair pair = IRequiemPair(path[i]);\\n      uint256 amountInput;\\n      uint256 amountOutput;\\n      address currentOutput;\\n      {\\n        (\\n          address output,\\n          uint256 reserveInput,\\n          uint256 reserveOutput,\\n          uint32 tokenWeightInput,\\n          uint32 tokenWeightOutput,\\n          uint32 swapFee\\n        ) = IRequiemFormula(formula).getFactoryReserveAndWeights(\\n            factory,\\n            address(pair),\\n            input\\n          );\\n        amountInput = IERC20(input).balanceOf(address(pair)) - reserveInput;\\n        amountOutput = IRequiemFormula(formula).getAmountOut(\\n          amountInput,\\n          reserveInput,\\n          reserveOutput,\\n          tokenWeightInput,\\n          tokenWeightOutput,\\n          swapFee\\n        );\\n        currentOutput = output;\\n      }\\n      (uint256 amount0Out, uint256 amount1Out) = input == pair.token0()\\n        ? (uint256(0), amountOutput)\\n        : (amountOutput, uint256(0));\\n      address to = i < path.length - 1 ? path[i + 1] : _to;\\n      pair.swap(amount0Out, amount1Out, to, new bytes(0));\\n      emit Exchange(address(pair), amountOutput, currentOutput);\\n      input = currentOutput;\\n    }\\n  }\\n\\n  function swapExactTokensForTokensSupportingFeeOnTransferTokens(\\n    address tokenIn,\\n    address tokenOut,\\n    uint256 amountIn,\\n    uint256 amountOutMin,\\n    address[] calldata path,\\n    address to,\\n    uint256 deadline\\n  ) external virtual override ensure(deadline) {\\n    TransferHelper.safeTransferFrom(tokenIn, msg.sender, path[0], amountIn);\\n    uint256 balanceBefore = IERC20(tokenOut).balanceOf(to);\\n    _swapSupportingFeeOnTransferTokens(tokenIn, path, to);\\n    require(\\n      IERC20(tokenOut).balanceOf(to) - balanceBefore >= amountOutMin,\\n      \\\"Router: INSUFFICIENT_OUTPUT_AMOUNT\\\"\\n    );\\n  }\\n\\n  function swapExactETHForTokensSupportingFeeOnTransferTokens(\\n    address tokenOut,\\n    uint256 amountOutMin,\\n    address[] calldata path,\\n    address to,\\n    uint256 deadline\\n  ) external payable virtual override ensure(deadline) {\\n    //            require(path[0] == WETH, \\\"Router: INVALID_PATH\\\");\\n    uint256 amountIn = msg.value;\\n    transferETHTo(amountIn, path[0]);\\n    uint256 balanceBefore = IERC20(tokenOut).balanceOf(to);\\n    _swapSupportingFeeOnTransferTokens(WETH, path, to);\\n    require(\\n      IERC20(tokenOut).balanceOf(to) - balanceBefore >= amountOutMin,\\n      \\\"Router: INSUFFICIENT_OUTPUT_AMOUNT\\\"\\n    );\\n  }\\n\\n  function swapExactTokensForETHSupportingFeeOnTransferTokens(\\n    address tokenIn,\\n    uint256 amountIn,\\n    uint256 amountOutMin,\\n    address[] calldata path,\\n    address to,\\n    uint256 deadline\\n  ) external virtual override ensure(deadline) {\\n    TransferHelper.safeTransferFrom(tokenIn, msg.sender, path[0], amountIn);\\n    _swapSupportingFeeOnTransferTokens(tokenIn, path, address(this));\\n    uint256 amountOut = IERC20(WETH).balanceOf(address(this));\\n    require(amountOut >= amountOutMin, \\\"Router: INSUFFICIENT_OUTPUT_AMOUNT\\\");\\n    transferAll(ETH_ADDRESS, to, amountOut);\\n  }\\n\\n  function multihopBatchSwapExactIn(\\n    Swap[][] memory swapSequences,\\n    address tokenIn,\\n    address tokenOut,\\n    uint256 totalAmountIn,\\n    uint256 minTotalAmountOut,\\n    uint256 deadline\\n  )\\n    public\\n    payable\\n    virtual\\n    override\\n    ensure(deadline)\\n    returns (uint256 totalAmountOut)\\n  {\\n    transferFromAll(tokenIn, totalAmountIn);\\n    uint256 balanceBefore;\\n    if (!isETH(tokenOut)) {\\n      balanceBefore = IERC20(tokenOut).balanceOf(msg.sender);\\n    }\\n\\n    for (uint256 i = 0; i < swapSequences.length; i++) {\\n      uint256 tokenAmountOut;\\n      for (uint256 k = 0; k < swapSequences[i].length; k++) {\\n        Swap memory swap = swapSequences[i][k];\\n        if (k > 0) {\\n          // Makes sure that on the second swap the output of the first was used\\n          // so there is not intermediate token leftover\\n          swap.swapAmount = tokenAmountOut;\\n        }\\n        tokenAmountOut = _swapSingleSupportFeeOnTransferTokens(\\n          swap.tokenIn,\\n          swap.tokenOut,\\n          swap.pool,\\n          swap.swapAmount,\\n          swap.limitReturnAmount\\n        );\\n      }\\n\\n      // This takes the amountOut of the last swap\\n      tokenAmountOut += totalAmountOut;\\n    }\\n\\n    transferAll(tokenOut, msg.sender, totalAmountOut);\\n    transferAll(tokenIn, msg.sender, getBalance(tokenIn));\\n\\n    if (isETH(tokenOut)) {\\n      require(totalAmountOut >= minTotalAmountOut, \\\"ERR_LIMIT_OUT\\\");\\n    } else {\\n      require(\\n        IERC20(tokenOut).balanceOf(msg.sender) - balanceBefore >=\\n          minTotalAmountOut,\\n        \\\"<minTotalAmountOut\\\"\\n      );\\n    }\\n  }\\n\\n  function multihopBatchSwapExactOut(\\n    Swap[][] memory swapSequences,\\n    address tokenIn,\\n    address tokenOut,\\n    uint256 maxTotalAmountIn,\\n    uint256 deadline\\n  )\\n    public\\n    payable\\n    virtual\\n    override\\n    ensure(deadline)\\n    returns (uint256 totalAmountIn)\\n  {\\n    transferFromAll(tokenIn, maxTotalAmountIn);\\n\\n    for (uint256 i = 0; i < swapSequences.length; i++) {\\n      uint256 tokenAmountInFirstSwap;\\n      // Specific code for a simple swap and a multihop (2 swaps in sequence)\\n      if (swapSequences[i].length == 1) {\\n        Swap memory swap = swapSequences[i][0];\\n        tokenAmountInFirstSwap = _swapSingleMixOut(\\n          swap.tokenIn,\\n          swap.tokenOut,\\n          swap.pool,\\n          swap.swapAmount,\\n          swap.limitReturnAmount\\n        );\\n      } else {\\n        // Consider we are swapping A -> B and B -> C. The goal is to buy a given amount\\n        // of token C. But first we need to buy B with A so we can then buy C with B\\n        // To get the exact amount of C we then first need to calculate how much B we\\\"ll need:\\n        uint256 intermediateTokenAmount;\\n        // This would be token B as described above\\n        Swap memory secondSwap = swapSequences[i][1];\\n        {\\n          address[] memory paths = new address[](1);\\n          paths[0] = secondSwap.pool;\\n          uint256[] memory amounts = IRequiemFormula(formula)\\n            .getFactoryAmountsIn(\\n              factory,\\n              secondSwap.tokenIn,\\n              secondSwap.tokenOut,\\n              secondSwap.swapAmount,\\n              paths\\n            );\\n          intermediateTokenAmount = amounts[0];\\n          require(\\n            intermediateTokenAmount <= secondSwap.limitReturnAmount,\\n            \\\"Router: EXCESSIVE_INPUT_AMOUNT\\\"\\n          );\\n        }\\n\\n        //// Buy intermediateTokenAmount of token B with A in the first pool\\n        Swap memory firstSwap = swapSequences[i][0];\\n        tokenAmountInFirstSwap = _swapSingleMixOut(\\n          firstSwap.tokenIn,\\n          firstSwap.tokenOut,\\n          firstSwap.pool,\\n          intermediateTokenAmount,\\n          firstSwap.limitReturnAmount\\n        );\\n\\n        //// Buy the final amount of token C desired\\n        _swapSingle(\\n          secondSwap.tokenIn,\\n          secondSwap.pool,\\n          intermediateTokenAmount,\\n          secondSwap.swapAmount\\n        );\\n      }\\n\\n      totalAmountIn += tokenAmountInFirstSwap;\\n    }\\n\\n    require(totalAmountIn <= maxTotalAmountIn, \\\"ERR_LIMIT_IN\\\");\\n\\n    transferAll(tokenOut, msg.sender, getBalance(tokenOut));\\n    transferAll(tokenIn, msg.sender, getBalance(tokenIn));\\n  }\\n\\n  function transferFromAll(address token, uint256 amount)\\n    internal\\n    returns (bool)\\n  {\\n    if (isETH(token)) {\\n      IWETH(WETH).deposit{value: msg.value}();\\n    } else {\\n      TransferHelper.safeTransferFrom(token, msg.sender, address(this), amount);\\n    }\\n    return true;\\n  }\\n\\n  function getBalance(address token) internal view returns (uint256) {\\n    if (isETH(token)) {\\n      return IWETH(WETH).balanceOf(address(this));\\n    } else {\\n      return IERC20(token).balanceOf(address(this));\\n    }\\n  }\\n\\n  function _swapSingleMixOut(\\n    address tokenIn,\\n    address tokenOut,\\n    address pool,\\n    uint256 swapAmount,\\n    uint256 limitReturnAmount\\n  ) internal returns (uint256 tokenAmountIn) {\\n    address[] memory paths = new address[](1);\\n    paths[0] = pool;\\n    uint256[] memory amounts = IRequiemFormula(formula).getFactoryAmountsIn(\\n      factory,\\n      tokenIn,\\n      tokenOut,\\n      swapAmount,\\n      paths\\n    );\\n    tokenAmountIn = amounts[0];\\n    require(\\n      tokenAmountIn <= limitReturnAmount,\\n      \\\"Router: EXCESSIVE_INPUT_AMOUNT\\\"\\n    );\\n    _swapSingle(tokenIn, pool, tokenAmountIn, amounts[1]);\\n  }\\n\\n  function _swapSingle(\\n    address tokenIn,\\n    address pair,\\n    uint256 targetSwapAmount,\\n    uint256 targetOutAmount\\n  ) internal {\\n    TransferHelper.safeTransfer(tokenIn, pair, targetSwapAmount);\\n    IRequiemPair pairV2 = IRequiemPair(pair);\\n    address token0 = pairV2.token0();\\n\\n    (uint256 amount0Out, uint256 amount1Out, address output) = tokenIn == token0\\n      ? (uint256(0), targetOutAmount, pairV2.token1())\\n      : (targetOutAmount, uint256(0), token0);\\n    pairV2.swap(amount0Out, amount1Out, address(this), new bytes(0));\\n\\n    emit Exchange(pair, targetOutAmount, output);\\n  }\\n\\n  function _swapSingleSupportFeeOnTransferTokens(\\n    address tokenIn,\\n    address tokenOut,\\n    address pool,\\n    uint256 swapAmount,\\n    uint256 limitReturnAmount\\n  ) internal returns (uint256 tokenAmountOut) {\\n    TransferHelper.safeTransfer(tokenIn, pool, swapAmount);\\n\\n    uint256 amountOutput;\\n    {\\n      (\\n        ,\\n        uint256 reserveInput,\\n        uint256 reserveOutput,\\n        uint32 tokenWeightInput,\\n        uint32 tokenWeightOutput,\\n        uint32 swapFee\\n      ) = IRequiemFormula(formula).getFactoryReserveAndWeights(\\n          factory,\\n          pool,\\n          tokenIn\\n        );\\n      uint256 amountInput = IERC20(tokenIn).balanceOf(pool) - reserveInput;\\n      amountOutput = IRequiemFormula(formula).getAmountOut(\\n        amountInput,\\n        reserveInput,\\n        reserveOutput,\\n        tokenWeightInput,\\n        tokenWeightOutput,\\n        swapFee\\n      );\\n    }\\n    uint256 balanceBefore = IERC20(tokenOut).balanceOf(address(this));\\n    (uint256 amount0Out, uint256 amount1Out) = tokenIn ==\\n      IRequiemPair(pool).token0()\\n      ? (uint256(0), amountOutput)\\n      : (amountOutput, uint256(0));\\n    IRequiemPair(pool).swap(\\n      amount0Out,\\n      amount1Out,\\n      address(this),\\n      new bytes(0)\\n    );\\n    emit Exchange(pool, amountOutput, tokenOut);\\n\\n    tokenAmountOut = IERC20(tokenOut).balanceOf(address(this)) - balanceBefore;\\n    require(\\n      tokenAmountOut >= limitReturnAmount,\\n      \\\"Router: INSUFFICIENT_OUTPUT_AMOUNT\\\"\\n    );\\n  }\\n\\n  function _validateAmountOut(\\n    address tokenIn,\\n    address tokenOut,\\n    uint256 amountIn,\\n    uint256 amountOutMin,\\n    address[] memory path\\n  ) internal view returns (uint256[] memory amounts) {\\n    amounts = IRequiemFormula(formula).getFactoryAmountsOut(\\n      factory,\\n      tokenIn,\\n      tokenOut,\\n      amountIn,\\n      path\\n    );\\n    require(\\n      amounts[amounts.length - 1] >= amountOutMin,\\n      \\\"Router: INSUFFICIENT_OUTPUT_AMOUNT\\\"\\n    );\\n  }\\n\\n  function _calculateAmountOut(\\n    address tokenIn,\\n    address tokenOut,\\n    uint256 amountIn,\\n    address[] memory path\\n  ) internal view returns (uint256[] memory amounts) {\\n    amounts = IRequiemFormula(formula).getFactoryAmountsOut(\\n      factory,\\n      tokenIn,\\n      tokenOut,\\n      amountIn,\\n      path\\n    );\\n  }\\n\\n  function _validateAmountIn(\\n    address tokenIn,\\n    address tokenOut,\\n    uint256 amountOut,\\n    uint256 amountInMax,\\n    address[] memory path\\n  ) internal view returns (uint256[] memory amounts) {\\n    amounts = IRequiemFormula(formula).getFactoryAmountsIn(\\n      factory,\\n      tokenIn,\\n      tokenOut,\\n      amountOut,\\n      path\\n    );\\n    require(amounts[0] <= amountInMax, \\\"Router: EXCESSIVE_INPUT_AMOUNT\\\");\\n  }\\n\\n  // the same as _validateAmountIn, just with no requirement checking\\n  function _calculateAmountIn(\\n    address tokenIn,\\n    address tokenOut,\\n    uint256 amountOut,\\n    address[] memory path\\n  ) internal view returns (uint256[] memory amounts) {\\n    amounts = IRequiemFormula(formula).getFactoryAmountsIn(\\n      factory,\\n      tokenIn,\\n      tokenOut,\\n      amountOut,\\n      path\\n    );\\n  }\\n\\n  function transferETHTo(uint256 amount, address to) internal {\\n    IWETH(WETH).deposit{value: amount}();\\n    assert(IWETH(WETH).transfer(to, amount));\\n  }\\n\\n  function transferAll(\\n    address token,\\n    address to,\\n    uint256 amount\\n  ) internal returns (bool) {\\n    if (amount == 0) {\\n      return true;\\n    }\\n\\n    if (isETH(token)) {\\n      IWETH(WETH).withdraw(amount);\\n      TransferHelper.safeTransferETH(to, amount);\\n    } else {\\n      TransferHelper.safeTransfer(token, to, amount);\\n    }\\n    return true;\\n  }\\n\\n  function isETH(address token) internal pure returns (bool) {\\n    return (token == ETH_ADDRESS);\\n  }\\n}\\n\",\"keccak256\":\"0x9291c9c29aaece8f596598ca258e7dfb630cebdb1eec9c654d69380036c5eb69\",\"license\":\"MIT\"}},\"version\":1}",
  "bytecode": "0x60e06040523480156200001157600080fd5b50604051620048db380380620048db8339810160408190526200003491620000db565b6001600160a01b038216608081905260408051634b75f54f60e01b81529051634b75f54f916004808201926020929091908290030181865afa1580156200007f573d6000803e3d6000fd5b505050506040513d601f19601f82011682018060405250810190620000a5919062000113565b6001600160a01b0390811660a0521660c0525062000138565b80516001600160a01b0381168114620000d657600080fd5b919050565b60008060408385031215620000ef57600080fd5b620000fa83620000be565b91506200010a60208401620000be565b90509250929050565b6000602082840312156200012657600080fd5b6200013182620000be565b9392505050565b60805160a05160c0516146af6200022c60003960008181610133015281816102d501528181610e0601528181610f8c0152818161143401528181611a9c01528181611b2f0152818161232f015281816123b101528181612429015281816124860152818161251b01528181612bb401528181612c4f01526130130152600081816101c301528181611203015281816127d10152818161297401528181612d3c015281816130d80152818161342b0152818161359401526136d601526000818161035c015281816112320152818161280001528181612d690152818161310501528181613458015261354f01526146af6000f3fe6080604052600436106101235760003560e01c8063ad5c4648116100a0578063ce81963211610064578063ce8196321461037e578063d59e44ee14610391578063f35aaf63146103b1578063fa3219d5146103d1578063fde1adda146103f157600080fd5b8063ad5c4648146102c3578063b05f579e146102f7578063b4e819fd1461030a578063bff51d711461032a578063c45a01551461034a57600080fd5b8063674ee80b116100e7578063674ee80b1461023d578063840c34d0146102505780639c91fcb514610263578063a67d0e3c14610283578063abbfddc5146102a357600080fd5b806308c820da146101675780630d1424a3146101905780634b75f54f146101b157806351bf1830146101fd5780635cae03101461021d57600080fd5b3661016257336001600160a01b037f0000000000000000000000000000000000000000000000000000000000000000161461016057610160613aa5565b005b600080fd5b61017a610175366004613bcd565b610404565b6040516101879190613c54565b60405180910390f35b6101a361019e366004613bcd565b610805565b604051908152602001610187565b3480156101bd57600080fd5b506101e57f000000000000000000000000000000000000000000000000000000000000000081565b6040516001600160a01b039091168152602001610187565b34801561020957600080fd5b5061017a610218366004613c98565b610997565b34801561022957600080fd5b50610160610238366004613d76565b610d5b565b61016061024b366004613dfc565b610ec6565b6101a361025e366004613fb1565b611087565b34801561026f57600080fd5b5061017a61027e366004613d76565b61140b565b34801561028f57600080fd5b5061016061029e366004614024565b611562565b3480156102af57600080fd5b5061017a6102be366004613c98565b6116e0565b3480156102cf57600080fd5b506101e57f000000000000000000000000000000000000000000000000000000000000000081565b61017a610305366004613dfc565b611a74565b34801561031657600080fd5b506101a3610325366004613c98565b611bce565b34801561033657600080fd5b5061017a6103453660046140bc565b611d89565b34801561035657600080fd5b506101e57f000000000000000000000000000000000000000000000000000000000000000081565b6101a361038c36600461414f565b611deb565b34801561039d57600080fd5b5061017a6103ac366004614024565b61208c565b3480156103bd57600080fd5b506101a36103cc366004613c98565b612156565b3480156103dd57600080fd5b5061017a6103ec366004613d76565b612306565b61017a6103ff366004613dfc565b612389565b606081428110156104305760405162461bcd60e51b8152600401610427906141cc565b60405180910390fd5b85516001600160401b0381111561044957610449613abb565b604051908082528060200260200182016040528015610472578160200160208202803683370190505b5091508482885181518110610489576104896141f5565b6020026020010181815250506000600183516104a59190614221565b90505b80156105d257876104ba600183614221565b815181106104ca576104ca6141f5565b60200260200101516001600160a01b031663cc56fd43886001846104ee9190614221565b815181106104fe576104fe6141f5565b6020026020010151898481518110610518576105186141f5565b6020026020010151868581518110610532576105326141f5565b60200260200101516040518463ffffffff1660e01b815260040161055893929190614238565b602060405180830381865afa158015610575573d6000803e3d6000fd5b505050506040513d601f19601f82011682018060405250810190610599919061425c565b836105a5600184614221565b815181106105b5576105b56141f5565b6020908102919091010152806105ca81614275565b9150506104a8565b5034826000815181106105e7576105e76141f5565b6020026020010151111561060d5760405162461bcd60e51b81526004016104279061428c565b61064b82600081518110610623576106236141f5565b60200260200101518860008151811061063e5761063e6141f5565b6020026020010151612484565b60005b87518110156107a9576000600189516106679190614221565b821461069657886106798360016142b5565b81518110610689576106896141f5565b6020026020010151610698565b855b90508882815181106106ac576106ac6141f5565b60200260200101516001600160a01b03166332fd54938984815181106106d4576106d46141f5565b60200260200101518a8560016106ea91906142b5565b815181106106fa576106fa6141f5565b6020026020010151878681518110610714576107146141f5565b60200260200101518887600161072a91906142b5565b8151811061073a5761073a6141f5565b6020026020010151866040518663ffffffff1660e01b81526004016107639594939291906142cd565b600060405180830381600087803b15801561077d57600080fd5b505af1158015610791573d6000803e3d6000fd5b505050505080806107a1906142fd565b91505061064e565b50816000815181106107bd576107bd6141f5565b60200260200101513411156107fb576107fb33836000815181106107e3576107e36141f5565b6020026020010151346107f69190614221565b61259c565b5095945050505050565b600081428110156108285760405162461bcd60e51b8152600401610427906141cc565b349150610842348860008151811061063e5761063e6141f5565b60005b87518110156109765760006001895161085e9190614221565b821461088d57886108708360016142b5565b81518110610880576108806141f5565b602002602001015161088f565b855b90508882815181106108a3576108a36141f5565b60200260200101516001600160a01b0316634ac00e038984815181106108cb576108cb6141f5565b60200260200101518a8560016108e191906142b5565b815181106108f1576108f16141f5565b6020026020010151876000866040518663ffffffff1660e01b815260040161091d9594939291906142cd565b6020604051808303816000875af115801561093c573d6000803e3d6000fd5b505050506040513d601f19601f82011682018060405250810190610960919061425c565b935050808061096e906142fd565b915050610845565b50818511156107fb5760405162461bcd60e51b815260040161042790614318565b606081428110156109ba5760405162461bcd60e51b8152600401610427906141cc565b86516001600160401b038111156109d3576109d3613abb565b6040519080825280602002602001820160405280156109fc578160200160208202803683370190505b5091508582895181518110610a1357610a136141f5565b602002602001018181525050600060018351610a2f9190614221565b90505b8015610b5c5788610a44600183614221565b81518110610a5457610a546141f5565b60200260200101516001600160a01b031663cc56fd4389600184610a789190614221565b81518110610a8857610a886141f5565b60200260200101518a8481518110610aa257610aa26141f5565b6020026020010151868581518110610abc57610abc6141f5565b60200260200101516040518463ffffffff1660e01b8152600401610ae293929190614238565b602060405180830381865afa158015610aff573d6000803e3d6000fd5b505050506040513d601f19601f82011682018060405250810190610b23919061425c565b83610b2f600184614221565b81518110610b3f57610b3f6141f5565b602090810291909101015280610b5481614275565b915050610a32565b508482600081518110610b7157610b716141f5565b60200260200101511115610b975760405162461bcd60e51b81526004016104279061428c565b610bf187600081518110610bad57610bad6141f5565b6020026020010151338a600081518110610bc957610bc96141f5565b602002602001015185600081518110610be457610be46141f5565b602002602001015161266a565b60005b8851811015610d4f57600060018a51610c0d9190614221565b8214610c3c5789610c1f8360016142b5565b81518110610c2f57610c2f6141f5565b6020026020010151610c3e565b855b9050898281518110610c5257610c526141f5565b60200260200101516001600160a01b03166332fd54938a8481518110610c7a57610c7a6141f5565b60200260200101518b856001610c9091906142b5565b81518110610ca057610ca06141f5565b6020026020010151878681518110610cba57610cba6141f5565b602002602001015188876001610cd091906142b5565b81518110610ce057610ce06141f5565b6020026020010151866040518663ffffffff1660e01b8152600401610d099594939291906142cd565b600060405180830381600087803b158015610d2357600080fd5b505af1158015610d37573d6000803e3d6000fd5b50505050508080610d47906142fd565b915050610bf4565b50509695505050505050565b8042811015610d7c5760405162461bcd60e51b8152600401610427906141cc565b610daf883387876000818110610d9457610d946141f5565b9050602002016020810190610da99190614345565b8a61266a565b610dee88868680806020026020016040519081016040528093929190818152602001838360200280828437600092019190915250309250612796915050565b6040516370a0823160e01b81523060048201526000907f00000000000000000000000000000000000000000000000000000000000000006001600160a01b0316906370a0823190602401602060405180830381865afa158015610e55573d6000803e3d6000fd5b505050506040513d601f19601f82011682018060405250810190610e79919061425c565b905086811015610e9b5760405162461bcd60e51b815260040161042790614362565b610eba73eeeeeeeeeeeeeeeeeeeeeeeeeeeeeeeeeeeeeeee8583612b81565b50505050505050505050565b8042811015610ee75760405162461bcd60e51b8152600401610427906141cc565b34610f17818787600081610efd57610efd6141f5565b9050602002016020810190610f129190614345565b612484565b6040516370a0823160e01b81526001600160a01b038581166004830152600091908a16906370a0823190602401602060405180830381865afa158015610f61573d6000803e3d6000fd5b505050506040513d601f19601f82011682018060405250810190610f85919061425c565b9050610fe67f00000000000000000000000000000000000000000000000000000000000000008888808060200260200160405190810160405280939291908181526020018383602002808284376000920191909152508a9250612796915050565b6040516370a0823160e01b81526001600160a01b038681166004830152899183918c16906370a0823190602401602060405180830381865afa158015611030573d6000803e3d6000fd5b505050506040513d601f19601f82011682018060405250810190611054919061425c565b61105e9190614221565b101561107c5760405162461bcd60e51b815260040161042790614362565b505050505050505050565b600081428110156110aa5760405162461bcd60e51b8152600401610427906141cc565b6110b48685612c3d565b5060005b875181101561139e5760008882815181106110d5576110d56141f5565b602002602001015151600114156111475760008983815181106110fa576110fa6141f5565b6020026020010151600081518110611114576111146141f5565b6020026020010151905061113f81602001518260400151836000015184606001518560800151612cdb565b91505061137e565b6000808a848151811061115c5761115c6141f5565b6020026020010151600181518110611176576111766141f5565b60200260200101519050600060016001600160401b0381111561119b5761119b613abb565b6040519080825280602002602001820160405280156111c4578160200160208202803683370190505b5090508160000151816000815181106111df576111df6141f5565b60200260200101906001600160a01b031690816001600160a01b03168152505060007f00000000000000000000000000000000000000000000000000000000000000006001600160a01b03166367f84adc7f0000000000000000000000000000000000000000000000000000000000000000856020015186604001518760600151876040518663ffffffff1660e01b81526004016112819594939291906143a4565b600060405180830381865afa15801561129e573d6000803e3d6000fd5b505050506040513d6000823e601f3d908101601f191682016040526112c69190810190614417565b9050806000815181106112db576112db6141f5565b6020026020010151935082608001518411156113095760405162461bcd60e51b8152600401610427906144a7565b505060008b858151811061131f5761131f6141f5565b6020026020010151600081518110611339576113396141f5565b60200260200101519050611360816020015182604001518360000151868560800151612cdb565b935061137a82602001518360000151858560600151612e3f565b5050505b61138881856142b5565b9350508080611396906142fd565b9150506110b8565b50838211156113de5760405162461bcd60e51b815260206004820152600c60248201526b22a9292fa624a6a4aa2fa4a760a11b6044820152606401610427565b6113f185336113ec88612fee565b612b81565b5061140086336113ec89612fee565b505095945050505050565b6060814281101561142e5760405162461bcd60e51b8152600401610427906141cc565b61148e897f00000000000000000000000000000000000000000000000000000000000000008a8a8a8a808060200260200160405190810160405280939291908181526020018383602002808284376000920191909152506130be92505050565b91506114d08933888860008181106114a8576114a86141f5565b90506020020160208101906114bd9190614345565b85600081518110610be457610be46141f5565b61151089838888808060200260200160405190810160405280939291908181526020018383602002808284376000920191909152503092506131cb915050565b61155573eeeeeeeeeeeeeeeeeeeeeeeeeeeeeeeeeeeeeeee8584600186516115389190614221565b81518110611548576115486141f5565b6020026020010151612b81565b5050979650505050505050565b80428110156115835760405162461bcd60e51b8152600401610427906141cc565b61159b893387876000818110610d9457610d946141f5565b6040516370a0823160e01b81526001600160a01b038481166004830152600091908a16906370a0823190602401602060405180830381865afa1580156115e5573d6000803e3d6000fd5b505050506040513d601f19601f82011682018060405250810190611609919061425c565b905061164a8a878780806020026020016040519081016040528093929190818152602001838360200280828437600092019190915250899250612796915050565b6040516370a0823160e01b81526001600160a01b038581166004830152889183918c16906370a0823190602401602060405180830381865afa158015611694573d6000803e3d6000fd5b505050506040513d601f19601f820116820180604052508101906116b8919061425c565b6116c29190614221565b1015610eba5760405162461bcd60e51b815260040161042790614362565b606081428110156117035760405162461bcd60e51b8152600401610427906141cc565b86516001600160401b0381111561171c5761171c613abb565b604051908082528060200260200182016040528015611745578160200160208202803683370190505b509150858289518151811061175c5761175c6141f5565b6020026020010181815250506000600183516117789190614221565b90505b80156118a5578861178d600183614221565b8151811061179d5761179d6141f5565b60200260200101516001600160a01b031663cc56fd43896001846117c19190614221565b815181106117d1576117d16141f5565b60200260200101518a84815181106117eb576117eb6141f5565b6020026020010151868581518110611805576118056141f5565b60200260200101516040518463ffffffff1660e01b815260040161182b93929190614238565b602060405180830381865afa158015611848573d6000803e3d6000fd5b505050506040513d601f19601f8201168201806040525081019061186c919061425c565b83611878600184614221565b81518110611888576118886141f5565b60209081029190910101528061189d81614275565b91505061177b565b5084826000815181106118ba576118ba6141f5565b602002602001015111156118e05760405162461bcd60e51b81526004016104279061428c565b6118f687600081518110610bad57610bad6141f5565b60005b8851811015611a5457600060018a516119129190614221565b821461194157896119248360016142b5565b81518110611934576119346141f5565b6020026020010151611943565b305b9050898281518110611957576119576141f5565b60200260200101516001600160a01b03166332fd54938a848151811061197f5761197f6141f5565b60200260200101518b85600161199591906142b5565b815181106119a5576119a56141f5565b60200260200101518786815181106119bf576119bf6141f5565b6020026020010151888760016119d591906142b5565b815181106119e5576119e56141f5565b6020026020010151866040518663ffffffff1660e01b8152600401611a0e9594939291906142cd565b600060405180830381600087803b158015611a2857600080fd5b505af1158015611a3c573d6000803e3d6000fd5b50505050508080611a4c906142fd565b9150506118f9565b50610d4f73eeeeeeeeeeeeeeeeeeeeeeeeeeeeeeeeeeeeeeee8588612b81565b60608142811015611a975760405162461bcd60e51b8152600401610427906141cc565b611af77f00000000000000000000000000000000000000000000000000000000000000008989348a8a8080602002602001604051908101604052809392919081815260200183836020028082843760009201919091525061341192505050565b9150611b2a82600081518110611b0f57611b0f6141f5565b602002602001015187876000818110610efd57610efd6141f5565b611b8a7f0000000000000000000000000000000000000000000000000000000000000000838888808060200260200160405190810160405280939291908181526020018383602002808284376000920191909152508a92506131cb915050565b81600081518110611b9d57611b9d6141f5565b6020026020010151341115611bc357611bc333836000815181106107e3576107e36141f5565b509695505050505050565b60008142811015611bf15760405162461bcd60e51b8152600401610427906141cc565b859150611c3487600081518110611c0a57611c0a6141f5565b6020026020010151338a600081518110611c2657611c266141f5565b60200260200101518961266a565b60005b8851811015611d6857600060018a51611c509190614221565b8214611c7f5789611c628360016142b5565b81518110611c7257611c726141f5565b6020026020010151611c81565b855b9050898281518110611c9557611c956141f5565b60200260200101516001600160a01b0316634ac00e038a8481518110611cbd57611cbd6141f5565b60200260200101518b856001611cd391906142b5565b81518110611ce357611ce36141f5565b6020026020010151876000866040518663ffffffff1660e01b8152600401611d0f9594939291906142cd565b6020604051808303816000875af1158015611d2e573d6000803e3d6000fd5b505050506040513d601f19601f82011682018060405250810190611d52919061425c565b9350508080611d60906142fd565b915050611c37565b5081851115611bc35760405162461bcd60e51b815260040161042790614318565b60608142811015611dac5760405162461bcd60e51b8152600401610427906141cc565b611db989898989896130be565b9150611dd3893387600081518110610bc957610bc96141f5565b611ddf898387876131cb565b50979650505050505050565b60008142811015611e0e5760405162461bcd60e51b8152600401610427906141cc565b611e188786612c3d565b506000611e2487613509565b611e93576040516370a0823160e01b81523360048201526001600160a01b038816906370a0823190602401602060405180830381865afa158015611e6c573d6000803e3d6000fd5b505050506040513d601f19601f82011682018060405250810190611e90919061425c565b90505b60005b8951811015611f64576000805b8b8381518110611eb557611eb56141f5565b602002602001015151811015611f445760008c8481518110611ed957611ed96141f5565b60200260200101518281518110611ef257611ef26141f5565b602002602001015190506000821115611f0d57606081018390525b611f2e8160200151826040015183600001518460600151856080015161352b565b9250508080611f3c906142fd565b915050611ea3565b50611f4f85826142b5565b50819050611f5c816142fd565b915050611e96565b50611f70873385612b81565b50611f7f88336113ec8b612fee565b50611f8987613509565b15611fd35784831015611fce5760405162461bcd60e51b815260206004820152600d60248201526c11549497d31253525517d3d555609a1b6044820152606401610427565b610d4f565b6040516370a0823160e01b8152336004820152859082906001600160a01b038a16906370a0823190602401602060405180830381865afa15801561201b573d6000803e3d6000fd5b505050506040513d601f19601f8201168201806040525081019061203f919061425c565b6120499190614221565b1015610d4f5760405162461bcd60e51b81526020600482015260126024820152710f1b5a5b951bdd185b105b5bdd5b9d13dd5d60721b6044820152606401610427565b606081428110156120af5760405162461bcd60e51b8152600401610427906141cc565b6120ef8a8a8a8a8a8a8080602002602001604051908101604052809392919081815260200183836020028082843760009201919091525061341192505050565b91506121098a33888860008181106114a8576114a86141f5565b6121498a838888808060200260200160405190810160405280939291908181526020018383602002808284376000920191909152508a92506131cb915050565b5098975050505050505050565b600081428110156121795760405162461bcd60e51b8152600401610427906141cc565b85915061219287600081518110611c0a57611c0a6141f5565b60005b88518110156122c657600060018a516121ae9190614221565b82146121dd57896121c08360016142b5565b815181106121d0576121d06141f5565b60200260200101516121df565b305b90508982815181106121f3576121f36141f5565b60200260200101516001600160a01b0316634ac00e038a848151811061221b5761221b6141f5565b60200260200101518b85600161223191906142b5565b81518110612241576122416141f5565b6020026020010151876000866040518663ffffffff1660e01b815260040161226d9594939291906142cd565b6020604051808303816000875af115801561228c573d6000803e3d6000fd5b505050506040513d601f19601f820116820180604052508101906122b0919061425c565b93505080806122be906142fd565b915050612195565b50818511156122e75760405162461bcd60e51b815260040161042790614318565b610d4f73eeeeeeeeeeeeeeeeeeeeeeeeeeeeeeeeeeeeeeee8584612b81565b606081428110156123295760405162461bcd60e51b8152600401610427906141cc565b61148e897f00000000000000000000000000000000000000000000000000000000000000008a8a8a8a8080602002602001604051908101604052809392919081815260200183836020028082843760009201919091525061341192505050565b606081428110156123ac5760405162461bcd60e51b8152600401610427906141cc565b61240c7f000000000000000000000000000000000000000000000000000000000000000089348a8a8a808060200260200160405190810160405280939291908181526020018383602002808284376000920191909152506130be92505050565b915061242482600081518110611b0f57611b0f6141f5565b611bc37f0000000000000000000000000000000000000000000000000000000000000000838888808060200260200160405190810160405280939291908181526020018383602002808284376000920191909152508a92506131cb915050565b7f00000000000000000000000000000000000000000000000000000000000000006001600160a01b031663d0e30db0836040518263ffffffff1660e01b81526004016000604051808303818588803b1580156124df57600080fd5b505af11580156124f3573d6000803e3d6000fd5b505060405163a9059cbb60e01b81526001600160a01b038581166004830152602482018790527f000000000000000000000000000000000000000000000000000000000000000016935063a9059cbb925060440190506020604051808303816000875af1158015612568573d6000803e3d6000fd5b505050506040513d601f19601f8201168201806040525081019061258c91906144de565b61259857612598613aa5565b5050565b604080516000808252602082019092526001600160a01b0384169083906040516125c69190614530565b60006040518083038185875af1925050503d8060008114612603576040519150601f19603f3d011682016040523d82523d6000602084013e612608565b606091505b50509050806126655760405162461bcd60e51b815260206004820152602360248201527f5472616e7366657248656c7065723a204554485f5452414e534645525f46414960448201526213115160ea1b6064820152608401610427565b505050565b600080856001600160a01b03166323b872dd86868660405160240161269193929190614238565b6040516020818303038152906040529060e01b6020820180516001600160e01b0383818316178352505050506040516126ca9190614530565b6000604051808303816000865af19150503d8060008114612707576040519150601f19603f3d011682016040523d82523d6000602084013e61270c565b606091505b509150915081801561273657508051158061273657508080602001905181019061273691906144de565b61278e5760405162461bcd60e51b8152602060048201526024808201527f5472616e7366657248656c7065723a205452414e534645525f46524f4d5f46416044820152631253115160e21b6064820152608401610427565b505050505050565b8260005b8351811015612b7a5760008482815181106127b7576127b76141f5565b6020026020010151905060008060008060008060008060007f00000000000000000000000000000000000000000000000000000000000000006001600160a01b031663b33d96b07f00000000000000000000000000000000000000000000000000000000000000008c8f6040518463ffffffff1660e01b815260040161285d939291906001600160a01b0393841681529183166020830152909116604082015260600190565b60c060405180830381865afa15801561287a573d6000803e3d6000fd5b505050506040513d601f19601f8201168201806040525081019061289e9190614560565b955095509550955095509550848c6001600160a01b03166370a082318c6040518263ffffffff1660e01b81526004016128e691906001600160a01b0391909116815260200190565b602060405180830381865afa158015612903573d6000803e3d6000fd5b505050506040513d601f19601f82011682018060405250810190612927919061425c565b6129319190614221565b60405163671a11b560e01b815260048101829052602481018790526044810186905263ffffffff80861660648301528085166084830152831660a48201529099507f00000000000000000000000000000000000000000000000000000000000000006001600160a01b03169063671a11b59060c401602060405180830381865afa1580156129c3573d6000803e3d6000fd5b505050506040513d601f19601f820116820180604052508101906129e7919061425c565b9750859650505050505050600080856001600160a01b0316630dfe16816040518163ffffffff1660e01b8152600401602060405180830381865afa158015612a33573d6000803e3d6000fd5b505050506040513d601f19601f82011682018060405250810190612a5791906145c9565b6001600160a01b0316886001600160a01b031614612a7757836000612a7b565b6000845b91509150600060018b51612a8f9190614221565b8810612a9b5789612ac0565b8a612aa78960016142b5565b81518110612ab757612ab76141f5565b60200260200101515b6040805160008152602081019182905263022c0d9f60e01b9091529091506001600160a01b0388169063022c0d9f90612b0290869086908690602481016145e6565b600060405180830381600087803b158015612b1c57600080fd5b505af1158015612b30573d6000803e3d6000fd5b5050505060008051602061465a833981519152878686604051612b5593929190614636565b60405180910390a1839850505050505050508080612b72906142fd565b91505061279a565b5050505050565b600081612b9057506001612c36565b612b9984613509565b15612c2757604051632e1a7d4d60e01b8152600481018390527f00000000000000000000000000000000000000000000000000000000000000006001600160a01b031690632e1a7d4d90602401600060405180830381600087803b158015612c0057600080fd5b505af1158015612c14573d6000803e3d6000fd5b50505050612c22838361259c565b612c32565b612c32848484613991565b5060015b9392505050565b6000612c4883613509565b15612cc6577f00000000000000000000000000000000000000000000000000000000000000006001600160a01b031663d0e30db0346040518263ffffffff1660e01b81526004016000604051808303818588803b158015612ca857600080fd5b505af1158015612cbc573d6000803e3d6000fd5b5050505050612cd2565b612cd28333308561266a565b50600192915050565b604080516001808252818301909252600091829190602080830190803683370190505090508481600081518110612d1457612d146141f5565b6001600160a01b0392831660209182029290920101526040516319fe12b760e21b81526000917f000000000000000000000000000000000000000000000000000000000000000016906367f84adc90612d99907f0000000000000000000000000000000000000000000000000000000000000000908c908c908b9089906004016143a4565b600060405180830381865afa158015612db6573d6000803e3d6000fd5b505050506040513d6000823e601f3d908101601f19168201604052612dde9190810190614417565b905080600081518110612df357612df36141f5565b6020026020010151925083831115612e1d5760405162461bcd60e51b8152600401610427906144a7565b61140088878584600181518110612e3657612e366141f5565b60200260200101515b612e4a848484613991565b60008390506000816001600160a01b0316630dfe16816040518163ffffffff1660e01b8152600401602060405180830381865afa158015612e8f573d6000803e3d6000fd5b505050506040513d601f19601f82011682018060405250810190612eb391906145c9565b90506000806000836001600160a01b0316896001600160a01b031614612edc5785600085612f41565b600086866001600160a01b031663d21220a76040518163ffffffff1660e01b8152600401602060405180830381865afa158015612f1d573d6000803e3d6000fd5b505050506040513d601f19601f82011682018060405250810190612f4191906145c9565b6040805160008152602081019182905263022c0d9f60e01b90915292955090935091506001600160a01b0386169063022c0d9f90612f8890869086903090602481016145e6565b600060405180830381600087803b158015612fa257600080fd5b505af1158015612fb6573d6000803e3d6000fd5b5050505060008051602061465a833981519152888783604051612fdb93929190614636565b60405180910390a1505050505050505050565b6000612ff982613509565b1561308d576040516370a0823160e01b81523060048201527f00000000000000000000000000000000000000000000000000000000000000006001600160a01b0316906370a08231906024015b602060405180830381865afa158015613063573d6000803e3d6000fd5b505050506040513d601f19601f82011682018060405250810190613087919061425c565b92915050565b6040516370a0823160e01b81523060048201526001600160a01b038316906370a0823190602401613046565b919050565b60405163119220a560e01b81526060906001600160a01b037f0000000000000000000000000000000000000000000000000000000000000000169063119220a590613135907f0000000000000000000000000000000000000000000000000000000000000000908a908a908a9089906004016143a4565b600060405180830381865afa158015613152573d6000803e3d6000fd5b505050506040513d6000823e601f3d908101601f1916820160405261317a9190810190614417565b905082816001835161318c9190614221565b8151811061319c5761319c6141f5565b602002602001015110156131c25760405162461bcd60e51b815260040161042790614362565b95945050505050565b8360005b835181101561278e5760008482815181106131ec576131ec6141f5565b602002602001015190506000816001600160a01b0316630dfe16816040518163ffffffff1660e01b8152600401602060405180830381865afa158015613236573d6000803e3d6000fd5b505050506040513d601f19601f8201168201806040525081019061325a91906145c9565b905060008761326a8560016142b5565b8151811061327a5761327a6141f5565b602002602001015190506000806000846001600160a01b0316886001600160a01b0316146132ab5783600086613310565b600084876001600160a01b031663d21220a76040518163ffffffff1660e01b8152600401602060405180830381865afa1580156132ec573d6000803e3d6000fd5b505050506040513d601f19601f8201168201806040525081019061331091906145c9565b925092509250600060018b516133269190614221565b88106133325789613357565b8a61333e8960016142b5565b8151811061334e5761334e6141f5565b60200260200101515b6040805160008152602081019182905263022c0d9f60e01b9091529091506001600160a01b0388169063022c0d9f9061339990879087908690602481016145e6565b600060405180830381600087803b1580156133b357600080fd5b505af11580156133c7573d6000803e3d6000fd5b5050505060008051602061465a8339815191528786846040516133ec93929190614636565b60405180910390a1819850505050505050508080613409906142fd565b9150506131cf565b6040516319fe12b760e21b81526060906001600160a01b037f000000000000000000000000000000000000000000000000000000000000000016906367f84adc90613488907f0000000000000000000000000000000000000000000000000000000000000000908a908a908a9089906004016143a4565b600060405180830381865afa1580156134a5573d6000803e3d6000fd5b505050506040513d6000823e601f3d908101601f191682016040526134cd9190810190614417565b905082816000815181106134e3576134e36141f5565b602002602001015111156131c25760405162461bcd60e51b8152600401610427906144a7565b6001600160a01b031673eeeeeeeeeeeeeeeeeeeeeeeeeeeeeeeeeeeeeeee1490565b6000613538868585613991565b604051630b33d96b60e41b81526001600160a01b037f00000000000000000000000000000000000000000000000000000000000000008116600483015285811660248301528781166044830152600091829182918291829182917f0000000000000000000000000000000000000000000000000000000000000000169063b33d96b09060640160c060405180830381865afa1580156135db573d6000803e3d6000fd5b505050506040513d601f19601f820116820180604052508101906135ff9190614560565b95509550955095509550506000858d6001600160a01b03166370a082318d6040518263ffffffff1660e01b815260040161364891906001600160a01b0391909116815260200190565b602060405180830381865afa158015613665573d6000803e3d6000fd5b505050506040513d601f19601f82011682018060405250810190613689919061425c565b6136939190614221565b60405163671a11b560e01b815260048101829052602481018890526044810187905263ffffffff80871660648301528086166084830152841660a48201529091507f00000000000000000000000000000000000000000000000000000000000000006001600160a01b03169063671a11b59060c401602060405180830381865afa158015613725573d6000803e3d6000fd5b505050506040513d601f19601f82011682018060405250810190613749919061425c565b6040516370a0823160e01b8152306004820152909750600096506001600160a01b038d1695506370a0823194506024019250613783915050565b602060405180830381865afa1580156137a0573d6000803e3d6000fd5b505050506040513d601f19601f820116820180604052508101906137c4919061425c565b9050600080876001600160a01b0316630dfe16816040518163ffffffff1660e01b8152600401602060405180830381865afa158015613807573d6000803e3d6000fd5b505050506040513d601f19601f8201168201806040525081019061382b91906145c9565b6001600160a01b03168a6001600160a01b03161461384b5783600061384f565b6000845b6040805160008152602081019182905263022c0d9f60e01b90915291935091506001600160a01b0389169063022c0d9f9061389390859085903090602481016145e6565b600060405180830381600087803b1580156138ad57600080fd5b505af11580156138c1573d6000803e3d6000fd5b5050505060008051602061465a83398151915288858b6040516138e693929190614636565b60405180910390a16040516370a0823160e01b815230600482015283906001600160a01b038b16906370a0823190602401602060405180830381865afa158015613934573d6000803e3d6000fd5b505050506040513d601f19601f82011682018060405250810190613958919061425c565b6139629190614221565b9450858510156139845760405162461bcd60e51b815260040161042790614362565b5050505095945050505050565b604080516001600160a01b038481166024830152604480830185905283518084039091018152606490920183526020820180516001600160e01b031663a9059cbb60e01b17905291516000928392908716916139ed9190614530565b6000604051808303816000865af19150503d8060008114613a2a576040519150601f19603f3d011682016040523d82523d6000602084013e613a2f565b606091505b5091509150818015613a59575080511580613a59575080806020019051810190613a5991906144de565b612b7a5760405162461bcd60e51b815260206004820152601f60248201527f5472616e7366657248656c7065723a205452414e534645525f4641494c4544006044820152606401610427565b634e487b7160e01b600052600160045260246000fd5b634e487b7160e01b600052604160045260246000fd5b60405160c081016001600160401b0381118282101715613af357613af3613abb565b60405290565b604051601f8201601f191681016001600160401b0381118282101715613b2157613b21613abb565b604052919050565b60006001600160401b03821115613b4257613b42613abb565b5060051b60200190565b6001600160a01b0381168114613b6157600080fd5b50565b600082601f830112613b7557600080fd5b81356020613b8a613b8583613b29565b613af9565b82815260059290921b84018101918181019086841115613ba957600080fd5b8286015b84811015611bc3578035613bc081613b4c565b8352918301918301613bad565b600080600080600060a08688031215613be557600080fd5b85356001600160401b0380821115613bfc57600080fd5b613c0889838a01613b64565b96506020880135915080821115613c1e57600080fd5b50613c2b88828901613b64565b945050604086013592506060860135613c4381613b4c565b949793965091946080013592915050565b6020808252825182820181905260009190848201906040850190845b81811015613c8c57835183529284019291840191600101613c70565b50909695505050505050565b60008060008060008060c08789031215613cb157600080fd5b86356001600160401b0380821115613cc857600080fd5b613cd48a838b01613b64565b97506020890135915080821115613cea57600080fd5b50613cf789828a01613b64565b95505060408701359350606087013592506080870135613d1681613b4c565b8092505060a087013590509295509295509295565b60008083601f840112613d3d57600080fd5b5081356001600160401b03811115613d5457600080fd5b6020830191508360208260051b8501011115613d6f57600080fd5b9250929050565b600080600080600080600060c0888a031215613d9157600080fd5b8735613d9c81613b4c565b9650602088013595506040880135945060608801356001600160401b03811115613dc557600080fd5b613dd18a828b01613d2b565b9095509350506080880135613de581613b4c565b8092505060a0880135905092959891949750929550565b60008060008060008060a08789031215613e1557600080fd5b8635613e2081613b4c565b95506020870135945060408701356001600160401b03811115613e4257600080fd5b613e4e89828a01613d2b565b9095509350506060870135613e6281613b4c565b80925050608087013590509295509295509295565b600082601f830112613e8857600080fd5b81356020613e98613b8583613b29565b82815260059290921b84018101918181019086841115613eb757600080fd5b8286015b84811015611bc35780356001600160401b03811115613eda5760008081fd5b8701603f81018913613eec5760008081fd5b848101356040613efe613b8583613b29565b82815260c0928302840182019288820191908d851115613f1e5760008081fd5b948301945b84861015613f9f5780868f031215613f3b5760008081fd5b613f43613ad1565b8635613f4e81613b4c565b8152868b0135613f5d81613b4c565b818c015286850135613f6e81613b4c565b81860152606087810135908201526080808801359082015260a0808801359082015283529485019491890191613f23565b50875250505092840192508301613ebb565b600080600080600060a08688031215613fc957600080fd5b85356001600160401b03811115613fdf57600080fd5b613feb88828901613e77565b9550506020860135613ffc81613b4c565b9350604086013561400c81613b4c565b94979396509394606081013594506080013592915050565b60008060008060008060008060e0898b03121561404057600080fd5b883561404b81613b4c565b9750602089013561405b81613b4c565b9650604089013595506060890135945060808901356001600160401b0381111561408457600080fd5b6140908b828c01613d2b565b90955093505060a08901356140a481613b4c565b8092505060c089013590509295985092959890939650565b600080600080600080600060e0888a0312156140d757600080fd5b87356140e281613b4c565b965060208801356140f281613b4c565b9550604088013594506060880135935060808801356001600160401b0381111561411b57600080fd5b6141278a828b01613b64565b93505060a088013561413881613b4c565b8092505060c0880135905092959891949750929550565b60008060008060008060c0878903121561416857600080fd5b86356001600160401b0381111561417e57600080fd5b61418a89828a01613e77565b965050602087013561419b81613b4c565b945060408701356141ab81613b4c565b959894975094956060810135955060808101359460a0909101359350915050565b6020808252600f908201526e149bdd5d195c8e8811561412549151608a1b604082015260600190565b634e487b7160e01b600052603260045260246000fd5b634e487b7160e01b600052601160045260246000fd5b6000828210156142335761423361420b565b500390565b6001600160a01b039384168152919092166020820152604081019190915260600190565b60006020828403121561426e57600080fd5b5051919050565b6000816142845761428461420b565b506000190190565b6020808252600f908201526e115610d154d4d2559157d253941555608a1b604082015260600190565b600082198211156142c8576142c861420b565b500190565b6001600160a01b039586168152938516602085015260408401929092526060830152909116608082015260a00190565b60006000198214156143115761431161420b565b5060010190565b602080825260139082015272125394d551919250d251539517d3d555141555606a1b604082015260600190565b60006020828403121561435757600080fd5b8135612c3681613b4c565b60208082526022908201527f526f757465723a20494e53554646494349454e545f4f55545055545f414d4f55604082015261139560f21b606082015260800190565b600060a0820160018060a01b038089168452602081891681860152818816604086015286606086015260a0608086015282865180855260c087019150828801945060005b818110156144065785518516835294830194918301916001016143e8565b50909b9a5050505050505050505050565b6000602080838503121561442a57600080fd5b82516001600160401b0381111561444057600080fd5b8301601f8101851361445157600080fd5b805161445f613b8582613b29565b81815260059190911b8201830190838101908783111561447e57600080fd5b928401925b8284101561449c57835182529284019290840190614483565b979650505050505050565b6020808252601e908201527f526f757465723a204558434553534956455f494e5055545f414d4f554e540000604082015260600190565b6000602082840312156144f057600080fd5b81518015158114612c3657600080fd5b60005b8381101561451b578181015183820152602001614503565b8381111561452a576000848401525b50505050565b60008251614542818460208701614500565b9190910192915050565b805163ffffffff811681146130b957600080fd5b60008060008060008060c0878903121561457957600080fd5b865161458481613b4c565b60208801516040890151919750955093506145a16060880161454c565b92506145af6080880161454c565b91506145bd60a0880161454c565b90509295509295509295565b6000602082840312156145db57600080fd5b8151612c3681613b4c565b84815283602082015260018060a01b0383166040820152608060608201526000825180608084015261461f8160a0850160208701614500565b601f01601f19169190910160a00195945050505050565b6001600160a01b039384168152602081019290925290911660408201526060019056feddac40937f35385a34f721af292e5a83fc5b840f722bff57c2fc71adba708c48a2646970667358221220a31bf67d1f65dc9c75f126750a83e2bb3b6e21a8379aae17058a7a53a453b62064736f6c634300080a0033",
  "deployedBytecode": "0x6080604052600436106101235760003560e01c8063ad5c4648116100a0578063ce81963211610064578063ce8196321461037e578063d59e44ee14610391578063f35aaf63146103b1578063fa3219d5146103d1578063fde1adda146103f157600080fd5b8063ad5c4648146102c3578063b05f579e146102f7578063b4e819fd1461030a578063bff51d711461032a578063c45a01551461034a57600080fd5b8063674ee80b116100e7578063674ee80b1461023d578063840c34d0146102505780639c91fcb514610263578063a67d0e3c14610283578063abbfddc5146102a357600080fd5b806308c820da146101675780630d1424a3146101905780634b75f54f146101b157806351bf1830146101fd5780635cae03101461021d57600080fd5b3661016257336001600160a01b037f0000000000000000000000000000000000000000000000000000000000000000161461016057610160613aa5565b005b600080fd5b61017a610175366004613bcd565b610404565b6040516101879190613c54565b60405180910390f35b6101a361019e366004613bcd565b610805565b604051908152602001610187565b3480156101bd57600080fd5b506101e57f000000000000000000000000000000000000000000000000000000000000000081565b6040516001600160a01b039091168152602001610187565b34801561020957600080fd5b5061017a610218366004613c98565b610997565b34801561022957600080fd5b50610160610238366004613d76565b610d5b565b61016061024b366004613dfc565b610ec6565b6101a361025e366004613fb1565b611087565b34801561026f57600080fd5b5061017a61027e366004613d76565b61140b565b34801561028f57600080fd5b5061016061029e366004614024565b611562565b3480156102af57600080fd5b5061017a6102be366004613c98565b6116e0565b3480156102cf57600080fd5b506101e57f000000000000000000000000000000000000000000000000000000000000000081565b61017a610305366004613dfc565b611a74565b34801561031657600080fd5b506101a3610325366004613c98565b611bce565b34801561033657600080fd5b5061017a6103453660046140bc565b611d89565b34801561035657600080fd5b506101e57f000000000000000000000000000000000000000000000000000000000000000081565b6101a361038c36600461414f565b611deb565b34801561039d57600080fd5b5061017a6103ac366004614024565b61208c565b3480156103bd57600080fd5b506101a36103cc366004613c98565b612156565b3480156103dd57600080fd5b5061017a6103ec366004613d76565b612306565b61017a6103ff366004613dfc565b612389565b606081428110156104305760405162461bcd60e51b8152600401610427906141cc565b60405180910390fd5b85516001600160401b0381111561044957610449613abb565b604051908082528060200260200182016040528015610472578160200160208202803683370190505b5091508482885181518110610489576104896141f5565b6020026020010181815250506000600183516104a59190614221565b90505b80156105d257876104ba600183614221565b815181106104ca576104ca6141f5565b60200260200101516001600160a01b031663cc56fd43886001846104ee9190614221565b815181106104fe576104fe6141f5565b6020026020010151898481518110610518576105186141f5565b6020026020010151868581518110610532576105326141f5565b60200260200101516040518463ffffffff1660e01b815260040161055893929190614238565b602060405180830381865afa158015610575573d6000803e3d6000fd5b505050506040513d601f19601f82011682018060405250810190610599919061425c565b836105a5600184614221565b815181106105b5576105b56141f5565b6020908102919091010152806105ca81614275565b9150506104a8565b5034826000815181106105e7576105e76141f5565b6020026020010151111561060d5760405162461bcd60e51b81526004016104279061428c565b61064b82600081518110610623576106236141f5565b60200260200101518860008151811061063e5761063e6141f5565b6020026020010151612484565b60005b87518110156107a9576000600189516106679190614221565b821461069657886106798360016142b5565b81518110610689576106896141f5565b6020026020010151610698565b855b90508882815181106106ac576106ac6141f5565b60200260200101516001600160a01b03166332fd54938984815181106106d4576106d46141f5565b60200260200101518a8560016106ea91906142b5565b815181106106fa576106fa6141f5565b6020026020010151878681518110610714576107146141f5565b60200260200101518887600161072a91906142b5565b8151811061073a5761073a6141f5565b6020026020010151866040518663ffffffff1660e01b81526004016107639594939291906142cd565b600060405180830381600087803b15801561077d57600080fd5b505af1158015610791573d6000803e3d6000fd5b505050505080806107a1906142fd565b91505061064e565b50816000815181106107bd576107bd6141f5565b60200260200101513411156107fb576107fb33836000815181106107e3576107e36141f5565b6020026020010151346107f69190614221565b61259c565b5095945050505050565b600081428110156108285760405162461bcd60e51b8152600401610427906141cc565b349150610842348860008151811061063e5761063e6141f5565b60005b87518110156109765760006001895161085e9190614221565b821461088d57886108708360016142b5565b81518110610880576108806141f5565b602002602001015161088f565b855b90508882815181106108a3576108a36141f5565b60200260200101516001600160a01b0316634ac00e038984815181106108cb576108cb6141f5565b60200260200101518a8560016108e191906142b5565b815181106108f1576108f16141f5565b6020026020010151876000866040518663ffffffff1660e01b815260040161091d9594939291906142cd565b6020604051808303816000875af115801561093c573d6000803e3d6000fd5b505050506040513d601f19601f82011682018060405250810190610960919061425c565b935050808061096e906142fd565b915050610845565b50818511156107fb5760405162461bcd60e51b815260040161042790614318565b606081428110156109ba5760405162461bcd60e51b8152600401610427906141cc565b86516001600160401b038111156109d3576109d3613abb565b6040519080825280602002602001820160405280156109fc578160200160208202803683370190505b5091508582895181518110610a1357610a136141f5565b602002602001018181525050600060018351610a2f9190614221565b90505b8015610b5c5788610a44600183614221565b81518110610a5457610a546141f5565b60200260200101516001600160a01b031663cc56fd4389600184610a789190614221565b81518110610a8857610a886141f5565b60200260200101518a8481518110610aa257610aa26141f5565b6020026020010151868581518110610abc57610abc6141f5565b60200260200101516040518463ffffffff1660e01b8152600401610ae293929190614238565b602060405180830381865afa158015610aff573d6000803e3d6000fd5b505050506040513d601f19601f82011682018060405250810190610b23919061425c565b83610b2f600184614221565b81518110610b3f57610b3f6141f5565b602090810291909101015280610b5481614275565b915050610a32565b508482600081518110610b7157610b716141f5565b60200260200101511115610b975760405162461bcd60e51b81526004016104279061428c565b610bf187600081518110610bad57610bad6141f5565b6020026020010151338a600081518110610bc957610bc96141f5565b602002602001015185600081518110610be457610be46141f5565b602002602001015161266a565b60005b8851811015610d4f57600060018a51610c0d9190614221565b8214610c3c5789610c1f8360016142b5565b81518110610c2f57610c2f6141f5565b6020026020010151610c3e565b855b9050898281518110610c5257610c526141f5565b60200260200101516001600160a01b03166332fd54938a8481518110610c7a57610c7a6141f5565b60200260200101518b856001610c9091906142b5565b81518110610ca057610ca06141f5565b6020026020010151878681518110610cba57610cba6141f5565b602002602001015188876001610cd091906142b5565b81518110610ce057610ce06141f5565b6020026020010151866040518663ffffffff1660e01b8152600401610d099594939291906142cd565b600060405180830381600087803b158015610d2357600080fd5b505af1158015610d37573d6000803e3d6000fd5b50505050508080610d47906142fd565b915050610bf4565b50509695505050505050565b8042811015610d7c5760405162461bcd60e51b8152600401610427906141cc565b610daf883387876000818110610d9457610d946141f5565b9050602002016020810190610da99190614345565b8a61266a565b610dee88868680806020026020016040519081016040528093929190818152602001838360200280828437600092019190915250309250612796915050565b6040516370a0823160e01b81523060048201526000907f00000000000000000000000000000000000000000000000000000000000000006001600160a01b0316906370a0823190602401602060405180830381865afa158015610e55573d6000803e3d6000fd5b505050506040513d601f19601f82011682018060405250810190610e79919061425c565b905086811015610e9b5760405162461bcd60e51b815260040161042790614362565b610eba73eeeeeeeeeeeeeeeeeeeeeeeeeeeeeeeeeeeeeeee8583612b81565b50505050505050505050565b8042811015610ee75760405162461bcd60e51b8152600401610427906141cc565b34610f17818787600081610efd57610efd6141f5565b9050602002016020810190610f129190614345565b612484565b6040516370a0823160e01b81526001600160a01b038581166004830152600091908a16906370a0823190602401602060405180830381865afa158015610f61573d6000803e3d6000fd5b505050506040513d601f19601f82011682018060405250810190610f85919061425c565b9050610fe67f00000000000000000000000000000000000000000000000000000000000000008888808060200260200160405190810160405280939291908181526020018383602002808284376000920191909152508a9250612796915050565b6040516370a0823160e01b81526001600160a01b038681166004830152899183918c16906370a0823190602401602060405180830381865afa158015611030573d6000803e3d6000fd5b505050506040513d601f19601f82011682018060405250810190611054919061425c565b61105e9190614221565b101561107c5760405162461bcd60e51b815260040161042790614362565b505050505050505050565b600081428110156110aa5760405162461bcd60e51b8152600401610427906141cc565b6110b48685612c3d565b5060005b875181101561139e5760008882815181106110d5576110d56141f5565b602002602001015151600114156111475760008983815181106110fa576110fa6141f5565b6020026020010151600081518110611114576111146141f5565b6020026020010151905061113f81602001518260400151836000015184606001518560800151612cdb565b91505061137e565b6000808a848151811061115c5761115c6141f5565b6020026020010151600181518110611176576111766141f5565b60200260200101519050600060016001600160401b0381111561119b5761119b613abb565b6040519080825280602002602001820160405280156111c4578160200160208202803683370190505b5090508160000151816000815181106111df576111df6141f5565b60200260200101906001600160a01b031690816001600160a01b03168152505060007f00000000000000000000000000000000000000000000000000000000000000006001600160a01b03166367f84adc7f0000000000000000000000000000000000000000000000000000000000000000856020015186604001518760600151876040518663ffffffff1660e01b81526004016112819594939291906143a4565b600060405180830381865afa15801561129e573d6000803e3d6000fd5b505050506040513d6000823e601f3d908101601f191682016040526112c69190810190614417565b9050806000815181106112db576112db6141f5565b6020026020010151935082608001518411156113095760405162461bcd60e51b8152600401610427906144a7565b505060008b858151811061131f5761131f6141f5565b6020026020010151600081518110611339576113396141f5565b60200260200101519050611360816020015182604001518360000151868560800151612cdb565b935061137a82602001518360000151858560600151612e3f565b5050505b61138881856142b5565b9350508080611396906142fd565b9150506110b8565b50838211156113de5760405162461bcd60e51b815260206004820152600c60248201526b22a9292fa624a6a4aa2fa4a760a11b6044820152606401610427565b6113f185336113ec88612fee565b612b81565b5061140086336113ec89612fee565b505095945050505050565b6060814281101561142e5760405162461bcd60e51b8152600401610427906141cc565b61148e897f00000000000000000000000000000000000000000000000000000000000000008a8a8a8a808060200260200160405190810160405280939291908181526020018383602002808284376000920191909152506130be92505050565b91506114d08933888860008181106114a8576114a86141f5565b90506020020160208101906114bd9190614345565b85600081518110610be457610be46141f5565b61151089838888808060200260200160405190810160405280939291908181526020018383602002808284376000920191909152503092506131cb915050565b61155573eeeeeeeeeeeeeeeeeeeeeeeeeeeeeeeeeeeeeeee8584600186516115389190614221565b81518110611548576115486141f5565b6020026020010151612b81565b5050979650505050505050565b80428110156115835760405162461bcd60e51b8152600401610427906141cc565b61159b893387876000818110610d9457610d946141f5565b6040516370a0823160e01b81526001600160a01b038481166004830152600091908a16906370a0823190602401602060405180830381865afa1580156115e5573d6000803e3d6000fd5b505050506040513d601f19601f82011682018060405250810190611609919061425c565b905061164a8a878780806020026020016040519081016040528093929190818152602001838360200280828437600092019190915250899250612796915050565b6040516370a0823160e01b81526001600160a01b038581166004830152889183918c16906370a0823190602401602060405180830381865afa158015611694573d6000803e3d6000fd5b505050506040513d601f19601f820116820180604052508101906116b8919061425c565b6116c29190614221565b1015610eba5760405162461bcd60e51b815260040161042790614362565b606081428110156117035760405162461bcd60e51b8152600401610427906141cc565b86516001600160401b0381111561171c5761171c613abb565b604051908082528060200260200182016040528015611745578160200160208202803683370190505b509150858289518151811061175c5761175c6141f5565b6020026020010181815250506000600183516117789190614221565b90505b80156118a5578861178d600183614221565b8151811061179d5761179d6141f5565b60200260200101516001600160a01b031663cc56fd43896001846117c19190614221565b815181106117d1576117d16141f5565b60200260200101518a84815181106117eb576117eb6141f5565b6020026020010151868581518110611805576118056141f5565b60200260200101516040518463ffffffff1660e01b815260040161182b93929190614238565b602060405180830381865afa158015611848573d6000803e3d6000fd5b505050506040513d601f19601f8201168201806040525081019061186c919061425c565b83611878600184614221565b81518110611888576118886141f5565b60209081029190910101528061189d81614275565b91505061177b565b5084826000815181106118ba576118ba6141f5565b602002602001015111156118e05760405162461bcd60e51b81526004016104279061428c565b6118f687600081518110610bad57610bad6141f5565b60005b8851811015611a5457600060018a516119129190614221565b821461194157896119248360016142b5565b81518110611934576119346141f5565b6020026020010151611943565b305b9050898281518110611957576119576141f5565b60200260200101516001600160a01b03166332fd54938a848151811061197f5761197f6141f5565b60200260200101518b85600161199591906142b5565b815181106119a5576119a56141f5565b60200260200101518786815181106119bf576119bf6141f5565b6020026020010151888760016119d591906142b5565b815181106119e5576119e56141f5565b6020026020010151866040518663ffffffff1660e01b8152600401611a0e9594939291906142cd565b600060405180830381600087803b158015611a2857600080fd5b505af1158015611a3c573d6000803e3d6000fd5b50505050508080611a4c906142fd565b9150506118f9565b50610d4f73eeeeeeeeeeeeeeeeeeeeeeeeeeeeeeeeeeeeeeee8588612b81565b60608142811015611a975760405162461bcd60e51b8152600401610427906141cc565b611af77f00000000000000000000000000000000000000000000000000000000000000008989348a8a8080602002602001604051908101604052809392919081815260200183836020028082843760009201919091525061341192505050565b9150611b2a82600081518110611b0f57611b0f6141f5565b602002602001015187876000818110610efd57610efd6141f5565b611b8a7f0000000000000000000000000000000000000000000000000000000000000000838888808060200260200160405190810160405280939291908181526020018383602002808284376000920191909152508a92506131cb915050565b81600081518110611b9d57611b9d6141f5565b6020026020010151341115611bc357611bc333836000815181106107e3576107e36141f5565b509695505050505050565b60008142811015611bf15760405162461bcd60e51b8152600401610427906141cc565b859150611c3487600081518110611c0a57611c0a6141f5565b6020026020010151338a600081518110611c2657611c266141f5565b60200260200101518961266a565b60005b8851811015611d6857600060018a51611c509190614221565b8214611c7f5789611c628360016142b5565b81518110611c7257611c726141f5565b6020026020010151611c81565b855b9050898281518110611c9557611c956141f5565b60200260200101516001600160a01b0316634ac00e038a8481518110611cbd57611cbd6141f5565b60200260200101518b856001611cd391906142b5565b81518110611ce357611ce36141f5565b6020026020010151876000866040518663ffffffff1660e01b8152600401611d0f9594939291906142cd565b6020604051808303816000875af1158015611d2e573d6000803e3d6000fd5b505050506040513d601f19601f82011682018060405250810190611d52919061425c565b9350508080611d60906142fd565b915050611c37565b5081851115611bc35760405162461bcd60e51b815260040161042790614318565b60608142811015611dac5760405162461bcd60e51b8152600401610427906141cc565b611db989898989896130be565b9150611dd3893387600081518110610bc957610bc96141f5565b611ddf898387876131cb565b50979650505050505050565b60008142811015611e0e5760405162461bcd60e51b8152600401610427906141cc565b611e188786612c3d565b506000611e2487613509565b611e93576040516370a0823160e01b81523360048201526001600160a01b038816906370a0823190602401602060405180830381865afa158015611e6c573d6000803e3d6000fd5b505050506040513d601f19601f82011682018060405250810190611e90919061425c565b90505b60005b8951811015611f64576000805b8b8381518110611eb557611eb56141f5565b602002602001015151811015611f445760008c8481518110611ed957611ed96141f5565b60200260200101518281518110611ef257611ef26141f5565b602002602001015190506000821115611f0d57606081018390525b611f2e8160200151826040015183600001518460600151856080015161352b565b9250508080611f3c906142fd565b915050611ea3565b50611f4f85826142b5565b50819050611f5c816142fd565b915050611e96565b50611f70873385612b81565b50611f7f88336113ec8b612fee565b50611f8987613509565b15611fd35784831015611fce5760405162461bcd60e51b815260206004820152600d60248201526c11549497d31253525517d3d555609a1b6044820152606401610427565b610d4f565b6040516370a0823160e01b8152336004820152859082906001600160a01b038a16906370a0823190602401602060405180830381865afa15801561201b573d6000803e3d6000fd5b505050506040513d601f19601f8201168201806040525081019061203f919061425c565b6120499190614221565b1015610d4f5760405162461bcd60e51b81526020600482015260126024820152710f1b5a5b951bdd185b105b5bdd5b9d13dd5d60721b6044820152606401610427565b606081428110156120af5760405162461bcd60e51b8152600401610427906141cc565b6120ef8a8a8a8a8a8a8080602002602001604051908101604052809392919081815260200183836020028082843760009201919091525061341192505050565b91506121098a33888860008181106114a8576114a86141f5565b6121498a838888808060200260200160405190810160405280939291908181526020018383602002808284376000920191909152508a92506131cb915050565b5098975050505050505050565b600081428110156121795760405162461bcd60e51b8152600401610427906141cc565b85915061219287600081518110611c0a57611c0a6141f5565b60005b88518110156122c657600060018a516121ae9190614221565b82146121dd57896121c08360016142b5565b815181106121d0576121d06141f5565b60200260200101516121df565b305b90508982815181106121f3576121f36141f5565b60200260200101516001600160a01b0316634ac00e038a848151811061221b5761221b6141f5565b60200260200101518b85600161223191906142b5565b81518110612241576122416141f5565b6020026020010151876000866040518663ffffffff1660e01b815260040161226d9594939291906142cd565b6020604051808303816000875af115801561228c573d6000803e3d6000fd5b505050506040513d601f19601f820116820180604052508101906122b0919061425c565b93505080806122be906142fd565b915050612195565b50818511156122e75760405162461bcd60e51b815260040161042790614318565b610d4f73eeeeeeeeeeeeeeeeeeeeeeeeeeeeeeeeeeeeeeee8584612b81565b606081428110156123295760405162461bcd60e51b8152600401610427906141cc565b61148e897f00000000000000000000000000000000000000000000000000000000000000008a8a8a8a8080602002602001604051908101604052809392919081815260200183836020028082843760009201919091525061341192505050565b606081428110156123ac5760405162461bcd60e51b8152600401610427906141cc565b61240c7f000000000000000000000000000000000000000000000000000000000000000089348a8a8a808060200260200160405190810160405280939291908181526020018383602002808284376000920191909152506130be92505050565b915061242482600081518110611b0f57611b0f6141f5565b611bc37f0000000000000000000000000000000000000000000000000000000000000000838888808060200260200160405190810160405280939291908181526020018383602002808284376000920191909152508a92506131cb915050565b7f00000000000000000000000000000000000000000000000000000000000000006001600160a01b031663d0e30db0836040518263ffffffff1660e01b81526004016000604051808303818588803b1580156124df57600080fd5b505af11580156124f3573d6000803e3d6000fd5b505060405163a9059cbb60e01b81526001600160a01b038581166004830152602482018790527f000000000000000000000000000000000000000000000000000000000000000016935063a9059cbb925060440190506020604051808303816000875af1158015612568573d6000803e3d6000fd5b505050506040513d601f19601f8201168201806040525081019061258c91906144de565b61259857612598613aa5565b5050565b604080516000808252602082019092526001600160a01b0384169083906040516125c69190614530565b60006040518083038185875af1925050503d8060008114612603576040519150601f19603f3d011682016040523d82523d6000602084013e612608565b606091505b50509050806126655760405162461bcd60e51b815260206004820152602360248201527f5472616e7366657248656c7065723a204554485f5452414e534645525f46414960448201526213115160ea1b6064820152608401610427565b505050565b600080856001600160a01b03166323b872dd86868660405160240161269193929190614238565b6040516020818303038152906040529060e01b6020820180516001600160e01b0383818316178352505050506040516126ca9190614530565b6000604051808303816000865af19150503d8060008114612707576040519150601f19603f3d011682016040523d82523d6000602084013e61270c565b606091505b509150915081801561273657508051158061273657508080602001905181019061273691906144de565b61278e5760405162461bcd60e51b8152602060048201526024808201527f5472616e7366657248656c7065723a205452414e534645525f46524f4d5f46416044820152631253115160e21b6064820152608401610427565b505050505050565b8260005b8351811015612b7a5760008482815181106127b7576127b76141f5565b6020026020010151905060008060008060008060008060007f00000000000000000000000000000000000000000000000000000000000000006001600160a01b031663b33d96b07f00000000000000000000000000000000000000000000000000000000000000008c8f6040518463ffffffff1660e01b815260040161285d939291906001600160a01b0393841681529183166020830152909116604082015260600190565b60c060405180830381865afa15801561287a573d6000803e3d6000fd5b505050506040513d601f19601f8201168201806040525081019061289e9190614560565b955095509550955095509550848c6001600160a01b03166370a082318c6040518263ffffffff1660e01b81526004016128e691906001600160a01b0391909116815260200190565b602060405180830381865afa158015612903573d6000803e3d6000fd5b505050506040513d601f19601f82011682018060405250810190612927919061425c565b6129319190614221565b60405163671a11b560e01b815260048101829052602481018790526044810186905263ffffffff80861660648301528085166084830152831660a48201529099507f00000000000000000000000000000000000000000000000000000000000000006001600160a01b03169063671a11b59060c401602060405180830381865afa1580156129c3573d6000803e3d6000fd5b505050506040513d601f19601f820116820180604052508101906129e7919061425c565b9750859650505050505050600080856001600160a01b0316630dfe16816040518163ffffffff1660e01b8152600401602060405180830381865afa158015612a33573d6000803e3d6000fd5b505050506040513d601f19601f82011682018060405250810190612a5791906145c9565b6001600160a01b0316886001600160a01b031614612a7757836000612a7b565b6000845b91509150600060018b51612a8f9190614221565b8810612a9b5789612ac0565b8a612aa78960016142b5565b81518110612ab757612ab76141f5565b60200260200101515b6040805160008152602081019182905263022c0d9f60e01b9091529091506001600160a01b0388169063022c0d9f90612b0290869086908690602481016145e6565b600060405180830381600087803b158015612b1c57600080fd5b505af1158015612b30573d6000803e3d6000fd5b5050505060008051602061465a833981519152878686604051612b5593929190614636565b60405180910390a1839850505050505050508080612b72906142fd565b91505061279a565b5050505050565b600081612b9057506001612c36565b612b9984613509565b15612c2757604051632e1a7d4d60e01b8152600481018390527f00000000000000000000000000000000000000000000000000000000000000006001600160a01b031690632e1a7d4d90602401600060405180830381600087803b158015612c0057600080fd5b505af1158015612c14573d6000803e3d6000fd5b50505050612c22838361259c565b612c32565b612c32848484613991565b5060015b9392505050565b6000612c4883613509565b15612cc6577f00000000000000000000000000000000000000000000000000000000000000006001600160a01b031663d0e30db0346040518263ffffffff1660e01b81526004016000604051808303818588803b158015612ca857600080fd5b505af1158015612cbc573d6000803e3d6000fd5b5050505050612cd2565b612cd28333308561266a565b50600192915050565b604080516001808252818301909252600091829190602080830190803683370190505090508481600081518110612d1457612d146141f5565b6001600160a01b0392831660209182029290920101526040516319fe12b760e21b81526000917f000000000000000000000000000000000000000000000000000000000000000016906367f84adc90612d99907f0000000000000000000000000000000000000000000000000000000000000000908c908c908b9089906004016143a4565b600060405180830381865afa158015612db6573d6000803e3d6000fd5b505050506040513d6000823e601f3d908101601f19168201604052612dde9190810190614417565b905080600081518110612df357612df36141f5565b6020026020010151925083831115612e1d5760405162461bcd60e51b8152600401610427906144a7565b61140088878584600181518110612e3657612e366141f5565b60200260200101515b612e4a848484613991565b60008390506000816001600160a01b0316630dfe16816040518163ffffffff1660e01b8152600401602060405180830381865afa158015612e8f573d6000803e3d6000fd5b505050506040513d601f19601f82011682018060405250810190612eb391906145c9565b90506000806000836001600160a01b0316896001600160a01b031614612edc5785600085612f41565b600086866001600160a01b031663d21220a76040518163ffffffff1660e01b8152600401602060405180830381865afa158015612f1d573d6000803e3d6000fd5b505050506040513d601f19601f82011682018060405250810190612f4191906145c9565b6040805160008152602081019182905263022c0d9f60e01b90915292955090935091506001600160a01b0386169063022c0d9f90612f8890869086903090602481016145e6565b600060405180830381600087803b158015612fa257600080fd5b505af1158015612fb6573d6000803e3d6000fd5b5050505060008051602061465a833981519152888783604051612fdb93929190614636565b60405180910390a1505050505050505050565b6000612ff982613509565b1561308d576040516370a0823160e01b81523060048201527f00000000000000000000000000000000000000000000000000000000000000006001600160a01b0316906370a08231906024015b602060405180830381865afa158015613063573d6000803e3d6000fd5b505050506040513d601f19601f82011682018060405250810190613087919061425c565b92915050565b6040516370a0823160e01b81523060048201526001600160a01b038316906370a0823190602401613046565b919050565b60405163119220a560e01b81526060906001600160a01b037f0000000000000000000000000000000000000000000000000000000000000000169063119220a590613135907f0000000000000000000000000000000000000000000000000000000000000000908a908a908a9089906004016143a4565b600060405180830381865afa158015613152573d6000803e3d6000fd5b505050506040513d6000823e601f3d908101601f1916820160405261317a9190810190614417565b905082816001835161318c9190614221565b8151811061319c5761319c6141f5565b602002602001015110156131c25760405162461bcd60e51b815260040161042790614362565b95945050505050565b8360005b835181101561278e5760008482815181106131ec576131ec6141f5565b602002602001015190506000816001600160a01b0316630dfe16816040518163ffffffff1660e01b8152600401602060405180830381865afa158015613236573d6000803e3d6000fd5b505050506040513d601f19601f8201168201806040525081019061325a91906145c9565b905060008761326a8560016142b5565b8151811061327a5761327a6141f5565b602002602001015190506000806000846001600160a01b0316886001600160a01b0316146132ab5783600086613310565b600084876001600160a01b031663d21220a76040518163ffffffff1660e01b8152600401602060405180830381865afa1580156132ec573d6000803e3d6000fd5b505050506040513d601f19601f8201168201806040525081019061331091906145c9565b925092509250600060018b516133269190614221565b88106133325789613357565b8a61333e8960016142b5565b8151811061334e5761334e6141f5565b60200260200101515b6040805160008152602081019182905263022c0d9f60e01b9091529091506001600160a01b0388169063022c0d9f9061339990879087908690602481016145e6565b600060405180830381600087803b1580156133b357600080fd5b505af11580156133c7573d6000803e3d6000fd5b5050505060008051602061465a8339815191528786846040516133ec93929190614636565b60405180910390a1819850505050505050508080613409906142fd565b9150506131cf565b6040516319fe12b760e21b81526060906001600160a01b037f000000000000000000000000000000000000000000000000000000000000000016906367f84adc90613488907f0000000000000000000000000000000000000000000000000000000000000000908a908a908a9089906004016143a4565b600060405180830381865afa1580156134a5573d6000803e3d6000fd5b505050506040513d6000823e601f3d908101601f191682016040526134cd9190810190614417565b905082816000815181106134e3576134e36141f5565b602002602001015111156131c25760405162461bcd60e51b8152600401610427906144a7565b6001600160a01b031673eeeeeeeeeeeeeeeeeeeeeeeeeeeeeeeeeeeeeeee1490565b6000613538868585613991565b604051630b33d96b60e41b81526001600160a01b037f00000000000000000000000000000000000000000000000000000000000000008116600483015285811660248301528781166044830152600091829182918291829182917f0000000000000000000000000000000000000000000000000000000000000000169063b33d96b09060640160c060405180830381865afa1580156135db573d6000803e3d6000fd5b505050506040513d601f19601f820116820180604052508101906135ff9190614560565b95509550955095509550506000858d6001600160a01b03166370a082318d6040518263ffffffff1660e01b815260040161364891906001600160a01b0391909116815260200190565b602060405180830381865afa158015613665573d6000803e3d6000fd5b505050506040513d601f19601f82011682018060405250810190613689919061425c565b6136939190614221565b60405163671a11b560e01b815260048101829052602481018890526044810187905263ffffffff80871660648301528086166084830152841660a48201529091507f00000000000000000000000000000000000000000000000000000000000000006001600160a01b03169063671a11b59060c401602060405180830381865afa158015613725573d6000803e3d6000fd5b505050506040513d601f19601f82011682018060405250810190613749919061425c565b6040516370a0823160e01b8152306004820152909750600096506001600160a01b038d1695506370a0823194506024019250613783915050565b602060405180830381865afa1580156137a0573d6000803e3d6000fd5b505050506040513d601f19601f820116820180604052508101906137c4919061425c565b9050600080876001600160a01b0316630dfe16816040518163ffffffff1660e01b8152600401602060405180830381865afa158015613807573d6000803e3d6000fd5b505050506040513d601f19601f8201168201806040525081019061382b91906145c9565b6001600160a01b03168a6001600160a01b03161461384b5783600061384f565b6000845b6040805160008152602081019182905263022c0d9f60e01b90915291935091506001600160a01b0389169063022c0d9f9061389390859085903090602481016145e6565b600060405180830381600087803b1580156138ad57600080fd5b505af11580156138c1573d6000803e3d6000fd5b5050505060008051602061465a83398151915288858b6040516138e693929190614636565b60405180910390a16040516370a0823160e01b815230600482015283906001600160a01b038b16906370a0823190602401602060405180830381865afa158015613934573d6000803e3d6000fd5b505050506040513d601f19601f82011682018060405250810190613958919061425c565b6139629190614221565b9450858510156139845760405162461bcd60e51b815260040161042790614362565b5050505095945050505050565b604080516001600160a01b038481166024830152604480830185905283518084039091018152606490920183526020820180516001600160e01b031663a9059cbb60e01b17905291516000928392908716916139ed9190614530565b6000604051808303816000865af19150503d8060008114613a2a576040519150601f19603f3d011682016040523d82523d6000602084013e613a2f565b606091505b5091509150818015613a59575080511580613a59575080806020019051810190613a5991906144de565b612b7a5760405162461bcd60e51b815260206004820152601f60248201527f5472616e7366657248656c7065723a205452414e534645525f4641494c4544006044820152606401610427565b634e487b7160e01b600052600160045260246000fd5b634e487b7160e01b600052604160045260246000fd5b60405160c081016001600160401b0381118282101715613af357613af3613abb565b60405290565b604051601f8201601f191681016001600160401b0381118282101715613b2157613b21613abb565b604052919050565b60006001600160401b03821115613b4257613b42613abb565b5060051b60200190565b6001600160a01b0381168114613b6157600080fd5b50565b600082601f830112613b7557600080fd5b81356020613b8a613b8583613b29565b613af9565b82815260059290921b84018101918181019086841115613ba957600080fd5b8286015b84811015611bc3578035613bc081613b4c565b8352918301918301613bad565b600080600080600060a08688031215613be557600080fd5b85356001600160401b0380821115613bfc57600080fd5b613c0889838a01613b64565b96506020880135915080821115613c1e57600080fd5b50613c2b88828901613b64565b945050604086013592506060860135613c4381613b4c565b949793965091946080013592915050565b6020808252825182820181905260009190848201906040850190845b81811015613c8c57835183529284019291840191600101613c70565b50909695505050505050565b60008060008060008060c08789031215613cb157600080fd5b86356001600160401b0380821115613cc857600080fd5b613cd48a838b01613b64565b97506020890135915080821115613cea57600080fd5b50613cf789828a01613b64565b95505060408701359350606087013592506080870135613d1681613b4c565b8092505060a087013590509295509295509295565b60008083601f840112613d3d57600080fd5b5081356001600160401b03811115613d5457600080fd5b6020830191508360208260051b8501011115613d6f57600080fd5b9250929050565b600080600080600080600060c0888a031215613d9157600080fd5b8735613d9c81613b4c565b9650602088013595506040880135945060608801356001600160401b03811115613dc557600080fd5b613dd18a828b01613d2b565b9095509350506080880135613de581613b4c565b8092505060a0880135905092959891949750929550565b60008060008060008060a08789031215613e1557600080fd5b8635613e2081613b4c565b95506020870135945060408701356001600160401b03811115613e4257600080fd5b613e4e89828a01613d2b565b9095509350506060870135613e6281613b4c565b80925050608087013590509295509295509295565b600082601f830112613e8857600080fd5b81356020613e98613b8583613b29565b82815260059290921b84018101918181019086841115613eb757600080fd5b8286015b84811015611bc35780356001600160401b03811115613eda5760008081fd5b8701603f81018913613eec5760008081fd5b848101356040613efe613b8583613b29565b82815260c0928302840182019288820191908d851115613f1e5760008081fd5b948301945b84861015613f9f5780868f031215613f3b5760008081fd5b613f43613ad1565b8635613f4e81613b4c565b8152868b0135613f5d81613b4c565b818c015286850135613f6e81613b4c565b81860152606087810135908201526080808801359082015260a0808801359082015283529485019491890191613f23565b50875250505092840192508301613ebb565b600080600080600060a08688031215613fc957600080fd5b85356001600160401b03811115613fdf57600080fd5b613feb88828901613e77565b9550506020860135613ffc81613b4c565b9350604086013561400c81613b4c565b94979396509394606081013594506080013592915050565b60008060008060008060008060e0898b03121561404057600080fd5b883561404b81613b4c565b9750602089013561405b81613b4c565b9650604089013595506060890135945060808901356001600160401b0381111561408457600080fd5b6140908b828c01613d2b565b90955093505060a08901356140a481613b4c565b8092505060c089013590509295985092959890939650565b600080600080600080600060e0888a0312156140d757600080fd5b87356140e281613b4c565b965060208801356140f281613b4c565b9550604088013594506060880135935060808801356001600160401b0381111561411b57600080fd5b6141278a828b01613b64565b93505060a088013561413881613b4c565b8092505060c0880135905092959891949750929550565b60008060008060008060c0878903121561416857600080fd5b86356001600160401b0381111561417e57600080fd5b61418a89828a01613e77565b965050602087013561419b81613b4c565b945060408701356141ab81613b4c565b959894975094956060810135955060808101359460a0909101359350915050565b6020808252600f908201526e149bdd5d195c8e8811561412549151608a1b604082015260600190565b634e487b7160e01b600052603260045260246000fd5b634e487b7160e01b600052601160045260246000fd5b6000828210156142335761423361420b565b500390565b6001600160a01b039384168152919092166020820152604081019190915260600190565b60006020828403121561426e57600080fd5b5051919050565b6000816142845761428461420b565b506000190190565b6020808252600f908201526e115610d154d4d2559157d253941555608a1b604082015260600190565b600082198211156142c8576142c861420b565b500190565b6001600160a01b039586168152938516602085015260408401929092526060830152909116608082015260a00190565b60006000198214156143115761431161420b565b5060010190565b602080825260139082015272125394d551919250d251539517d3d555141555606a1b604082015260600190565b60006020828403121561435757600080fd5b8135612c3681613b4c565b60208082526022908201527f526f757465723a20494e53554646494349454e545f4f55545055545f414d4f55604082015261139560f21b606082015260800190565b600060a0820160018060a01b038089168452602081891681860152818816604086015286606086015260a0608086015282865180855260c087019150828801945060005b818110156144065785518516835294830194918301916001016143e8565b50909b9a5050505050505050505050565b6000602080838503121561442a57600080fd5b82516001600160401b0381111561444057600080fd5b8301601f8101851361445157600080fd5b805161445f613b8582613b29565b81815260059190911b8201830190838101908783111561447e57600080fd5b928401925b8284101561449c57835182529284019290840190614483565b979650505050505050565b6020808252601e908201527f526f757465723a204558434553534956455f494e5055545f414d4f554e540000604082015260600190565b6000602082840312156144f057600080fd5b81518015158114612c3657600080fd5b60005b8381101561451b578181015183820152602001614503565b8381111561452a576000848401525b50505050565b60008251614542818460208701614500565b9190910192915050565b805163ffffffff811681146130b957600080fd5b60008060008060008060c0878903121561457957600080fd5b865161458481613b4c565b60208801516040890151919750955093506145a16060880161454c565b92506145af6080880161454c565b91506145bd60a0880161454c565b90509295509295509295565b6000602082840312156145db57600080fd5b8151612c3681613b4c565b84815283602082015260018060a01b0383166040820152608060608201526000825180608084015261461f8160a0850160208701614500565b601f01601f19169190910160a00195945050505050565b6001600160a01b039384168152602081019290925290911660408201526060019056feddac40937f35385a34f721af292e5a83fc5b840f722bff57c2fc71adba708c48a2646970667358221220a31bf67d1f65dc9c75f126750a83e2bb3b6e21a8379aae17058a7a53a453b62064736f6c634300080a0033",
  "devdoc": {
    "kind": "dev",
    "methods": {},
    "version": 1
  },
  "userdoc": {
    "kind": "user",
    "methods": {},
    "version": 1
  },
  "storageLayout": {
    "storage": [],
    "types": null
  }
}